event_id,event_date,artist_name,artist_mbid,artist_sort_name,tour_name,venue_name,venue_id,city_name,state,state_code,country_name,country_code,lat,lng,song_count,songs,setlist_url
13446d09,2025-06-20,Xiu Xiu,8b431ac6-0806-4e4a-9b6b-1734370fa890,Xiu Xiu,,Royal Canadian Legion Branch 1,7bd33250,Calgary,Alberta,AB,Canada,CA,51.050112282,-114.085285152,12,The Silver Platter; Sleep Blvd.; Blacks; It Comes Out as a Joke; Suha; Gray Death; Wig Master; T.D.F.T.W.; Sad Pony Guerrilla Girl; Common Loon; Veneficium; Get Up,https://www.setlist.fm/setlist/xiu-xiu/2025/royal-canadian-legion-branch-1-calgary-ab-canada-13446d09.html
b46795e,2025-06-19,The Mummies,0879bdd2-e5a0-4a43-9ba5-8c7c02b65080,"Mummies, The",,The Palomino,7bd78a00,Calgary,Alberta,AB,Canada,CA,51.050112282,-114.085285152,21,"Come On Up; Just One More Dance; Red Cobra #9; I'm Gonna Kill My Baby Tonight; Big Boy Pete; Mashi; I Hear You Laughing; Gwendolyn; Dog Meat; You Should Have Known Better; One by One; Food, Sickles and Girls; I Don't Like It; Uncontrollable Urge; Stronger Than Dirt; The Beast With Four Left Feet; That Girl; (You Must Fight to Live) On the Planet of the Apes; I Can't Wait; The Fly; Shut Yer Mouth",https://www.setlist.fm/setlist/the-mummies/2025/the-palomino-calgary-ab-canada-b46795e.html
b446d0e,2025-06-19,Tropical Fuck Storm,a7a3399e-2d9a-4c3b-9ada-7e861aed1cb3,Tropical Fuck Storm,Fairyland Codex,Royal Canadian Legion Branch 1,7bd33250,Calgary,Alberta,AB,Canada,CA,51.050112282,-114.085285152,10,Braindrops; Bloodsport; Goon Show; You Let My Tyres Down; Moscovium; Ann; Who's My Eugene?; Rubber Bullies; Two Afternoons; Stayin' Alive,https://www.setlist.fm/setlist/tropical-fuck-storm/2025/royal-canadian-legion-branch-1-calgary-ab-canada-b446d0e.html
7b445a3c,2025-06-19,Zola Jesus,c35bd778-efb5-424b-ba7b-dae56d01a206,Zola Jesus,,Central United Church,bd7d9b2,Calgary,Alberta,AB,Canada,CA,51.050112282,-114.085285152,0,,https://www.setlist.fm/setlist/zola-jesus/2025/central-united-church-calgary-ab-canada-7b445a3c.html
3b446024,2025-06-19,Shannon McNally,0fecf18b-9461-4927-b7d7-45df236baf98,"McNally, Shannon",,Bella Concert Hall,33d03c11,Calgary,Alberta,AB,Canada,CA,51.050112282,-114.085285152,0,,https://www.setlist.fm/setlist/shannon-mcnally/2025/bella-concert-hall-calgary-ab-canada-3b446024.html
3b444cb4,2025-06-19,The Mummies,0879bdd2-e5a0-4a43-9ba5-8c7c02b65080,"Mummies, The",,"MacEwan Hall, University of Calgary",3d4615f,Calgary,Alberta,AB,Canada,CA,51.050112282,-114.085285152,7,Just One More Dance; I Can't Wait; Gwendolyn; The Beast With Four Left Feet; Dog Meat; Come On Up; One by One,https://www.setlist.fm/setlist/the-mummies/2025/macewan-hall-university-of-calgary-calgary-ab-canada-3b444cb4.html
347e56f,2025-06-19,Mike Campbell & The Dirty Knobs,ef94d509-9448-4ed0-9912-93158f51aa9e,Mike Campbell & The Dirty Knobs,,Bella Concert Hall,33d03c11,Calgary,Alberta,AB,Canada,CA,51.050112282,-114.085285152,20,Wreckless Abandon; External Combustion; Dare to Dream; Can't Stop the Sun; Fuck That Guy; Even the Losers; Hands Are Tied; Love Is A Long Road; Lonely Sea; I Still Love You; Dirty Job; Hell or High Water; Fault Lines; In This Lifetime; Don't Wait Up; Shake These Blues; You Got Lucky; Fooled Again (I Don't Like It); Everybody; Sundown,https://www.setlist.fm/setlist/mike-campbell-and-the-dirty-knobs/2025/bella-concert-hall-calgary-ab-canada-347e56f.html
34451e3,2025-06-19,Motherhood,10f139ff-02c8-4eaa-afa2-d59ad59e6fa6,Motherhood,,Royal Canadian Legion Branch 1,7bd33250,Calgary,Alberta,AB,Canada,CA,51.050112282,-114.085285152,11,"Flood II; Shepherd; Tabletop; Grow High; Moat; Ripped Sheet; Tin Can Beach, Pt. 1; Tin Can Beach, Pt. 2; Dry Heave; Bok Globule; Sunk",https://www.setlist.fm/setlist/motherhood/2025/royal-canadian-legion-branch-1-calgary-ab-canada-34451e3.html
1b466180,2025-06-19,Glockabelle,fcb68790-5c5b-4b79-8dfc-6382abcdd779,Glockabelle,,The Palomino,7bd78a00,Calgary,Alberta,AB,Canada,CA,51.050112282,-114.085285152,0,,https://www.setlist.fm/setlist/glockabelle/2025/the-palomino-calgary-ab-canada-1b466180.html
b44cdfe,2025-06-18,Stucco,ad5641c1-0293-4dad-8209-0688fa8e9a3a,Stucco,,The Palomino,7bd78a00,Calgary,Alberta,AB,Canada,CA,51.050112282,-114.085285152,0,,https://www.setlist.fm/setlist/stucco/2025/the-palomino-calgary-ab-canada-b44cdfe.html
7b446a20,2025-06-18,Crachat,301db803-ccec-493d-9f97-86a27921edd7,Crachat,,Dicken's Pub,3bd79cd8,Calgary,Alberta,AB,Canada,CA,51.050112282,-114.085285152,0,,https://www.setlist.fm/setlist/crachat/2025/dickens-pub-calgary-ab-canada-7b446a20.html
7b445ac4,2025-06-18,Bridge City Sinners,f128dfa0-026c-442a-9bc6-801ee43759e6,Bridge City Sinners,,Modern Love,2bd1f022,Calgary,Alberta,AB,Canada,CA,51.050112282,-114.085285152,18,"Through and Through; Crazy; The Damned; Run from the Sun; Song of the Siren; Midnight to Vice; Pick Your Poison; The Legend of Olog‐hai, Pt. 1; The Legend of Olog‐hai, Pt. 2; The Fear; Unholy Hymns; Spears and Blades; The Devil’s Swing; Heavy; Devil Like You; Doubt; Break the Chain; Kreacher",https://www.setlist.fm/setlist/bridge-city-sinners/2025/modern-love-calgary-ab-canada-7b445ac4.html
63446a23,2025-06-18,Lemon Boy,557fc746-9c2a-4604-8437-4c2065cc0f19,Lemon Boy,,Dicken's Pub,3bd79cd8,Calgary,Alberta,AB,Canada,CA,51.050112282,-114.085285152,0,,https://www.setlist.fm/setlist/lemon-boy/2025/dickens-pub-calgary-ab-canada-63446a23.html
4b4633e2,2025-06-18,Peelander‐Z,6ced2b8e-7024-4ccf-b49d-555fe905bd78,Peelander‐Z,Spring Tour 2025,Dicken's Pub,3bd79cd8,Calgary,Alberta,AB,Canada,CA,51.050112282,-114.085285152,9,P-Burger; Mad Tiger; Taco Taco Tacos; Armadillo; See You Gator; So Many Mike; Ninja-High Schooool; S.T.E.A.K; Girls Just Want to Have Fun,https://www.setlist.fm/setlist/peelanderz/2025/dickens-pub-calgary-ab-canada-4b4633e2.html
3b456498,2025-06-18,Eraser,2828dd28-8d89-414c-bcd2-31c584a1a347,Eraser,,The Palomino,7bd78a00,Calgary,Alberta,AB,Canada,CA,51.050112282,-114.085285152,0,,https://www.setlist.fm/setlist/eraser/2025/the-palomino-calgary-ab-canada-3b456498.html
3b445820,2025-06-18,Clea Anaïs,270f4d56-506d-4ead-980f-c1127679ef5e,"Anaïs, Clea",,Royal Canadian Legion Branch 1,7bd33250,Calgary,Alberta,AB,Canada,CA,51.050112282,-114.085285152,0,,https://www.setlist.fm/setlist/clea-anais/2025/royal-canadian-legion-branch-1-calgary-ab-canada-3b445820.html
3b44581c,2025-06-18,Aladean Kheroufi,fdfcc7d7-3588-4bb4-b7d1-e9673d5fe6ac,"Kheroufi, Aladean",,Royal Canadian Legion Branch 1,7bd33250,Calgary,Alberta,AB,Canada,CA,51.050112282,-114.085285152,0,,https://www.setlist.fm/setlist/aladean-kheroufi/2025/royal-canadian-legion-branch-1-calgary-ab-canada-3b44581c.html
344cdfb,2025-06-18,CAT PISS,367ddece-ed06-4f9e-acd6-c3f1aea0969b,CAT PISS,,The Palomino,7bd78a00,Calgary,Alberta,AB,Canada,CA,51.050112282,-114.085285152,0,,https://www.setlist.fm/setlist/cat-piss/2025/the-palomino-calgary-ab-canada-344cdfb.html
3441983,2025-06-18,Concrete Vehicles,459085bb-c5db-4abe-87da-1915c8b1d4c6,Concrete Vehicles,,Studio 666 CJSW,1bd7d1d8,Calgary,Alberta,AB,Canada,CA,51.050112282,-114.085285152,4,Dissolution Use; Weird New Vocation; Concrete Vehicles; Now in a Vacuum,https://www.setlist.fm/setlist/concrete-vehicles/2025/studio-666-cjsw-calgary-ab-canada-3441983.html
3344581d,2025-06-18,Babe Corner,ba4fee2a-d414-4786-902a-44ad9271da5a,Babe Corner,,Royal Canadian Legion Branch 1,7bd33250,Calgary,Alberta,AB,Canada,CA,51.050112282,-114.085285152,0,,https://www.setlist.fm/setlist/babe-corner/2025/royal-canadian-legion-branch-1-calgary-ab-canada-3344581d.html
2b44582e,2025-06-18,TOPS,2491939e-b112-4afd-8563-c1ab1ea27e1c,TOPS,,Royal Canadian Legion Branch 1,7bd33250,Calgary,Alberta,AB,Canada,CA,51.050112282,-114.085285152,0,,https://www.setlist.fm/setlist/tops/2025/royal-canadian-legion-branch-1-calgary-ab-canada-2b44582e.html
2b44581a,2025-06-18,The Painters,2cbdda67-0da7-4ff3-bb0c-1f038d057d47,"Painters, The",,Royal Canadian Legion Branch 1,7bd33250,Calgary,Alberta,AB,Canada,CA,51.050112282,-114.085285152,0,,https://www.setlist.fm/setlist/the-painters/2025/royal-canadian-legion-branch-1-calgary-ab-canada-2b44581a.html
1b44cdfc,2025-06-18,Liiek,96988261-e59d-4f7d-a1b6-692d379d8482,Liiek,,The Palomino,7bd78a00,Calgary,Alberta,AB,Canada,CA,51.050112282,-114.085285152,0,,https://www.setlist.fm/setlist/liiek/2025/the-palomino-calgary-ab-canada-1b44cdfc.html
1b44cdf8,2025-06-18,Fulfillment,e5a0a654-20e8-44a6-91c4-197337f692b3,Fulfillment,,The Palomino,7bd78a00,Calgary,Alberta,AB,Canada,CA,51.050112282,-114.085285152,0,,https://www.setlist.fm/setlist/fulfillment/2025/the-palomino-calgary-ab-canada-1b44cdf8.html
1344cd05,2025-06-18,Concrete Vehicles,459085bb-c5db-4abe-87da-1915c8b1d4c6,Concrete Vehicles,,The Palomino,7bd78a00,Calgary,Alberta,AB,Canada,CA,51.050112282,-114.085285152,4,Now in a Vacuum; Concrete Vehicles; Weird New Vocation; Dissolution Use,https://www.setlist.fm/setlist/concrete-vehicles/2025/the-palomino-calgary-ab-canada-1344cd05.html
b44198a,2025-06-17,Concrete Vehicles,459085bb-c5db-4abe-87da-1915c8b1d4c6,Concrete Vehicles,,Commonwealth Bar & Stage,2bd484ea,Calgary,Alberta,AB,Canada,CA,51.050112282,-114.085285152,1,Dissolution Use,https://www.setlist.fm/setlist/concrete-vehicles/2025/commonwealth-bar-and-stage-calgary-ab-canada-b44198a.html
7b4646c4,2025-06-15,H1-KEY,6d9dc445-463c-4c98-a554-429afe985f2b,H1-KEY,,Southern Alberta Jubilee Auditorium,63d62ea7,Calgary,Alberta,AB,Canada,CA,51.050112282,-114.085285152,0,,https://www.setlist.fm/setlist/h1-key/2025/southern-alberta-jubilee-auditorium-calgary-ab-canada-7b4646c4.html
6b440ea2,2025-06-15,City and Colour,b1003bf1-25b8-41f4-a783-36060f987913,City and Colour,,Spruce Meadows,6bde8a82,Calgary,Alberta,AB,Canada,CA,51.050112282,-114.085285152,17,"Fragile Bird; Two Coins; Save Your Scissors; Difficult Love; Harder Than Stone; In the Water I Am Beautiful; Underground; Things We Choose to Care About; Day Old Hate; Little Hell; Silver and Gold; Hello, I'm in Delaware; Lover Come Back; Northern Wind; Bobcaygeon; The Girl; Sleeping Sickness",https://www.setlist.fm/setlist/city-and-colour/2025/spruce-meadows-calgary-ab-canada-6b440ea2.html
434417d7,2025-06-14,City and Colour,b1003bf1-25b8-41f4-a783-36060f987913,City and Colour,,Spruce Meadows,6bde8a82,Calgary,Alberta,AB,Canada,CA,51.050112282,-114.085285152,17,"Forgive Me / Young Lovers; Like Knives; What Makes a Man?; Twilight; Underground; Things We Choose to Care About; Casey's Song; Waiting; Blood; Constant Knot; Hello, I'm in Delaware; Sometimes (I Wish); Body in a Box; The Girl; Comin' Home; Sleeping Sickness; Rain",https://www.setlist.fm/setlist/city-and-colour/2025/spruce-meadows-calgary-ab-canada-434417d7.html
33479055,2025-06-14,Trauma Shot,27949d47-8147-4ad6-9347-e7effd201bb3,Trauma Shot,Where Weakness Dies,St Andrew Heights,13de2d11,Calgary,Alberta,AB,Canada,CA,51.050112282,-114.085285152,8,One In The Chamber; Taken By Flame; Curbstomped; Hope Is A Trap; Vices; Self-Inflicted Mental Terror; Survival of the Richest; Where Weakness Dies,https://www.setlist.fm/setlist/trauma-shot/2025/st-andrew-heights-calgary-ab-canada-33479055.html
334474c1,2025-06-14,CELIN,aabd97be-8da2-4594-9800-e7d5fdda9653,"Simard, Celine",,Best of Kin Social,1bde3d84,Calgary,Alberta,AB,Canada,CA,51.050112282,-114.085285152,1,Red Eye,https://www.setlist.fm/setlist/celin/2025/best-of-kin-social-calgary-ab-canada-334474c1.html
634422d3,2025-06-13,Corey Kent,c59c787f-75cf-405b-b4f0-8445f730bcbe,"Kent, Corey",Black Bandana,Ranchman's Cookhouse and Dancehall,63d22e57,Calgary,Alberta,AB,Canada,CA,51.050112282,-114.085285152,18,Girl I Never Met; Ain’t My Day; Highways; Tumbleweed; This Heart; Poster Child; Come Together; How You Know You Made It; Damn Good Country Song; Gold; Rust; Champagne Supernova; Never Ready; Wild as Her; Something’s Gonna Kill Me; Much Too Young (to Feel This Damn Old); Bixby; It's a Great Day to Be Alive,https://www.setlist.fm/setlist/corey-kent/2025/ranchmans-cookhouse-and-dancehall-calgary-ab-canada-634422d3.html
4b401742,2025-06-13,Inferi,7408e3bd-87a9-41f5-be26-05c3777fa97b,Inferi,Rags To Riffage Part II,Dicken's Pub,3bd79cd8,Calgary,Alberta,AB,Canada,CA,51.050112282,-114.085285152,2,No Gods but Our Flesh; Behold the Bearer of Light,https://www.setlist.fm/setlist/inferi/2025/dickens-pub-calgary-ab-canada-4b401742.html
4b401736,2025-06-13,Greylotus,c0c806c2-049a-4bad-a202-927c0f5c5f59,Greylotus,,Dicken's Pub,3bd79cd8,Calgary,Alberta,AB,Canada,CA,51.050112282,-114.085285152,0,,https://www.setlist.fm/setlist/greylotus/2025/dickens-pub-calgary-ab-canada-4b401736.html
4b40171e,2025-06-13,Demon King,26c0d316-80e6-4c17-84e8-1fff55f48075,Demon King,,Dicken's Pub,3bd79cd8,Calgary,Alberta,AB,Canada,CA,51.050112282,-114.085285152,0,,https://www.setlist.fm/setlist/demon-king/2025/dickens-pub-calgary-ab-canada-4b40171e.html
4b40171a,2025-06-13,Vitriol,b364254e-66c7-4a4b-8f00-8c1a3ed66b3b,Vitriol,,Dicken's Pub,3bd79cd8,Calgary,Alberta,AB,Canada,CA,51.050112282,-114.085285152,0,,https://www.setlist.fm/setlist/vitriol/2025/dickens-pub-calgary-ab-canada-4b40171a.html
3b5b608c,2025-06-09,Wage War,653f3412-63c8-4bd8-bce1-a33aaf93a837,Wage War,Awaken The Fallen Tour,Scotiabank Saddledome,13d7a181,Calgary,Alberta,AB,Canada,CA,51.050112282,-114.085285152,9,NAIL5; Godspeed; Low; Circle the Drain; BLUR; TOMBSTONE; HAPPY HUNTING; MAGNETIC; Manic,https://www.setlist.fm/setlist/wage-war/2025/scotiabank-saddledome-calgary-ab-canada-3b5b608c.html
335b6089,2025-06-09,Volbeat,4753fcb7-9270-493a-974d-8daca4e49125,Volbeat,Greatest of All Tours Worldwide,Scotiabank Saddledome,13d7a181,Calgary,Alberta,AB,Canada,CA,51.050112282,-114.085285152,15,A Warrior's Call / I Only Want to Be With You; Lola Montez; Devils Are Awake; The Devil's Bleeding Crown; Sad Man's Tongue; Demonic Depression; Fallen; Shotgun Blues; In the Barn of the Goat Giving Birth to Satan's Spawn in a Dying World of Doom; By a Monster's Hand; Black Rose; Seal the Deal; Last Day Under the Sun; For Evigt; Still Counting,https://www.setlist.fm/setlist/volbeat/2025/scotiabank-saddledome-calgary-ab-canada-335b6089.html
2b5b608e,2025-06-09,Three Days Grace,fabb37f8-eb2a-4cc1-a72a-b56935bbb72d,Three Days Grace,,Scotiabank Saddledome,13d7a181,Calgary,Alberta,AB,Canada,CA,51.050112282,-114.085285152,17,It's All Over; Animal I Have Become; So Called Life; Break; Home; The Mountain; Pain; Time of Dying; Apologies; I Hate Everything About You; I Am Machine; Mayday; Just Like You; The Good Life; Painkiller; Never Too Late; Riot,https://www.setlist.fm/setlist/three-days-grace/2025/scotiabank-saddledome-calgary-ab-canada-2b5b608e.html
b4875a6,2025-06-06,Alli Walker,f7509ce3-d481-4c4e-8c8d-dca42007205d,"Walker, Alli",2025 Tour,,6bd796c6,Calgary,Alberta,AB,Canada,CA,51.050112282,-114.085285152,0,,https://www.setlist.fm/setlist/alli-walker/2025/unknown-venue-calgary-ab-canada-b4875a6.html
6b442ab6,2025-06-06,Bywater Call,89dbbb37-7991-487b-bcf3-ebe270a70d24,Bywater Call,,Mikey's Juke Joint & Eatery,63d5c65b,Calgary,Alberta,AB,Canada,CA,51.050112282,-114.085285152,0,,https://www.setlist.fm/setlist/bywater-call/2025/mikeys-juke-joint-and-eatery-calgary-ab-canada-6b442ab6.html
1358594d,2025-06-06,Miguel Mateos,3557099c-890f-4417-8d97-681f1f2ae3b4,"Mateos, Miguel",,Deerfoot Inn & Casino,5bd67734,Calgary,Alberta,AB,Canada,CA,51.050112282,-114.085285152,17,"Tirá para arriba; Llámame, si me necesitas; Perdiendo el control; Si tuviéramos alas; Desnúdame; Malos pensamientos; No me dejes caer; Y, sin pensar; Donde arde la ciudad; Mi sombra en la pared; Hagamos el amor; Atado a un sentimiento; Everybody Wants to Rule the World; Es tan fácil romper un corazón; Lola; Obsesión; Cuando seas grande",https://www.setlist.fm/setlist/miguel-mateos/2025/deerfoot-inn-and-casino-calgary-ab-canada-1358594d.html
7376ae2d,2025-06-04,Still Depths,3fe1c8bd-31e1-427d-a355-0baf51e6c296,Still Depths,,Studio 666 CJSW,1bd7d1d8,Calgary,Alberta,AB,Canada,CA,51.050112282,-114.085285152,4,American Alcoholic Author; In Love With My Dog; Boy Fight; Animate Feelings,https://www.setlist.fm/setlist/still-depths/2025/studio-666-cjsw-calgary-ab-canada-7376ae2d.html
73484275,2025-06-04,Still Depths,3fe1c8bd-31e1-427d-a355-0baf51e6c296,Still Depths,,Commonwealth Bar & Stage,2bd484ea,Calgary,Alberta,AB,Canada,CA,51.050112282,-114.085285152,1,Top 5 Reasons I'm the Shit,https://www.setlist.fm/setlist/still-depths/2025/commonwealth-bar-and-stage-calgary-ab-canada-73484275.html
5b4493d8,2025-06-04,The Wallflowers,d9c90718-d54d-4ccf-a92e-37a5415ce299,"Wallflowers, The",,Grey Eagle Resort & Casino,23d44c13,Calgary,Alberta,AB,Canada,CA,51.050112282,-114.085285152,9,Sleepwalker; Move the River; 6th Avenue Heartache; Roots and Wings; I've Been Delivered; God Don't Make Lonely Girls; One Headlight; The Waiting; The Difference,https://www.setlist.fm/setlist/the-wallflowers/2025/grey-eagle-resort-and-casino-calgary-ab-canada-5b4493d8.html
4b449f76,2025-06-04,B.A. Johnston,23a2b922-00b7-4310-afbe-8f5f9bfc49e9,"Johnston, B.A.",,The Ship and Anchor,63d7b60b,Calgary,Alberta,AB,Canada,CA,51.050112282,-114.085285152,0,,https://www.setlist.fm/setlist/ba-johnston/2025/the-ship-and-anchor-calgary-ab-canada-4b449f76.html
33474cd9,2025-06-04,ZZ Top,a81259a0-a2f5-464b-866e-71220f2739f1,ZZ Top,The Elevation Tour,Grey Eagle Resort & Casino,23d44c13,Calgary,Alberta,AB,Canada,CA,51.050112282,-114.085285152,16,"Got Me Under Pressure; I Thank You; Waitin' for the Bus; Jesus Just Left Chicago; Gimme All Your Lovin'; Pearl Necklace; I'm Bad, I'm Nationwide; I Gotsta Get Paid; My Head's in Mississippi; Sixteen Tons; Just Got Paid; Sharp Dressed Man; Legs; Brown Sugar; Tube Snake Boogie; La Grange",https://www.setlist.fm/setlist/zz-top/2025/grey-eagle-resort-and-casino-calgary-ab-canada-33474cd9.html
235a485b,2025-06-04,Preoccupations,9ee1988d-66ec-4c29-98d6-876a45e0fcbd,Preoccupations,ILL AT EASE,Commonwealth Bar & Stage,2bd484ea,Calgary,Alberta,AB,Canada,CA,51.050112282,-114.085285152,15,Unconscious Melody; Silhouettes; Instrumental Jam; Ill at Ease; Ricochet; Continental Shelf; March of Progress; Focus; Bastards; Disarray; Andromeda; Stimulation; Memory; Bunker Buster; Krem2,https://www.setlist.fm/setlist/preoccupations/2025/commonwealth-bar-and-stage-calgary-ab-canada-235a485b.html
b4759b6,2025-06-01,Séan McCann,3172900e-7f54-48a6-9206-67482d8d9b54,"McCann, Séan",Great Big Canadian Road Trip,Parkdale United Church,1bde2518,Calgary,Alberta,AB,Canada,CA,51.050112282,-114.085285152,16,"Safe Upon the Shore; Donkey Riding; When I'm Up I Can't Get Down; 10,000 Miles Away; Free Man; Red Wine and Whiskey; Stronger; Consequence Free; Excursion Around the Bay; Love; Good People; The Night Paddy Murphy Died; General Taylor; Ordinary Day; Mary Mack; You Know I Love You",https://www.setlist.fm/setlist/sean-mccann/2025/parkdale-united-church-calgary-ab-canada-b4759b6.html
73475a11,2025-06-01,The Blue Stones,bff6b03f-c91b-4af9-a7f3-3dad6bc3165e,"Blue Stones, The",METRO,The Palace Theatre,6bd2e222,Calgary,Alberta,AB,Canada,CA,51.050112282,-114.085285152,0,,https://www.setlist.fm/setlist/the-blue-stones/2025/the-palace-theatre-calgary-ab-canada-73475a11.html
635ad66b,2025-05-25,Ziggy Alberts,413ca455-cdc1-4188-8cac-70f7e6c72394,"Alberts, Ziggy",New Love,"MacEwan Hall, University of Calgary",3d4615f,Calgary,Alberta,AB,Canada,CA,51.050112282,-114.085285152,0,,https://www.setlist.fm/setlist/ziggy-alberts/2025/macewan-hall-university-of-calgary-calgary-ab-canada-635ad66b.html
435b373f,2025-05-24,My Life With the Thrill Kill Kult,07934e8f-f079-4645-a984-4a529504d79c,My Life With the Thrill Kill Kult,,The Palace Theatre,6bd2e222,Calgary,Alberta,AB,Canada,CA,51.050112282,-114.085285152,10,Shock of Point 6; A Daisy Chain 4 Satan; The Days of Swine and Roses; Nervous Xians; On This Rack; A Girl Doesn't Get Killed by a Make-Believe Lover... 'Cuz It's Hot; A Continental Touch; Sex on Wheelz; Do You Fear (For Your Child)?; And This Is What the Devil Does,https://www.setlist.fm/setlist/my-life-with-the-thrill-kill-kult/2025/the-palace-theatre-calgary-ab-canada-435b373f.html
435927f7,2025-05-24,Die Krupps,fc555365-17a2-4820-84e8-400887aa3d6f,"Krupps, Die",,The Palace Theatre,6bd2e222,Calgary,Alberta,AB,Canada,CA,51.050112282,-114.085285152,7,Nazis auf Speed; Der Amboss; Fatherland; Metal Machine Music; Robo Sapien; To the Hilt; Bloodsuckers,https://www.setlist.fm/setlist/die-krupps/2025/the-palace-theatre-calgary-ab-canada-435927f7.html
3b5a7860,2025-05-24,Ministry,13df2a46-f72f-40e7-aa63-26fcf62c7048,Ministry,The Squirrely Years,The Palace Theatre,6bd2e222,Calgary,Alberta,AB,Canada,CA,51.050112282,-114.085285152,14,Work for Love; Here We Go; All Day; I'll Do Anything for You; Same Old Madness; Just Like You; Over the Shoulder; We Believe; I'm Falling; Effigy (I'm Not An); Revenge; (Everyday Is) Halloween; Ricky's Hand; Da Ya Think I'm Sexy?,https://www.setlist.fm/setlist/ministry/2025/the-palace-theatre-calgary-ab-canada-3b5a7860.html
3b470870,2025-05-24,James Arthur,56f62fe8-d3a0-46e0-b5df-a64a8b4b4274,"Arthur, James",Pisces,Grey Eagle Resort & Casino,23d44c13,Calgary,Alberta,AB,Canada,CA,51.050112282,-114.085285152,15,Water; Bitter Sweet Love; Sermon / Ready or Not; Can I Be Him; Empty Space; Rewrite the Stars; Naked; KARAOKE; Cruel; Impossible; Train Wreck; Car's Outside; All My Love; Lasting Lover; Say You Won't Let Go,https://www.setlist.fm/setlist/james-arthur/2025/grey-eagle-resort-and-casino-calgary-ab-canada-3b470870.html
635b9e4b,2025-05-23,Alessia Cara,97e69730-3791-423b-9770-287261588854,"Cara, Alessia",Love & Hyperbole Tour,Grey Eagle Resort & Casino,23d44c13,Calgary,Alberta,AB,Canada,CA,51.050112282,-114.085285152,23,Dead Man; Left Alone; Run Run; Voice in My Head; Ready / Rooting for You; Subside; Drive; Get to You; Best Days / Out of Love; Stay / Wild Things; Trust My Lonely; Somebody Else; Fire; (Isn't It) Obvious; Slow Motion; Sweet Dream; Growing Pains; Apartment Song; You Let Me Down; Nighttime Thing; Clearly; Scars to Your Beautiful; Here,https://www.setlist.fm/setlist/alessia-cara/2025/grey-eagle-resort-and-casino-calgary-ab-canada-635b9e4b.html
2b47401a,2025-05-23,Alicia Moffet,a7cabcd9-b637-4682-bbd6-4db454fc07a7,"Moffet, Alicia",,Grey Eagle Resort & Casino,23d44c13,Calgary,Alberta,AB,Canada,CA,51.050112282,-114.085285152,8,Mr. Right; Choke; Lay Your Light; The Girl; Tired Of Me; Hotel W; Fake; Colder,https://www.setlist.fm/setlist/alicia-moffet/2025/grey-eagle-resort-and-casino-calgary-ab-canada-2b47401a.html
535b6ffd,2025-05-17,Art of Attrition,02f3b623-333f-483c-9104-ebc52a1edfee,Art of Attrition,The Subservient Bloodletting Tour,Dicken's Pub,3bd79cd8,Calgary,Alberta,AB,Canada,CA,51.050112282,-114.085285152,0,,https://www.setlist.fm/setlist/art-of-attrition/2025/dickens-pub-calgary-ab-canada-535b6ffd.html
53466ff5,2025-05-17,Jisei,587eee6d-b0b3-4ab7-90be-63b986bacaa5,Jisei,,The MLB,13d18141,Calgary,Alberta,AB,Canada,CA,51.050112282,-114.085285152,0,,https://www.setlist.fm/setlist/jisei/2025/the-mlb-calgary-ab-canada-53466ff5.html
435b6f13,2025-05-17,Beguiler,1d470aef-229d-403a-a72d-ef5bacb8f1e4,Beguiler,The Subservient Bloodletting Tour,Dicken's Pub,3bd79cd8,Calgary,Alberta,AB,Canada,CA,51.050112282,-114.085285152,0,,https://www.setlist.fm/setlist/beguiler/2025/dickens-pub-calgary-ab-canada-435b6f13.html
2b40e806,2025-05-17,Seraphina,1b79a524-3d9a-4c0d-a0f1-f358cc5da8ee,Seraphina,,The Rec Room,23d3a85f,Calgary,Alberta,AB,Canada,CA,51.050112282,-114.085285152,0,,https://www.setlist.fm/setlist/seraphina/2025/the-rec-room-calgary-ab-canada-2b40e806.html
13455959,2025-05-17,Andrés Cepeda,86a4ab3c-011c-4dca-afa3-80d9d49e9fb5,"Cepeda, Andrés",Nuestra Vida en Canciones,The Palace Theatre,6bd2e222,Calgary,Alberta,AB,Canada,CA,51.050112282,-114.085285152,0,,https://www.setlist.fm/setlist/andres-cepeda/2025/the-palace-theatre-calgary-ab-canada-13455959.html
534fbf71,2025-05-15,Ginette Reno,cb34ff6c-4361-4cf8-a1a0-b503c772469f,"Reno, Ginette",,Studio Bell,63d546ab,Calgary,Alberta,AB,Canada,CA,51.050112282,-114.085285152,1,Je ne suis qu'une chanson,https://www.setlist.fm/setlist/ginette-reno/2025/studio-bell-calgary-ab-canada-534fbf71.html
4b473b1a,2025-05-14,Juice,4580a3fc-f989-46de-b169-03cdabb53026,Juice,,Dicken's Pub,3bd79cd8,Calgary,Alberta,AB,Canada,CA,51.050112282,-114.085285152,8,Victim Of The Psychic War; Festival Of Fools; Murder; Drug Game; Profaned Remains; Chongo Juice; Satanic Pimp; World War 3,https://www.setlist.fm/setlist/juice/2025/dickens-pub-calgary-ab-canada-4b473b1a.html
3b46b0e4,2025-05-14,Pouya,cae09884-f473-460a-a04a-4dd3fc69cf6e,Pouya,THEY COULD NEVER MAKE ME,The Palace Theatre,6bd2e222,Calgary,Alberta,AB,Canada,CA,51.050112282,-114.085285152,0,,https://www.setlist.fm/setlist/pouya/2025/the-palace-theatre-calgary-ab-canada-3b46b0e4.html
3346b0d9,2025-05-14,Fat Nick,8739d68e-a0f2-4073-8873-8e5efe693b04,Fat Nick,,The Palace Theatre,6bd2e222,Calgary,Alberta,AB,Canada,CA,51.050112282,-114.085285152,0,,https://www.setlist.fm/setlist/fat-nick/2025/the-palace-theatre-calgary-ab-canada-3346b0d9.html
2b42b096,2025-05-14,SPEED,4ccddb42-9be6-46d8-822c-d9974962abec,SPEED,,Dicken's Pub,3bd79cd8,Calgary,Alberta,AB,Canada,CA,51.050112282,-114.085285152,0,,https://www.setlist.fm/setlist/speed/2025/dickens-pub-calgary-ab-canada-2b42b096.html
2346b0db,2025-05-14,Kxllswxtch,7d577034-18d3-4066-85c7-157d3bcce6b5,Kxllswxtch,,The Palace Theatre,6bd2e222,Calgary,Alberta,AB,Canada,CA,51.050112282,-114.085285152,0,,https://www.setlist.fm/setlist/kxllswxtch/2025/the-palace-theatre-calgary-ab-canada-2346b0db.html
735a7e51,2025-05-13,Atheist,424f2349-f719-46c0-ab39-abbb4364d95f,Atheist,Shred Fest,Dicken's Pub,3bd79cd8,Calgary,Alberta,AB,Canada,CA,51.050112282,-114.085285152,10,No Truth; On They Slay; Unholy War; Unquestionable Presence; The Formative Years; Water; Room With a View; I Deny; Mother Man; Piece of Time,https://www.setlist.fm/setlist/atheist/2025/dickens-pub-calgary-ab-canada-735a7e51.html
