event_id,event_date,artist_name,artist_mbid,artist_sort_name,tour_name,venue_name,venue_id,city_name,state,state_code,country_name,country_code,lat,lng,song_count,songs,setlist_url
234508e7,2025-07-05,Jeanphilip,e3ba2a6f-67e0-41b9-9802-22eed4a3d513,Jeanphilip,"Du Saint-Laurent à la Seine, 2025",Quai des brumes,3d64943,Montreal,Quebec,QC,Canada,CA,45.5088375,-73.587809,7,Qu'on se passe de moi; Ivresse; Dans nos vérandas; Du Saint-Laurent à la Seine; Ma tête dégèle; En stéréo; Bûcher dans le tas,https://www.setlist.fm/setlist/jeanphilip/2025/quai-des-brumes-montreal-qc-canada-234508e7.html
5344abe9,2025-07-04,Violent Femmes,2aab61bc-67f4-4722-8c6e-e1821b2e32a6,Violent Femmes,,Salle Wilfrid-Pelletier,7bd65e04,Montreal,Quebec,QC,Canada,CA,45.5088375,-73.587809,24,Country Death Song; I Hear the Rain; Never Tell; Jesus Walking on the Water; I Know It's True but I'm Sorry to Say; Hallowed Ground; Sweet Misery Blues; Black Girls; It's Gonna Rain; Blister in the Sun; Kiss Off; Please Do Not Go; Add It Up; Confessions; Prove My Love; Promise; To the Kill; Gone Daddy Gone; Good Feeling; Life Is an Adventure; Danse Avec Moi; Happy Birthday to You; I Held Her in My Arms; Gimme the Car,https://www.setlist.fm/setlist/violent-femmes/2025/salle-wilfrid-pelletier-montreal-qc-canada-5344abe9.html
4b453bf6,2025-07-04,Virvum,7aecd2ce-2f67-4511-9c67-a4bf9322441f,Virvum,Canada Takeover,Piranha Bar,13d78911,Montreal,Quebec,QC,Canada,CA,45.5088375,-73.587809,9,The Cypher Supreme; Earthwork; Anthesis; Tentacles of the Sun; Returners; Illuminance; Ad Rigorem; I: A New Journey Awaits; II: A Final Warming Shine: Ascension and Trespassing,https://www.setlist.fm/setlist/virvum/2025/piranha-bar-montreal-qc-canada-4b453bf6.html
4b453bea,2025-07-04,Stortregn,9de31a7f-1898-4d59-bee7-90cd4aa4265b,Stortregn,Canada Takeover,Piranha Bar,13d78911,Montreal,Quebec,QC,Canada,CA,45.5088375,-73.587809,8,Ghosts of the Past; Xeno Chaos; Cosmos Eater; A Lost Battle Rages On; The Revelation; One Eternal; Through the Dark Gates; Elegy,https://www.setlist.fm/setlist/stortregn/2025/piranha-bar-montreal-qc-canada-4b453bea.html
43422b67,2025-07-04,Today Is the Day,c5790c27-5808-42a2-b409-5395b56c209f,Today Is the Day,,Piranha Bar,13d78911,Montreal,Quebec,QC,Canada,CA,45.5088375,-73.587809,0,,https://www.setlist.fm/setlist/today-is-the-day/2025/piranha-bar-montreal-qc-canada-43422b67.html
345256f,2025-07-04,Pypy,fd8f59b9-17df-46b7-b849-1b607c66b2cc,Pypy,,Place des Arts,5bd62b34,Montreal,Quebec,QC,Canada,CA,45.5088375,-73.587809,11,Pagan Day; New York; Poodle Wig; Sacred Times; Molly; Erase; Daffodils; Too Much Cocaine; She’s Back; She's Gone; I Give a Fuck,https://www.setlist.fm/setlist/pypy/2025/place-des-arts-montreal-qc-canada-345256f.html
33452099,2025-07-04,Monsieur Periné,644c9096-41be-4d89-87b6-deceabf08930,Monsieur Periné,,Place des Festivals,13d64941,Montreal,Quebec,QC,Canada,CA,45.5088375,-73.587809,1,Tu m'as promis,https://www.setlist.fm/setlist/monsieur-perine/2025/place-des-festivals-montreal-qc-canada-33452099.html
33452059,2025-07-04,Kes,bfb74962-0875-47d2-8593-13be3d20797d,Kes,,Scène Rogers,13d00d2d,Montreal,Quebec,QC,Canada,CA,45.5088375,-73.587809,12,Last drum; Hello / Tack Back / Boss Lady; Jub Jub / Liki Tiki; Banga / Mood; Tuesday on the Rocks; My Love / Endless Summer; Old Soca  / No Sweetness; Cocoa Tea; Fallin / Ting / Wotless / Workout; Dear Promoter / People; Stage Gone Bad / Miracle; Savannah Grass,https://www.setlist.fm/setlist/kes/2025/scene-rogers-montreal-qc-canada-33452059.html
5b5fa370,2025-07-03,Madeleine Peyroux,7f260b9c-bea7-469b-9ba8-0daec7d2c85c,"Peyroux, Madeleine",Let's Walk Tour,Place des Arts,5bd62b34,Montreal,Quebec,QC,Canada,CA,45.5088375,-73.587809,0,,https://www.setlist.fm/setlist/madeleine-peyroux/2025/place-des-arts-montreal-qc-canada-5b5fa370.html
5b4513dc,2025-07-03,Yves Lambert,0c159e39-d25a-4d09-a33d-3d72c45f5324,"Lambert, Yves",,Square Sir-George-Étienne-Cartier,3d145af,Montreal,Quebec,QC,Canada,CA,45.5088375,-73.587809,0,,https://www.setlist.fm/setlist/yves-lambert/2025/square-sir-george-etienne-cartier-montreal-qc-canada-5b4513dc.html
3b4718ec,2025-07-03,George Thorogood & the Destroyers,bc01f01c-a401-40d8-9472-b377ac33af05,"Thorogood, George & the Destroyers",,MTELUS,13d291d1,Montreal,Quebec,QC,Canada,CA,45.5088375,-73.587809,7,"Rock Party; Who Do You Love?; One Bourbon, One Scotch, One Beer; I Drink Alone; Get a Hair-cut; Bad to the Bone; Move It on Over",https://www.setlist.fm/setlist/george-thorogood-and-the-destroyers/2025/mtelus-montreal-qc-canada-3b4718ec.html
3b451c30,2025-07-03,Alastair Greene,c0349a70-993d-45a1-a239-5ecfbaa71e02,"Greene, Alastair",,MTELUS,13d291d1,Montreal,Quebec,QC,Canada,CA,45.5088375,-73.587809,0,,https://www.setlist.fm/setlist/alastair-greene/2025/mtelus-montreal-qc-canada-3b451c30.html
334718d1,2025-07-03,Christone “Kingfish” Ingram,779f771b-8d62-4f90-9a82-95e542e2784b,"Ingram, Christone “Kingfish”",The Hard Road,Scène TD,73d646ad,Montreal,Quebec,QC,Canada,CA,45.5088375,-73.587809,7,Instrumental Jam; Midnight Heat; Fresh Out; Empty Promises; Not Gonna Lie; Mississippi Night; 662,https://www.setlist.fm/setlist/christone-kingfish-ingram/2025/scene-td-montreal-qc-canada-334718d1.html
2b4718ea,2025-07-03,Fantastic Negrito,b7be8029-5ebe-4e4b-bc0c-a4d4756463c7,Fantastic Negrito,,Scène Rogers,13d00d2d,Montreal,Quebec,QC,Canada,CA,45.5088375,-73.587809,0,,https://www.setlist.fm/setlist/fantastic-negrito/2025/scene-rogers-montreal-qc-canada-2b4718ea.html
1b4795cc,2025-07-03,Mon Laferte,ab966c0f-e526-46ae-b492-82c27b87f81f,"Laferte, Mon",,Salle Wilfrid-Pelletier,7bd65e04,Montreal,Quebec,QC,Canada,CA,45.5088375,-73.587809,21,Tormento; Aunque te mueras por volver; Mi buen amor; Préndele fuego; Pornocracia; Calaveras; La mujer; Amado mío; Se me va a quemar el corazón; La trenza; Funeral; Quédate esta noche; Canción feliz; Otra noche de llorar; Amantes suicidas; Por qué me fui a enamorar de ti; Flaco; Amor completo; Tu falta de querer; Pa' dónde se fue; Amárrame,https://www.setlist.fm/setlist/mon-laferte/2025/salle-wilfrid-pelletier-montreal-qc-canada-1b4795cc.html
1b42e944,2025-07-03,Anyma Ora’,2c800f8d-d33c-4ef8-8970-146e326047c5,"Ora’, Anyma",,Scène Loto-Québec,bd711e6,Montreal,Quebec,QC,Canada,CA,45.5088375,-73.587809,0,,https://www.setlist.fm/setlist/anyma-ora/2025/scene-loto-quebec-montreal-qc-canada-1b42e944.html
6b5a5ade,2025-07-02,The Cat Empire,a530492f-8806-4bd7-9c14-80c237eb92fe,"Cat Empire, The",Bird in Paradise,MTELUS,13d291d1,Montreal,Quebec,QC,Canada,CA,45.5088375,-73.587809,18,Blood on the Stage; How to Explain?; Oscar Wilde; Prophets in the Sky; Candela; Song for Elias; Going to Live; Two Shoes; Brighter Than Gold; Hello; Sly; Be With You Again; Steal the Light; Devil; The Chariot; Days Like These / Saltwater / One Four Five / So Many Nights / The Darkness / The Rhythm / In My Pocket / The Wine Song; Still Young; All Night Loud,https://www.setlist.fm/setlist/the-cat-empire/2025/mtelus-montreal-qc-canada-6b5a5ade.html
5b45c3b4,2025-07-02,Jean‐Philippe Audin,abd167b3-754c-4546-a5bb-cb8da2567cb6,"Audin, Jean‐Philippe",,Société des arts technologiques (SAT),1bd6494c,Montreal,Quebec,QC,Canada,CA,45.5088375,-73.587809,15,Twin Peaks Theme; The Voice of Love; Laura Palmer's Theme; Audrey's Dance; Theme From Twin Peaks: Fire Walk With Me; Questions in a World of Blue; Into the Night; The Pink Room; The Pine Float; Don’t Do Anything (I Wouldn’t Do); Moving Through Time; Freshly Squeezed; The Nightingale; Falling; The Voice of Love,https://www.setlist.fm/setlist/jeanphilippe-audin/2025/societe-des-arts-technologiques-sat-montreal-qc-canada-5b45c3b4.html
535b3f09,2025-07-02,Men I Trust,25ab7547-a4d2-480b-b028-c7f3497bc858,Men I Trust,,Place des Festivals,13d64941,Montreal,Quebec,QC,Canada,CA,45.5088375,-73.587809,21,"To Ease You; Come Back Down; Husk; Hard To See; Sugar; Another Stone; In My Years; Ring of Past; Carried Away; Serenade of Water; Where I Sit; The Better Half; Humming Man; Oncle Jazz / Norton Commander (All We Need) / Hard To Let Go / Numb / Lifelong Song / Lucky Sue / Tree Among Shrubs; All Night; Seven; Tailwhip; Show Me How; Say, Can You Hear; Worn Down; Billie Toppy",https://www.setlist.fm/setlist/men-i-trust/2025/place-des-festivals-montreal-qc-canada-535b3f09.html
4b453f62,2025-07-02,Meggie Lennon,f086f03c-91fa-4aa5-9dd8-ab1697d5a164,"Lennon, Meggie",,MTELUS,13d291d1,Montreal,Quebec,QC,Canada,CA,45.5088375,-73.587809,0,,https://www.setlist.fm/setlist/meggie-lennon/2025/mtelus-montreal-qc-canada-4b453f62.html
3b4388a0,2025-07-02,Anomalie,42616833-1821-4b46-9c4e-7ec3831cf4a7,Anomalie,,Le Gesù,33d77c09,Montreal,Quebec,QC,Canada,CA,45.5088375,-73.587809,0,,https://www.setlist.fm/setlist/anomalie/2025/le-gesu-montreal-qc-canada-3b4388a0.html
3453903,2025-07-02,Carl Mayotte,3e7df9f3-3494-4c26-864d-038fc4534111,"Mayotte, Carl",,Place des Festivals,13d64941,Montreal,Quebec,QC,Canada,CA,45.5088375,-73.587809,1,Abracadabra,https://www.setlist.fm/setlist/carl-mayotte/2025/place-des-festivals-montreal-qc-canada-3453903.html
33438899,2025-07-02,Linda May Han Oh,9960b51b-f542-419a-b77f-418432a71f96,"Oh, Linda May Han",,Esplanade Tranquille,4bdeaf5a,Montreal,Quebec,QC,Canada,CA,45.5088375,-73.587809,0,,https://www.setlist.fm/setlist/linda-may-han-oh/2025/esplanade-tranquille-montreal-qc-canada-33438899.html
234c2843,2025-07-02,Ben Harper,1582a5b8-538e-45e7-9ae4-4099439a0e79,"Harper, Ben",,Salle Wilfrid-Pelletier,7bd65e04,Montreal,Quebec,QC,Canada,CA,45.5088375,-73.587809,23,Before the Rain Dried; Manhattan; Steal My Kisses; Don't Give Up on Me Now; Power of the Gospel; Give a Man a Home; Dancing in the Dark; Please Bleed; Roses From My Friends; Morning Yearning; Hallelujah; Walk Away; Forever; Diamonds on the Inside; Trying Not to Fall in Love With You; Inland Empire; Sexual Healing; Another Lonely Day; Amen Omen; Knockin' on Heaven's Door; Excuse Me Mr.; The Woman in You; Waiting on an Angel,https://www.setlist.fm/setlist/ben-harper/2025/salle-wilfrid-pelletier-montreal-qc-canada-234c2843.html
7345cefd,2025-07-01,The Sugar Darlings,7c5e0d76-7c5b-457d-970f-9cdc35d9cc2d,"Sugar Darlings, The",,Scène Rogers,13d00d2d,Montreal,Quebec,QC,Canada,CA,45.5088375,-73.587809,0,,https://www.setlist.fm/setlist/the-sugar-darlings/2025/scene-rogers-montreal-qc-canada-7345cefd.html
6b45ce1a,2025-07-01,Ariane Racicot,5e215b39-9ba0-4ee5-a5d6-ea4b3a1a13e0,"Racicot, Ariane",,Pub Molson,73de1a5d,Montreal,Quebec,QC,Canada,CA,45.5088375,-73.587809,7,Avant la tempête; Going For A Walk; Dancing With Fire; There Is Some Hope; Canicules; ; Bicycle Ride,https://www.setlist.fm/setlist/ariane-racicot/2025/pub-molson-montreal-qc-canada-6b45ce1a.html
6345cef3,2025-07-01,Lucky Chemistry,6c0475f2-2ece-41f4-9d2e-3184530afe12,Lucky Chemistry,,Le Cabaret TD Assurances,2bde1446,Montreal,Quebec,QC,Canada,CA,45.5088375,-73.587809,0,,https://www.setlist.fm/setlist/lucky-chemistry/2025/le-cabaret-td-assurances-montreal-qc-canada-6345cef3.html
534473b5,2025-07-01,Thundercat,044fd265-79dd-43eb-afc4-8b20becf7e17,Thundercat,,Salle Wilfrid-Pelletier,7bd65e04,Montreal,Quebec,QC,Canada,CA,45.5088375,-73.587809,4,Lost in Space / Great Scott / 22-26 / Interstellar Love; How Sway / Uh Uh; Overseas; A.D.D. Through the Roof,https://www.setlist.fm/setlist/thundercat/2025/salle-wilfrid-pelletier-montreal-qc-canada-534473b5.html
4b45cf86,2025-07-01,Jeff Goldblum,150fde6c-d8d6-4e59-8ff7-52cfe85497d9,"Goldblum, Jeff",,Salle Wilfrid-Pelletier,7bd65e04,Montreal,Quebec,QC,Canada,CA,45.5088375,-73.587809,2,Gens du pays; Ô Canada,https://www.setlist.fm/setlist/jeff-goldblum/2025/salle-wilfrid-pelletier-montreal-qc-canada-4b45cf86.html
4b45179a,2025-07-01,Derrick Hodge,f3b66b77-196b-4c79-8200-df970ead4456,"Hodge, Derrick",,Le Studio TD,2bd00812,Montreal,Quebec,QC,Canada,CA,45.5088375,-73.587809,0,,https://www.setlist.fm/setlist/derrick-hodge/2025/le-studio-td-montreal-qc-canada-4b45179a.html
23452c93,2025-07-01,RJD2,1a120ec5-35b3-4f3e-aa49-7201550d9feb,RJD2,,Club Soda,6bd6c6ca,Montreal,Quebec,QC,Canada,CA,45.5088375,-73.587809,8,"Mama Said Knock You Out; The Horror; 1976; Making Days Longer; Behold, Numbers!; See You Leave; Ghostwriter; Good Times Roll, Part 1 & 2",https://www.setlist.fm/setlist/rjd2/2025/club-soda-montreal-qc-canada-23452c93.html
7b58d6d4,2025-06-30,BABYMETAL,27e2997f-f7a1-4353-bcc4-57b9274fa9a4,BABYMETAL,BABYMETAL NORTH AMERICA 2025,Place Bell,23d4d04f,Laval,Quebec,QC,Canada,CA,45.5699525280969,-73.6919975280762,13,BABYMETAL DEATH; Megitsune; PA PA YA!!; BxMxC; METALI!!; Kon! Kon!; Song 3; Headbangeeeeerrrrr!!!!!; RATATATA; Gimme Chocolate!!; from me to u; KARATE; Road of Resistance,https://www.setlist.fm/setlist/babymetal/2025/place-bell-laval-qc-canada-7b58d6d4.html
6b45c666,2025-06-30,The Surfrajettes,c64e43b7-f3b8-49ae-a016-02047f6dabf5,"Surfrajettes, The",Summer Stomp,"Bar ""Le Ritz"" P.D.B",43d407c7,Montreal,Quebec,QC,Canada,CA,45.5088375,-73.587809,9,Diamond Head; Clam Chowder; Banshee Bop; Heart of Glass; Easy as Pie; Riders in the Sky; Paint It Black; Spice Up Your Life; Toxic,https://www.setlist.fm/setlist/the-surfrajettes/2025/bar-le-ritz-pdb-montreal-qc-canada-6b45c666.html
6345f647,2025-06-30,Trombone Shorty & Orleans Avenue,ebc0f4e7-f709-4790-a7d7-4915004927be,Trombone Shorty & Orleans Avenue,Might Not Make It Home,Scène TD,73d646ad,Montreal,Quebec,QC,Canada,CA,45.5088375,-73.587809,0,,https://www.setlist.fm/setlist/trombone-shorty-and-orleans-avenue/2025/scene-td-montreal-qc-canada-6345f647.html
534517b5,2025-06-30,Nate Smith,a1652aa0-8fae-4f6b-b914-6ab6a1291fdd,"Smith, Nate",,Théâtre Jean-Duceppe,53d42b95,Montreal,Quebec,QC,Canada,CA,45.5088375,-73.587809,1,When Your Life Was Low,https://www.setlist.fm/setlist/nate-smith/2025/theatre-jean-duceppe-montreal-qc-canada-534517b5.html
3b471854,2025-06-30,Charlie Cunningham,73ed4066-c55b-496c-bb1a-1238937a2361,"Cunningham, Charlie",North America 2025,Le Gesù,33d77c09,Montreal,Quebec,QC,Canada,CA,45.5088375,-73.587809,0,,https://www.setlist.fm/setlist/charlie-cunningham/2025/le-gesu-montreal-qc-canada-3b471854.html
345cdaf,2025-06-30,Kiefer,a2252be6-2f4f-40d2-a54d-da93c9dfb649,Kiefer,,Le Gesù,33d77c09,Montreal,Quebec,QC,Canada,CA,45.5088375,-73.587809,0,,https://www.setlist.fm/setlist/kiefer/2025/le-gesu-montreal-qc-canada-345cdaf.html
2b58d0c2,2025-06-30,Black Veil Brides,33319aed-9bd7-4cd1-903c-716845c1b7cd,Black Veil Brides,,Place Bell,23d4d04f,Laval,Quebec,QC,Canada,CA,45.5699525280969,-73.6919975280762,8,Knives and Pens; Bleeders; Faithless; Coffin; Devil; The Legacy; Perfect Weapon; In the End,https://www.setlist.fm/setlist/black-veil-brides/2025/place-bell-laval-qc-canada-2b58d0c2.html
2b45d46a,2025-06-30,Nai Palm,2faee3c1-74f7-4778-903f-c24b1293860d,"Palm, Nai",,Club Soda,6bd6c6ca,Montreal,Quebec,QC,Canada,CA,45.5088375,-73.587809,14,Baby Brother; Get Sun; Blackstar/Pyramid Song; Breathing Underwater; Have You Ever Been (to Electric Ladyland); Haiku; When the Knife; Borderline With My Atoms; Atoll; Molasses; Crossfire; Everything’s Beautiful; Nakamarra; Homebody,https://www.setlist.fm/setlist/nai-palm/2025/club-soda-montreal-qc-canada-2b45d46a.html
2b45d416,2025-06-30,Nubya Garcia,42dd1862-7255-47ed-8584-651abce3bf53,"Garcia, Nubya",,Scène TD,73d646ad,Montreal,Quebec,QC,Canada,CA,45.5088375,-73.587809,0,,https://www.setlist.fm/setlist/nubya-garcia/2025/scene-td-montreal-qc-canada-2b45d416.html
2345fc37,2025-06-30,Lalah Hathaway,3f0f4358-4c48-4bce-be34-acf61d24df0b,"Hathaway, Lalah",,Théâtre Jean-Duceppe,53d42b95,Montreal,Quebec,QC,Canada,CA,45.5088375,-73.587809,0,,https://www.setlist.fm/setlist/lalah-hathaway/2025/theatre-jean-duceppe-montreal-qc-canada-2345fc37.html
2345d46f,2025-06-30,André Leroux,b5451acd-9b96-4ab1-9283-8226bb369790,"Leroux, André",,Pub Molson,73de1a5d,Montreal,Quebec,QC,Canada,CA,45.5088375,-73.587809,5,"The Night Has a Thousand Eyes; Iris; 415 Central Park West; Échanges synaptiques; Take The ""D"" Train",https://www.setlist.fm/setlist/andre-leroux/2025/pub-molson-montreal-qc-canada-2345d46f.html
2345d443,2025-06-30,Matteo Mancuso,c8472682-aeff-4121-8bb0-cbf3f426a841,"Mancuso, Matteo",North America Tour 2025,Scène Rogers,13d00d2d,Montreal,Quebec,QC,Canada,CA,45.5088375,-73.587809,2,Fred; Open Fields,https://www.setlist.fm/setlist/matteo-mancuso/2025/scene-rogers-montreal-qc-canada-2345d443.html
2345d427,2025-06-30,Matteo Mancuso,c8472682-aeff-4121-8bb0-cbf3f426a841,"Mancuso, Matteo",North America Tour 2025,Scène Rogers,13d00d2d,Montreal,Quebec,QC,Canada,CA,45.5088375,-73.587809,2,The Chicken; Drop D,https://www.setlist.fm/setlist/matteo-mancuso/2025/scene-rogers-montreal-qc-canada-2345d427.html
1b45f9b0,2025-06-30,Jeff Goldblum & The Mildred Snitzer Orchestra,d6497b10-b72e-4e11-84db-7fac60292746,"Goldblum, Jeff & Mildred Snitzer Orchestra, The",,Salle Wilfrid-Pelletier,7bd65e04,Montreal,Quebec,QC,Canada,CA,45.5088375,-73.587809,0,,https://www.setlist.fm/setlist/jeff-goldblum-and-the-mildred-snitzer-orchestra/2025/salle-wilfrid-pelletier-montreal-qc-canada-1b45f9b0.html
1b45d52c,2025-06-30,Avishai Cohen Trio,05da8a7c-676d-4d8a-a514-e25ee526a98f,"Cohen, Avishai, Trio",,Maison symphonique de Montréal,23d714c7,Montreal,Quebec,QC,Canada,CA,45.5088375,-73.587809,0,,https://www.setlist.fm/setlist/avishai-cohen-trio/2025/maison-symphonique-de-montreal-montreal-qc-canada-1b45d52c.html
5b4537ec,2025-06-29,Lucky Chemistry,6c0475f2-2ece-41f4-9d2e-3184530afe12,Lucky Chemistry,,Le Cabaret TD Assurances,2bde1446,Montreal,Quebec,QC,Canada,CA,45.5088375,-73.587809,0,,https://www.setlist.fm/setlist/lucky-chemistry/2025/le-cabaret-td-assurances-montreal-qc-canada-5b4537ec.html
345d56f,2025-06-29,Mike Stern,38e82a3d-4e11-4e0b-92d5-6b3a3f93f276,"Stern, Mike",,Théâtre Jean-Duceppe,53d42b95,Montreal,Quebec,QC,Canada,CA,45.5088375,-73.587809,9,Like a Thief; Connections; Echoes; Wishing Well; Tumble Home; Band Jam and Solos; Gospel Song; Tipatina's; Red House,https://www.setlist.fm/setlist/mike-stern/2025/theatre-jean-duceppe-montreal-qc-canada-345d56f.html
2b471852,2025-06-29,Charlie Cunningham,73ed4066-c55b-496c-bb1a-1238937a2361,"Cunningham, Charlie",North America 2025,Le Gesù,33d77c09,Montreal,Quebec,QC,Canada,CA,45.5088375,-73.587809,0,,https://www.setlist.fm/setlist/charlie-cunningham/2025/le-gesu-montreal-qc-canada-2b471852.html
2b45d8e6,2025-06-29,The Brooks,67747add-725b-49a9-a981-b97c0b690a21,"Brooks, The",Soon As I Can,Club Soda,6bd6c6ca,Montreal,Quebec,QC,Canada,CA,45.5088375,-73.587809,14,"Funkyshit; Pain & Bliss; Sista; The Wall; Play The Part; Where The Party At; Priceless; Game Play; Soon As I Can; Mirror, Mirror; Funklife; Coming From the Real; If You Want Me to Stay; Turn Up The Sound",https://www.setlist.fm/setlist/the-brooks/2025/club-soda-montreal-qc-canada-2b45d8e6.html
2b45d826,2025-06-29,Bye Parula,a606a741-3c09-4a50-8505-bd913f129a10,Bye Parula,,Club Soda,6bd6c6ca,Montreal,Quebec,QC,Canada,CA,45.5088375,-73.587809,0,,https://www.setlist.fm/setlist/bye-parula/2025/club-soda-montreal-qc-canada-2b45d826.html
2347246b,2025-06-29,Angine de Poitrine,5fd29907-c3c5-4b1d-a799-7cf9bbd288fc,Angine de Poitrine,,Club Montréal Loto-Québec,6bde1a5e,Montreal,Quebec,QC,Canada,CA,45.5088375,-73.587809,0,,https://www.setlist.fm/setlist/angine-de-poitrine/2025/club-montreal-loto-quebec-montreal-qc-canada-2347246b.html
b45edd6,2025-06-28,Secret Chiefs 3,45ec9b41-eeea-42da-8337-28c67a8d2934,Secret Chiefs 3,,MTELUS,13d291d1,Montreal,Quebec,QC,Canada,CA,45.5088375,-73.587809,8,Spiritus Intelligentiae: Jophiel; Tistrya; Bionic; Vajra; iGod; Cali; RFID Slaverider / Codex Alimentarius / Agenda 21; The 7 / Brazen Serpent,https://www.setlist.fm/setlist/secret-chiefs-3/2025/mtelus-montreal-qc-canada-b45edd6.html
7b59ae58,2025-06-28,Rickshaw Billie’s Burger Patrol,cf9d7a43-7cd0-4b19-959d-3b7d116845a5,Rickshaw Billie’s Burger Patrol,,"Bar ""Le Ritz"" P.D.B",43d407c7,Montreal,Quebec,QC,Canada,CA,45.5088375,-73.587809,0,,https://www.setlist.fm/setlist/rickshaw-billies-burger-patrol/2025/bar-le-ritz-pdb-montreal-qc-canada-7b59ae58.html
734ea6f5,2025-06-28,Brekky Boy,2249ad69-4d67-4a22-bb30-64f0844bab86,Brekky Boy,,Scène TD,73d646ad,Montreal,Quebec,QC,Canada,CA,45.5088375,-73.587809,0,,https://www.setlist.fm/setlist/brekky-boy/2025/scene-td-montreal-qc-canada-734ea6f5.html
73459669,2025-06-28,Convictions,66bf8de7-0bb2-4cfe-8059-4ec0da132702,Convictions,,Théâtre Fairmount,5bd4439c,Montreal,Quebec,QC,Canada,CA,45.5088375,-73.587809,0,,https://www.setlist.fm/setlist/convictions/2025/theatre-fairmount-montreal-qc-canada-73459669.html
6b59ae5a,2025-06-28,Pigs Pigs Pigs Pigs Pigs Pigs Pigs,611c226a-6eda-486a-ab1c-cd8573e68c00,Pigs Pigs Pigs Pigs Pigs Pigs Pigs,Death Hilarious UK & Europe Tour,"Bar ""Le Ritz"" P.D.B",43d407c7,Montreal,Quebec,QC,Canada,CA,45.5088375,-73.587809,0,,https://www.setlist.fm/setlist/pigs-pigs-pigs-pigs-pigs-pigs-pigs/2025/bar-le-ritz-pdb-montreal-qc-canada-6b59ae5a.html
6b459676,2025-06-28,The Browning,fb759bfb-34ec-4f1d-91f9-fd46549bc3cd,"Browning, The",,Théâtre Fairmount,5bd4439c,Montreal,Quebec,QC,Canada,CA,45.5088375,-73.587809,0,,https://www.setlist.fm/setlist/the-browning/2025/theatre-fairmount-montreal-qc-canada-6b459676.html
634f8abf,2025-06-28,Colorsfade,0816370b-be5d-41df-9f60-a43e4bed3985,Colorsfade,,Cabaret Foufounes,2bd000d2,Montreal,Quebec,QC,Canada,CA,45.5088375,-73.587809,8,Line In The Sand; Disaster; Complaining; Obedience; I'm Not Mad; Open Book; Loaded for Peace; Roll of the Dice,https://www.setlist.fm/setlist/colorsfade/2025/cabaret-foufounes-montreal-qc-canada-634f8abf.html
6345966b,2025-06-28,Born of Osiris,132ca1ea-0891-420f-b129-50247bb144b5,Born of Osiris,,Théâtre Fairmount,5bd4439c,Montreal,Quebec,QC,Canada,CA,45.5088375,-73.587809,0,,https://www.setlist.fm/setlist/born-of-osiris/2025/theatre-fairmount-montreal-qc-canada-6345966b.html
5b4473b8,2025-06-28,Nas,cfbc0924-0035-4d6c-8197-f024653af823,Nas,,Salle Wilfrid-Pelletier,7bd65e04,Montreal,Quebec,QC,Canada,CA,45.5088375,-73.587809,22,The Genesis; N.Y. State of Mind; Life's a Bitch; The World Is Yours; Halftime; Memory Lane (Sittin' in da Park); One Love; Represent; It Ain't Hard to Tell; The Message; Street Dreams; Got Ur Self a Gun; Spicy; The Don; Hot Boyz; Oochie Wally; You Owe Me; Rare; I Can; Made You Look; If I Ruled the World (Imagine That); One Mic,https://www.setlist.fm/setlist/nas/2025/salle-wilfrid-pelletier-montreal-qc-canada-5b4473b8.html
5345f761,2025-06-28,Jay-Jay Johanson,99e9b8ff-b8ea-4019-a073-acc9fbc93bbe,"Johanson, Jay-Jay",,Théâtre Maisonneuve,3d6d9bb,Montreal,Quebec,QC,Canada,CA,45.5088375,-73.587809,21,Finally; So Tell the Girls That I Am Back in Town; Ten Little Minutes; You'll Miss Me When I'm Gone; Seine; Smoke; Not Time Yet; The Girl I Love Is Gone; Far Away; How Long Do You Think We're Gonna Last; She Doesn't Live Here Anymore; ; It Hurts Me So; She's Mine but I'm Not Hers; Milan Madrid Chicago Paris; Tomorrow; Quel Dommage; Heard Somebody Whistle; Whispering Words; Believe in Us; I'm Older Now,https://www.setlist.fm/setlist/jay-jay-johanson/2025/theatre-maisonneuve-montreal-qc-canada-5345f761.html
5345f3cd,2025-06-28,Grace Bowers and the Hodge Podge,02f23ec9-c149-4971-97cb-cc47c86efbd0,"Grace Bowers and Hodge Podge, The",Wine on Venus,Scène TD,73d646ad,Montreal,Quebec,QC,Canada,CA,45.5088375,-73.587809,0,,https://www.setlist.fm/setlist/grace-bowers-and-the-hodge-podge/2025/scene-td-montreal-qc-canada-5345f3cd.html
4b4473be,2025-06-28,Elisapie,47c3d134-96e1-434c-898e-d4f6bb2c1f37,Elisapie,,Scène TD,73d646ad,Montreal,Quebec,QC,Canada,CA,45.5088375,-73.587809,14,"Uummati Attanarsimat (Heart of Glass); Taimangalimaaq (Time After Time); Call of the moose; Californiamut (Going to California); Isumagijunnaitaungituq (The Unforgiven); Wolves Don't Live by the Rules; Sinnatuumait (Dreams); Qanniuguma; Taimaa Qimatsiniungimat (Hey, That's No Way to Say Goodbye); Arnaq; Qaisimalaurittuq (Wish You Were Here); Qimatsilunga (I Want to Break Free); Quviasukkuvit (If It Makes You Happy); Inuuniaravit (Born to Be Alive)",https://www.setlist.fm/setlist/elisapie/2025/scene-td-montreal-qc-canada-4b4473be.html
2b45f4d2,2025-06-28,The Budos Band,b6fa9b9b-41cf-45a6-adc0-0a4c9a8c0d3c,"Budos Band, The",VII Tour 2025,MTELUS,13d291d1,Montreal,Quebec,QC,Canada,CA,45.5088375,-73.587809,19,"Thrice Crowned; Overlander; Night Raid; Old Engine Oil; The Sticks; Chicago Falcon; Black Venom; Escape From Ptenoda City; T.I.B.W.F.; Long in the Tooth; Frontier's Edge; Veil of Shadows; Behind the Black Curtain; Breakout; Unbroken, Unshaven; BAM; Up From the South; Ethio; Turkish",https://www.setlist.fm/setlist/the-budos-band/2025/mtelus-montreal-qc-canada-2b45f4d2.html
1b45edf4,2025-06-28,Unwritten Law,846cdb90-81a6-4c05-a7dc-9dd075f0db9e,Unwritten Law,,Les Foufounes Électriques,53d6d3f5,Montreal,Quebec,QC,Canada,CA,45.5088375,-73.587809,17,Teenage Suicide; Rescue Me; Lonesome; California Sky; Cailin; Sound Siren; Ghosted; Seein' Red; Celebration Song; Before I Go; ; How You Feel; Rest of My Life; She Says; Save Me (Wake Up Call); Up All Night; Harmonic,https://www.setlist.fm/setlist/unwritten-law/2025/les-foufounes-electriques-montreal-qc-canada-1b45edf4.html
b45e5d2,2025-06-27,Finely Tuned Elephant,61c117ba-f48d-4fab-9894-db35ad64bcb7,Finely Tuned Elephant,,l'Escogriffe Bar Spectacle,4bd2f396,Montreal,Quebec,QC,Canada,CA,45.5088375,-73.587809,0,,https://www.setlist.fm/setlist/finely-tuned-elephant/2025/lescogriffe-bar-spectacle-montreal-qc-canada-b45e5d2.html
7b408a7c,2025-06-27,Couleur Pastèque,800139f2-f21a-47e4-aeea-ce42a87704f1,Couleur Pasteque,,Bar L'Hémisphère Gauche,2bd77082,Montreal,Quebec,QC,Canada,CA,45.5088375,-73.587809,10,Biscuit Soldat; Connaître Le Fruit; La Punk; Tintin Au Compte-Goutte; Bartrelle; La Pop; Mon Pain Souvenir; Jean-Daniel Pharcie; Poupée BBQ; Ottobit,https://www.setlist.fm/setlist/couleur-pasteque/2025/bar-lhemisphere-gauche-montreal-qc-canada-7b408a7c.html
