event_id,event_date,artist_name,artist_mbid,artist_sort_name,tour_name,venue_name,venue_id,city_name,state,state_code,country_name,country_code,lat,lng,song_count,songs,setlist_url
2b4fac9e,2025-12-31,April Wine,78761837-4b00-4935-b7be-601697900e66,April Wine,,Grey Eagle Resort & Casino,23d44c13,Calgary,Alberta,AB,Canada,CA,51.050112282,-114.085285152,0,,https://www.setlist.fm/setlist/april-wine/2025/grey-eagle-resort-and-casino-calgary-ab-canada-2b4fac9e.html
3b4c3460,2025-12-21,Telstar Drugs,bafb9c27-72a3-4d47-93cc-a97281b6e996,Telstar Drugs,,Private Venue,33d35475,Calgary,Alberta,AB,Canada,CA,51.050112282,-114.085285152,6,Greyed Rainbow; Pressed; Unglued; Pulley; Young One; Gamelan,https://www.setlist.fm/setlist/telstar-drugs/2025/private-venue-calgary-ab-canada-3b4c3460.html
3b4dd474,2025-12-20,Chixdiggit!,4ce7c52b-f532-41c4-86ec-34f18b2a37c0,Chixdiggit,,Modern Love,2bd1f022,Calgary,Alberta,AB,Canada,CA,51.050112282,-114.085285152,10,Spanish Fever; Silent Night; (I Feel Like) (Gerry) Cheevers (Stitch Marks on My Heart); Good King Wenceslas; I Drove the Coquihalla; Gettin' Air; You're Pretty Good; Sikome Beach; I Wanna Hump You/Wish You a Merry Christmas; Chupacabras,https://www.setlist.fm/setlist/chixdiggit/2025/modern-love-calgary-ab-canada-3b4dd474.html
34e0d57,2025-12-19,Air Supply,df9a1914-7fad-4900-bdd4-d7811712a2a8,Air Supply,50th Anniversary,Grey Eagle Resort & Casino,23d44c13,Calgary,Alberta,AB,Canada,CA,51.050112282,-114.085285152,0,,https://www.setlist.fm/setlist/air-supply/2025/grey-eagle-resort-and-casino-calgary-ab-canada-34e0d57.html
634526c3,2025-12-17,Mac DeMarco,f2492c31-54a8-4347-a1fc-f81f72873bbf,"DeMarco, Mac",2025 World Tour,"MacEwan Hall, University of Calgary",3d4615f,Calgary,Alberta,AB,Canada,CA,51.050112282,-114.085285152,24,Shining; For the First Time; Sweeter; On the Level; Phantom; Salad Days; Nightmare; 20191009 I Like Her; Rock and Roll; Still Beating; Passing Out Pieces; On the Square; Heart to Heart; Knockin; Ode to Viceroy; Another One; Rooster; Freaking Out the Neighborhood; Holy; Moonlight on the River; My Kind of Woman; Chamber of Reflection; Ô Canada; Nobody,https://www.setlist.fm/setlist/mac-demarco/2025/macewan-hall-university-of-calgary-calgary-ab-canada-634526c3.html
134db131,2025-12-13,Sun Kil Moon,ef2c6449-d02b-415b-ad8c-c14c08266552,Sun Kil Moon,,Commonwealth Bar & Stage,2bd484ea,Calgary,Alberta,AB,Canada,CA,51.050112282,-114.085285152,15,Christmas in New Orleans; Somehow the Wonder of Life Prevails; Mother and Daughter; I Watched the Film the Song Remains the Same; Carry Me Ohio; Young Love; Richard Ramirez Died Today of Natural Causes; Somewhere; Calgary; I Know It's Pathetic but That Was the Greatest Night of My Life; I Can't Live Without My Mother's Love; Have You Forgotten; Dogs; A Dream of Winter; Alesund,https://www.setlist.fm/setlist/sun-kil-moon/2025/commonwealth-bar-and-stage-calgary-ab-canada-134db131.html
34c516f,2025-12-10,The Royal Foundry,e0c50b71-7cbe-45bf-8bba-e7cce93995a8,"Royal Foundry, The",,The Palace Theatre,6bd2e222,Calgary,Alberta,AB,Canada,CA,51.050112282,-114.085285152,6,Rewind; Listen to the Beat; Famous; I Give Up; I Don't Wanna Talk; Little High Little Low,https://www.setlist.fm/setlist/the-royal-foundry/2025/the-palace-theatre-calgary-ab-canada-34c516f.html
334c5041,2025-12-10,Hotel Mira,f3235b39-4559-43bb-94f0-ac7dbadd2a28,Hotel Mira,Pity Party North American Tour,The Palace Theatre,6bd2e222,Calgary,Alberta,AB,Canada,CA,51.050112282,-114.085285152,18,America's Favourite Pastime; King of the World; This Could Be It for Me; Runner; Vampire; Jungle; Alone in America; Right Back Where I Was; Son-in-Law; Made for This; Cowboy; Re: Valentine's Day; Making Progress; Dancing With the Moonlight; Speaking Off the Record; Don't Look Back in Anger; Fever Pitch; Southern Comforting,https://www.setlist.fm/setlist/hotel-mira/2025/the-palace-theatre-calgary-ab-canada-334c5041.html
34e012b,2025-12-08,Lauryn Hill,e8414012-4a1c-4ad4-be5e-fc55294e28cc,"Hill, Lauryn",Artist in Residence,Southern Alberta Jubilee Auditorium,63d62ea7,Calgary,Alberta,AB,Canada,CA,51.050112282,-114.085285152,16,Intro; Everything Is Everything; When It Hurts So Bad; Final Hour; Lost Ones; Ex-Factor; To Zion; Superstar; Can't Take My Eyes Off You; ; ; ; Killing Me Softly With His Song; Doo Wop (That Thing); Ready or Not; Fu-Gee-La,https://www.setlist.fm/setlist/lauryn-hill/2025/southern-alberta-jubilee-auditorium-calgary-ab-canada-34e012b.html
2b4c64de,2025-12-08,Lauryn Hill,e8414012-4a1c-4ad4-be5e-fc55294e28cc,"Hill, Lauryn",Artist in Residence,Southern Alberta Jubilee Auditorium,63d62ea7,Calgary,Alberta,AB,Canada,CA,51.050112282,-114.085285152,0,,https://www.setlist.fm/setlist/lauryn-hill/2025/southern-alberta-jubilee-auditorium-calgary-ab-canada-2b4c64de.html
334c48e1,2025-12-06,Steven Page,6837f020-f677-4438-ae4e-24467811d309,"Page, Steven",,Southern Alberta Jubilee Auditorium,63d62ea7,Calgary,Alberta,AB,Canada,CA,51.050112282,-114.085285152,1,Jane,https://www.setlist.fm/setlist/steven-page/2025/southern-alberta-jubilee-auditorium-calgary-ab-canada-334c48e1.html
234c0c5f,2025-12-05,grandson,cc699fe3-db51-4837-928f-8f712c61a01a,grandson,Inertia Tour,"MacEwan Hall, University of Calgary",3d4615f,Calgary,Alberta,AB,Canada,CA,51.050112282,-114.085285152,23,Killing in the Name; AUTONOMOUS DELIVERY ROBOT; BURY YOU; We Did It!!!; Oh No!!!; BELLS OF WAR; Stigmata; GOD IS AN ANIMAL; PULL THE TRIGGER; Darkside; Overdose; 6:00; LITTLE WHITE LIES; Masters of War; SELF IMMOLATION; BRAINROT; WHO'S THE ENEMY; Fallin (Temptation); Heather; Drones; YOU MADE ME THIS WAY; Blood // Water; Stick Up,https://www.setlist.fm/setlist/grandson/2025/macewan-hall-university-of-calgary-calgary-ab-canada-234c0c5f.html
234c2c23,2025-12-02,Dave Chappelle,7e37a1bf-3442-4c60-9dda-06989b869eab,"Chappelle, Dave",,Scotiabank Saddledome,13d7a181,Calgary,Alberta,AB,Canada,CA,51.050112282,-114.085285152,0,,https://www.setlist.fm/setlist/dave-chappelle/2025/scotiabank-saddledome-calgary-ab-canada-234c2c23.html
7b4c3ef8,2025-12-01,Foxwarren,81239c30-1f43-498f-a319-37218922d232,Foxwarren,,The Palace Theatre,6bd2e222,Calgary,Alberta,AB,Canada,CA,51.050112282,-114.085285152,0,,https://www.setlist.fm/setlist/foxwarren/2025/the-palace-theatre-calgary-ab-canada-7b4c3ef8.html
734c3ef1,2025-12-01,Hannah Frances,22ff2821-2d94-4066-9b46-994ce3e32f2c,"Frances, Hannah",,The Palace Theatre,6bd2e222,Calgary,Alberta,AB,Canada,CA,51.050112282,-114.085285152,0,,https://www.setlist.fm/setlist/hannah-frances/2025/the-palace-theatre-calgary-ab-canada-734c3ef1.html
b4cfdde,2025-11-30,Rivers of Nihil,a802fee7-86d5-4043-94a3-a5cc5b121cc9,Rivers of Nihil,,The Palace Theatre,6bd2e222,Calgary,Alberta,AB,Canada,CA,51.050112282,-114.085285152,0,,https://www.setlist.fm/setlist/rivers-of-nihil/2025/the-palace-theatre-calgary-ab-canada-b4cfdde.html
1b4cfdec,2025-11-30,Psycroptic,e984de0f-7744-4f87-ac42-bed48b920842,Psycroptic,,The Palace Theatre,6bd2e222,Calgary,Alberta,AB,Canada,CA,51.050112282,-114.085285152,0,,https://www.setlist.fm/setlist/psycroptic/2025/the-palace-theatre-calgary-ab-canada-1b4cfdec.html
134cfdf9,2025-11-30,Ne Obliviscaris,75359245-49cf-4991-932f-e078408481f2,Ne Obliviscaris,North American Headline Tour 2025,The Palace Theatre,6bd2e222,Calgary,Alberta,AB,Canada,CA,51.050112282,-114.085285152,0,,https://www.setlist.fm/setlist/ne-obliviscaris/2025/the-palace-theatre-calgary-ab-canada-134cfdf9.html
6341aa97,2025-11-29,mgk,f6af669a-56ea-448a-a044-de76181ada33,mgk,Lost Americana Tour,Scotiabank Saddledome,13d7a181,Calgary,Alberta,AB,Canada,CA,51.050112282,-114.085285152,33,outlaw overture; starman; dont wait run fast; maybe / Wild Boy / El Diablo; ay!; goddamn; I Think I'm OKAY; title track; kiss kiss; drunk face; bloody valentine; forget me too; all I know; secrets; Who I Was; sun to me; Lonely Road; miss sunshine; Iris; lonely; WWIII; concert for aliens; my ex's best friend; jawbreaker; nothing inside; banyan tree - interlude; play this when i'm gone; papercuts; your name forever; make up sex; cliché; sweet coraline; vampire diaries,https://www.setlist.fm/setlist/mgk/2025/scotiabank-saddledome-calgary-ab-canada-6341aa97.html
534f6721,2025-11-29,drug bug,cf145968-8b64-4f0a-9f2e-b235d38a6483,drug bug,,Loophole Coffee Bar,5bd1f340,Calgary,Alberta,AB,Canada,CA,51.050112282,-114.085285152,7,cut your hair; I can't help myself; sometimes it gets worse; And Your Bird Can Sing; boy kisser; ♥; lost in translation,https://www.setlist.fm/setlist/drug-bug/2025/loophole-coffee-bar-calgary-ab-canada-534f6721.html
3b4cd4f8,2025-11-29,Headstones,85ee4cdd-a6e8-44e2-b3d6-dfd0176844e4,Headstones,,Grey Eagle Resort & Casino,23d44c13,Calgary,Alberta,AB,Canada,CA,51.050112282,-114.085285152,12,Tweeter and the Monkey Man; Leave it All Behind; When Something Stands for Nothing; An Effort to Forget; Cubically Contained; Oh My God! / New Orleans Is Sinking / House of the Rising Sun / Sympathy for the Devil / Time / Oh My God!; Three Angels; Navigate; Cemetery; Unsound / People Are Strange / Unsound; Devil's On Fire / Blow at High Dough; Smile & Wave / Eve of Destruction / Smile & Wave,https://www.setlist.fm/setlist/headstones/2025/grey-eagle-resort-and-casino-calgary-ab-canada-3b4cd4f8.html
3419daf,2025-11-29,Julia Wolf,f4e4a8c2-4ee8-42eb-9c6a-0c21a06097a6,"Wolf, Julia",,Scotiabank Saddledome,13d7a181,Calgary,Alberta,AB,Canada,CA,51.050112282,-114.085285152,8,Loser; FYP; Kill You Off; Pearl; Wishbone; Jennifer's Body; Sunshine State; In My Room,https://www.setlist.fm/setlist/julia-wolf/2025/scotiabank-saddledome-calgary-ab-canada-3419daf.html
334cd411,2025-11-29,Snotty Nose Rez Kids,595e4d8a-22e9-44fc-b2a7-dd6f898dec9d,Snotty Nose Rez Kids,,"MacEwan Hall, University of Calgary",3d4615f,Calgary,Alberta,AB,Canada,CA,51.050112282,-114.085285152,10,PAINT THE TOWN RED; DAMN RIGHT; If I Die Today; NO DOGS ALLOWED; I Got Paid Today; LET YA HAIR DOWN; Uncle Rico; I Can't Remember My Name; BBE; Sink or Swim,https://www.setlist.fm/setlist/snotty-nose-rez-kids/2025/macewan-hall-university-of-calgary-calgary-ab-canada-334cd411.html
2b4cd4fe,2025-11-29,The Tea Party,7ebc552b-71b2-47b7-9dc8-31ef08e20aec,"Tea Party, The",,Grey Eagle Resort & Casino,23d44c13,Calgary,Alberta,AB,Canada,CA,51.050112282,-114.085285152,10,Writing's on the Wall; The Bazaar; Psychopomp; The Messenger / Bobcaygeon / The Messenger; The Halcyon Days; Save Me; Heaven Coming Down; Temptation; Winter Solstice; Sister Awake / Paint It Black / Sister Awake,https://www.setlist.fm/setlist/the-tea-party/2025/grey-eagle-resort-and-casino-calgary-ab-canada-2b4cd4fe.html
2b4cd4fa,2025-11-29,Finger Eleven,0b76f632-25fa-4681-9862-86499c28afd3,Finger Eleven,,Grey Eagle Resort & Casino,23d44c13,Calgary,Alberta,AB,Canada,CA,51.050112282,-114.085285152,13,Above; Adrenaline; Falling On; Quicksand; Living in a Dream; Together Right; Last Night on Earth; One Thing; First Time; Slow Chemical; The Mountain; Good Times; That's All / Paralyzer / Back in Black,https://www.setlist.fm/setlist/finger-eleven/2025/grey-eagle-resort-and-casino-calgary-ab-canada-2b4cd4fa.html
2346c063,2025-11-29,PUP,3165f5e0-44ff-446a-81d7-c09ec69661ae,PUP,WORLD'S COOLEST GUYS CANADA TOUR 2025,"MacEwan Hall, University of Calgary",3d4615f,Calgary,Alberta,AB,Canada,CA,51.050112282,-114.085285152,22,"No Hope; My Life Is Over and I Couldn't Be Happier; Dark Days; Concrete; Robot Writes a Love Song; Free at Last; Paranoid; Totally Fine; Morbid Stuff; Kids; Scorpion Hill; Hallways; Sleep in the Heat; Closure; Familiar Patterns; Shut Up; If This Tour Doesn't Kill You, I Will; DVP; Hunger for Death; Reservoir; Old Wounds; Sabotage",https://www.setlist.fm/setlist/pup/2025/macewan-hall-university-of-calgary-calgary-ab-canada-2346c063.html
134cd929,2025-11-29,Noeline Hofmann,98e910b6-cfae-4a79-b21f-69508fd4d725,"Hofmann, Noeline",Purple Gas Tour '25,Ranchman's Cookhouse and Dancehall,63d22e57,Calgary,Alberta,AB,Canada,CA,51.050112282,-114.085285152,0,,https://www.setlist.fm/setlist/noeline-hofmann/2025/ranchmans-cookhouse-and-dancehall-calgary-ab-canada-134cd929.html
5b4ce30c,2025-11-28,Serena Ryder,15a6f792-8fb4-425b-82c9-dfac4fa845b9,"Ryder, Serena",Merry Myths Tour,Bella Concert Hall,33d03c11,Calgary,Alberta,AB,Canada,CA,51.050112282,-114.085285152,0,,https://www.setlist.fm/setlist/serena-ryder/2025/bella-concert-hall-calgary-ab-canada-5b4ce30c.html
434ce30f,2025-11-28,Lydia Persaud,4ae9adc6-8f18-480c-af70-5639688464db,"Persaud, Lydia",,Bella Concert Hall,33d03c11,Calgary,Alberta,AB,Canada,CA,51.050112282,-114.085285152,0,,https://www.setlist.fm/setlist/lydia-persaud/2025/bella-concert-hall-calgary-ab-canada-434ce30f.html
3b4ccc1c,2025-11-28,The Honest Heart Collective,99119507-b65f-453e-9ddd-63f8f5233997,"Honest Heart Collective, The",,The Palace Theatre,6bd2e222,Calgary,Alberta,AB,Canada,CA,51.050112282,-114.085285152,9,11/17; I've Got You; I Heard You're Worried About Me; Outrun; Debts; '96 Sunfire; Lonely Bones; Namesake; Atlantic City,https://www.setlist.fm/setlist/the-honest-heart-collective/2025/the-palace-theatre-calgary-ab-canada-3b4ccc1c.html
2b47ec86,2025-11-28,The Used,8262d8e4-9137-4bb3-a787-3caabbbc13e9,"Used, The",Canada 2025,Scotiabank Saddledome,13d7a181,Calgary,Alberta,AB,Canada,CA,51.050112282,-114.085285152,12,Pretty Handsome Awkward; Take It Away; The Bird and the Worm; I Caught Fire; All That I've Got; Buried Myself Alive; Fuck You; Blow Me; Listening; Blood on My Hands; The Taste of Ink; A Box Full of Sharp Objects,https://www.setlist.fm/setlist/the-used/2025/scotiabank-saddledome-calgary-ab-canada-2b47ec86.html
2b46c056,2025-11-28,Sleep Theory,e0d839ad-3880-4530-ac32-6d373006678f,Sleep Theory,,Scotiabank Saddledome,13d7a181,Calgary,Alberta,AB,Canada,CA,51.050112282,-114.085285152,2,Fallout; Static,https://www.setlist.fm/setlist/sleep-theory/2025/scotiabank-saddledome-calgary-ab-canada-2b46c056.html
2346c07f,2025-11-28,Papa Roach,c5eb9407-caeb-4303-b383-6929aa94021c,Papa Roach,Rise of the Roach Tour,Scotiabank Saddledome,13d7a181,Calgary,Alberta,AB,Canada,CA,51.050112282,-114.085285152,20,Even If It Kills Me; Blood Brothers; Dead Cell; ...To Be Loved; Kill the Noise; Getting Away With Murder; California Love; Liar; Forever / In the End; Falling Apart; Leave a Light On (Talk Away the Dark); Scars; Drum & Bass Solo; BRAINDEAD; Help; Born for Greatness; Between Angels and Insects; Infest; Medley of Nu-metal songs; Last Resort,https://www.setlist.fm/setlist/papa-roach/2025/scotiabank-saddledome-calgary-ab-canada-2346c07f.html
1b4ef5c4,2025-11-28,CELIN,aabd97be-8da2-4594-9800-e7d5fdda9653,"Simard, Celine",,James Joyce Irish Pub,63de060f,Calgary,Alberta,AB,Canada,CA,51.050112282,-114.085285152,0,,https://www.setlist.fm/setlist/celin/2025/james-joyce-irish-pub-calgary-ab-canada-1b4ef5c4.html
5b44cba4,2025-11-25,Silverstein,d89de379-665d-425c-b2e9-41b95d1edb36,Silverstein,25 Years of Noise,The Palace Theatre,6bd2e222,Calgary,Alberta,AB,Canada,CA,51.050112282,-114.085285152,20,Negative Space; Drain the Blood; Stress; The Altar; Infinite; Bad Habits; The Afterglow; Je me souviens; Massachusetts; You Gotta Stay Positive; The Artist; Vices; The End; Worlds Apart; Your Sword Versus My Dagger; Already Dead; Smile in Your Sleep; My Heroine; Smashed Into Pieces; Bleeds No More,https://www.setlist.fm/setlist/silverstein/2025/the-palace-theatre-calgary-ab-canada-5b44cba4.html
4b444b4a,2025-11-25,Bloom,85b2dffa-10c4-4100-84bd-b80de67996ee,Bloom,,The Palace Theatre,6bd2e222,Calgary,Alberta,AB,Canada,CA,51.050112282,-114.085285152,0,,https://www.setlist.fm/setlist/bloom/2025/the-palace-theatre-calgary-ab-canada-4b444b4a.html
4344cb9b,2025-11-25,Thursday,0acae232-d31a-4211-b6d0-6af1b6350274,Thursday,,The Palace Theatre,6bd2e222,Calgary,Alberta,AB,Canada,CA,51.050112282,-114.085285152,9,Signals Over the Air; Cross Out the Eyes; Jet Black New Year; This Song Brought to You by a Falling Bomb; Fast to the End; Application for Release From the Dream; The Lovesong Writer; Understanding in a Car Crash; War All the Time,https://www.setlist.fm/setlist/thursday/2025/the-palace-theatre-calgary-ab-canada-4344cb9b.html
43444b4b,2025-11-25,Free Throw,1ca441fa-7cea-4f29-939b-06d8741f74c7,Free Throw,,The Palace Theatre,6bd2e222,Calgary,Alberta,AB,Canada,CA,51.050112282,-114.085285152,0,,https://www.setlist.fm/setlist/free-throw/2025/the-palace-theatre-calgary-ab-canada-43444b4b.html
1b447dd4,2025-11-25,Trivium,1f5ff245-2837-4d4a-a609-e93e544478c3,Trivium,Struck Dead Tour,Grey Eagle Resort & Casino,23d44c13,Calgary,Alberta,AB,Canada,CA,51.050112282,-114.085285152,15,Capsizing the Sea; In Waves; Like Light to the Flies; Strife; Into the Mouth of Hell We March; Throes of Perdition; Until the World Goes Cold; Bury Me With My Screams; A Gunshot to the Head of Trepidation; Struck Dead; Dying in Your Arms; Pull Harder on the Strings of Your Martyr; The Heart From Your Hate; Down From the Sky; The Sin and the Sentence,https://www.setlist.fm/setlist/trivium/2025/grey-eagle-resort-and-casino-calgary-ab-canada-1b447dd4.html
1b44759c,2025-11-25,HERIOT,e87c14c7-d22d-4f9c-b564-2d66af0cc120,HERIOT,,Grey Eagle Resort & Casino,23d44c13,Calgary,Alberta,AB,Canada,CA,51.050112282,-114.085285152,6,Foul Void; Siege Lord; Demure; Commander of Pain; Mourn; At the Fortress Gate,https://www.setlist.fm/setlist/heriot/2025/grey-eagle-resort-and-casino-calgary-ab-canada-1b44759c.html
1344759d,2025-11-25,Jinjer,51b37017-859c-465e-8810-2d2dd41a401e,Jinjer,,Grey Eagle Resort & Casino,23d44c13,Calgary,Alberta,AB,Canada,CA,51.050112282,-114.085285152,9,"Duél; Green Serpent; Fast Draw; Hedonist; Teacher, Teacher!; Perennial; Rogue; Someone's Daughter; Pisces",https://www.setlist.fm/setlist/jinjer/2025/grey-eagle-resort-and-casino-calgary-ab-canada-1344759d.html
b4c9592,2025-11-22,Mersiv,cbf6e3a4-9508-4c90-ae2e-5651478b13e9,Mersiv,,"MacEwan Hall, University of Calgary",3d4615f,Calgary,Alberta,AB,Canada,CA,51.050112282,-114.085285152,0,,https://www.setlist.fm/setlist/mersiv/2025/macewan-hall-university-of-calgary-calgary-ab-canada-b4c9592.html
434c931f,2025-11-22,Fionn,f1b4cf18-6793-451f-97b7-2c2aec90d541,Fionn,Scum West Coast Tour 2025,Commonwealth Bar & Stage,2bd484ea,Calgary,Alberta,AB,Canada,CA,51.050112282,-114.085285152,16,Snake Behaviour; What Do You Do?; Chip Chop; I Put My Makeup On; Dreams; Zombie; Sick; The Pill; Banshee; Skeleton; Toxicity; Get Stoned; Bad at Being Casual; I Might Start Smoking; Scum; Blow,https://www.setlist.fm/setlist/fionn/2025/commonwealth-bar-and-stage-calgary-ab-canada-434c931f.html
734f5241,2025-11-21,Chastity,a57592dd-6be0-477f-b69f-67229e7d42fb,Chastity,,Modern Love,2bd1f022,Calgary,Alberta,AB,Canada,CA,51.050112282,-114.085285152,0,,https://www.setlist.fm/setlist/chastity/2025/modern-love-calgary-ab-canada-734f5241.html
3b4cb0d4,2025-11-21,Aysanabee,d4a20149-aa7a-4ccd-9f9d-515129dfca59,Aysanabee,,Commonwealth Bar & Stage,2bd484ea,Calgary,Alberta,AB,Canada,CA,51.050112282,-114.085285152,14,Embers; Edge of the Earth; Gone Baby Gone; Interlude No. 1; Long Gone; Solo; Here And Now; Somebody Else; Waste my Time; Alone; Home; Nomads; Without You; We Were Here,https://www.setlist.fm/setlist/aysanabee/2025/commonwealth-bar-and-stage-calgary-ab-canada-3b4cb0d4.html
3340e8ed,2025-11-21,The Dirty Nil,039ab342-efb8-472e-817c-5800d3a70493,"Dirty Nil, The",Fall Tour 2025,Modern Love,2bd1f022,Calgary,Alberta,AB,Canada,CA,51.050112282,-114.085285152,19,Gallop Of The Hounds; Pain of Infinity; No Weaknesses; That's What Heaven Feels Like; Rock N' Roll Band; That Don't Mean It Won't Sting; Celebration; Friends in the Sky; I Don't Want That Phone Call; Astro Ever After; Damage Control; Wrestle Yü to Hüsker Dü; This Is Me Warning Ya; Spider Dream; Fail in Time; Blunt Force Concussion; Evil Side; Doom Boy; Fuckin' Up Young,https://www.setlist.fm/setlist/the-dirty-nil/2025/modern-love-calgary-ab-canada-3340e8ed.html
134c9199,2025-11-21,Calgary Philharmonic Orchestra,8e54fed7-5974-4b43-8d02-d9a309a006ed,Calgary Philharmonic Orchestra,,Jack Singer Concert Hall,53d6c315,Calgary,Alberta,AB,Canada,CA,51.050112282,-114.085285152,5,"Starburst; Adagio for Strings; Sinfonia (for Orbiting Spheres); Symphony No. 1 in One Movement, Op. 9; Violin Concerto, Op. 14",https://www.setlist.fm/setlist/calgary-philharmonic-orchestra/2025/jack-singer-concert-hall-calgary-ab-canada-134c9199.html
334f4059,2025-11-20,MJ the Musical Broadway Original Cast,8bce84ce-a96a-445f-b427-880afc1653d6,MJ the Musical Broadway Original Cast,,Southern Alberta Jubilee Auditorium,63d62ea7,Calgary,Alberta,AB,Canada,CA,51.050112282,-114.085285152,0,,https://www.setlist.fm/setlist/mj-the-musical-broadway-original-cast/2025/southern-alberta-jubilee-auditorium-calgary-ab-canada-334f4059.html
2341f413,2025-11-20,Sloan,5a63c831-5bdb-444d-a9db-974501e3317d,Sloan,A Tour de Force,The Palace Theatre,6bd2e222,Calgary,Alberta,AB,Canada,CA,51.050112282,-114.085285152,27,Capitol Cooler; Live Forever; Scratch the Surface; Right to Roam; The Other Man; Ill Placed Trust; Baxter; Traces; Dream It All Over Again; All I Am Is All You're Not; So Far Down; The Lines You Amend; The Marquee and the Moon; Unkind; Dream Destroyer; Congratulations; Fortune Teller; No Damn Fears; I Can't Sleep; The Dogs; All Used Up; Witch's Wand; The Rest of My Life; Money City Maniacs; Snowsuit Sound; Underwhelmed; The Good in Everyone,https://www.setlist.fm/setlist/sloan/2025/the-palace-theatre-calgary-ab-canada-2341f413.html
7b452234,2025-11-16,Terri Clark,58597daa-83ea-4eec-af60-f8437dfdf0e6,"Clark, Terri",,Southern Alberta Jubilee Auditorium,63d62ea7,Calgary,Alberta,AB,Canada,CA,51.050112282,-114.085285152,0,,https://www.setlist.fm/setlist/terri-clark/2025/southern-alberta-jubilee-auditorium-calgary-ab-canada-7b452234.html
6b45222a,2025-11-16,Paul Brandt,3ca374f1-66b4-43c5-a61a-5f65f0ed7bb1,"Brandt, Paul",,Southern Alberta Jubilee Auditorium,63d62ea7,Calgary,Alberta,AB,Canada,CA,51.050112282,-114.085285152,0,,https://www.setlist.fm/setlist/paul-brandt/2025/southern-alberta-jubilee-auditorium-calgary-ab-canada-6b45222a.html
534f7f19,2025-11-16,Martin Short,32967245-ec7f-49a2-bf9f-3ed659005ffa,"Short, Martin",,Southern Alberta Jubilee Auditorium,63d62ea7,Calgary,Alberta,AB,Canada,CA,51.050112282,-114.085285152,0,,https://www.setlist.fm/setlist/martin-short/2025/southern-alberta-jubilee-auditorium-calgary-ab-canada-534f7f19.html
4b4f0f12,2025-11-15,The Halluci Nation,284ee768-2c9a-440a-be37-db926e90fc1c,"Halluci Nation, The",,Commonwealth Bar & Stage,2bd484ea,Calgary,Alberta,AB,Canada,CA,51.050112282,-114.085285152,0,,https://www.setlist.fm/setlist/the-halluci-nation/2025/commonwealth-bar-and-stage-calgary-ab-canada-4b4f0f12.html
7b4082cc,2025-11-14,Wine Lips,2ddac23f-58b9-4cad-9549-9c6be4d0bf17,Wine Lips,Hungry for a Knuckle Sandwich,Dicken's Pub,3bd79cd8,Calgary,Alberta,AB,Canada,CA,51.050112282,-114.085285152,0,,https://www.setlist.fm/setlist/wine-lips/2025/dickens-pub-calgary-ab-canada-7b4082cc.html
434ffbb3,2025-11-13,Distant,525bc102-00fa-4e0f-9d14-d994d5bf63e9,Distant,,Dicken's Pub,3bd79cd8,Calgary,Alberta,AB,Canada,CA,51.050112282,-114.085285152,0,,https://www.setlist.fm/setlist/distant/2025/dickens-pub-calgary-ab-canada-434ffbb3.html
2347a043,2025-11-13,Ingested,5a92705b-5925-4616-b178-c3e60877aa24,Ingested,EvisceraTour North America 2025,Dicken's Pub,3bd79cd8,Calgary,Alberta,AB,Canada,CA,51.050112282,-114.085285152,0,,https://www.setlist.fm/setlist/ingested/2025/dickens-pub-calgary-ab-canada-2347a043.html
1b4f05f8,2025-11-13,Ov Sulfur,6af2bf23-bd79-4d55-81b1-d1c158339c2c,Ov Sulfur,,Dicken's Pub,3bd79cd8,Calgary,Alberta,AB,Canada,CA,51.050112282,-114.085285152,0,,https://www.setlist.fm/setlist/ov-sulfur/2025/dickens-pub-calgary-ab-canada-1b4f05f8.html
3341c485,2025-11-12,Virginia to Vegas,ce10465f-3f89-4777-8909-298d95e92a9c,Virginia to Vegas,an examination of it all,Modern Love,2bd1f022,Calgary,Alberta,AB,Canada,CA,51.050112282,-114.085285152,20,intro; u up?; no excuses; break up with that guy.; Selfish; Last Night; Malibu; Told You So; Arizona Iced Tea; r.i.p.; Perfume; Just Friends; amnesia; million ways; heaven tonight; TIME!; intro / What Are We; We Are Stars; betterman; Lights Out,https://www.setlist.fm/setlist/virginia-to-vegas/2025/modern-love-calgary-ab-canada-3341c485.html
23417c43,2025-11-12,GoGo Penguin,b328de0e-ee48-4d74-9d36-7c7ee16ffc69,GoGo Penguin,,The Palace Theatre,6bd2e222,Calgary,Alberta,AB,Canada,CA,51.050112282,-114.085285152,0,,https://www.setlist.fm/setlist/gogo-penguin/2025/the-palace-theatre-calgary-ab-canada-23417c43.html
7b45223c,2025-11-11,Wyatt Flores,4ae67eb7-c01c-4d71-b995-21b093fcb888,"Flores, Wyatt",,The Palace Theatre,6bd2e222,Calgary,Alberta,AB,Canada,CA,51.050112282,-114.085285152,21,Welcome to the Plains; West of Tulsa; Running Out of Time; Oh Susannah; Little Town; Wildcat / You Can Have the Crown; Break My Bones; 3/13; Stillwater; Losing Sleep; I Believe in God; Forget Your Voice; When I Die; Drunk in Love; Holes; Orange Bottles; How to Save a Life; Please Don't Go; Milwaukee; Don't Wanna Say Goodnight; Wish I Could Stay,https://www.setlist.fm/setlist/wyatt-flores/2025/the-palace-theatre-calgary-ab-canada-7b45223c.html
3b4f64f0,2025-11-10,Shayfer James,53d2ae18-de31-4fd2-b368-82e6c1cebeb2,"James, Shayfer",,Dicken's Pub,3bd79cd8,Calgary,Alberta,AB,Canada,CA,51.050112282,-114.085285152,12,Weight of the World; First Date; Lighthouse Keeper; Blood Moon Love; For the Departed; Cavalry; Make a Wish; The Deed; Ferryman; Hell of a Dream; Villainous Thing; One Foot In The Grave,https://www.setlist.fm/setlist/shayfer-james/2025/dickens-pub-calgary-ab-canada-3b4f64f0.html
