event_id,event_date,artist_name,artist_mbid,artist_sort_name,tour_name,venue_name,venue_id,city_name,state,state_code,country_name,country_code,lat,lng,song_count,songs,setlist_url
b41fdce,2025-09-19,Closetalkers,7a17a145-78c0-471a-b923-6257268365fe,Closetalkers,,The Palace Theatre,6bd2e222,Calgary,Alberta,AB,Canada,CA,51.050112282,-114.085285152,0,,https://www.setlist.fm/setlist/closetalkers/2025/the-palace-theatre-calgary-ab-canada-b41fdce.html
341fdcb,2025-09-19,Prowl,2fb86f63-5014-4548-83c1-89e00e878a4b,Prowl,,The Palace Theatre,6bd2e222,Calgary,Alberta,AB,Canada,CA,51.050112282,-114.085285152,0,,https://www.setlist.fm/setlist/prowl/2025/the-palace-theatre-calgary-ab-canada-341fdcb.html
2b41b8c2,2025-09-19,Comeback Kid,6d152109-c447-446d-9a06-3621c920bebd,Comeback Kid,Wake the Dead 20th Anniversary,The Palace Theatre,6bd2e222,Calgary,Alberta,AB,Canada,CA,51.050112282,-114.085285152,18,False Idols Fall; My Other Side; Wake the Dead; The Trouble I Love; Talk Is Cheap; Partners in Crime; Our Distance; Bright Lights Keep Shining; Falling Apart; Losing Patience; Final Goodbye; Heavy Steps; G.M. Vincent & I; Absolute; Broadcasting...; All in a Year; Step Ahead; Wake the Dead,https://www.setlist.fm/setlist/comeback-kid/2025/the-palace-theatre-calgary-ab-canada-2b41b8c2.html
1b41fdc8,2025-09-19,Punitive Damage,c119ee5f-1477-423e-8917-c6985d79866b,Punitive Damage,,The Palace Theatre,6bd2e222,Calgary,Alberta,AB,Canada,CA,51.050112282,-114.085285152,0,,https://www.setlist.fm/setlist/punitive-damage/2025/the-palace-theatre-calgary-ab-canada-1b41fdc8.html
1341fdc9,2025-09-19,The Flatliners,e5b8c0f3-0752-4a76-987a-96098ce9d490,"Flatliners, The",,The Palace Theatre,6bd2e222,Calgary,Alberta,AB,Canada,CA,51.050112282,-114.085285152,0,,https://www.setlist.fm/setlist/the-flatliners/2025/the-palace-theatre-calgary-ab-canada-1341fdc9.html
43419f97,2025-09-18,Noah Reid,30172ece-2bd2-4d58-a568-529785520be9,"Reid, Noah",Live Again,Bella Concert Hall,33d03c11,Calgary,Alberta,AB,Canada,CA,51.050112282,-114.085285152,14,Runaway; Left Behind; Rivers Underground; Walk Before You Crawl; Got You; Sunport; False Alarms; Germantown; Just For Tonight; Underwater; American Roads; Heroes/Ghosts; Everything's Fine; A Case of You,https://www.setlist.fm/setlist/noah-reid/2025/bella-concert-hall-calgary-ab-canada-43419f97.html
734cfaed,2025-09-16,Dune Rats,6089bcad-bf45-4f34-939c-ba708c0aaf97,Dune Rats,,Modern Love,2bd1f022,Calgary,Alberta,AB,Canada,CA,51.050112282,-114.085285152,17,"Dr Dr; Dead, Rich or In Jail; 6 Pack; Red Light Green Light; UP; What a Memorable Night; Cheapskate; Dalai Lama, Big Banana, Marijuana; Scott Green; Superman; Too Tough Terry; Rich Kid Rehab; Paper Cuts; Beers, Bongs and Bullshit; Bullshit; Blister in the Sun; Color Television",https://www.setlist.fm/setlist/dune-rats/2025/modern-love-calgary-ab-canada-734cfaed.html
73473ee9,2025-09-16,Be’lakor,bc9ffd36-64be-4d41-8034-473f4b524159,Be’lakor,2025 North American Tour,Dicken's Pub,3bd79cd8,Calgary,Alberta,AB,Canada,CA,51.050112282,-114.085285152,9,Valence; Venator; Fraught; Neither Shape nor Shadow; Abeyance; Remnants; Roots to Sever; Countless Skies; The Smoke of Many Fires,https://www.setlist.fm/setlist/belakor/2025/dickens-pub-calgary-ab-canada-73473ee9.html
6344da4b,2025-09-15,A Wilhelm Scream,657ec972-3ab1-48a8-b472-1f1c210aaf17,"Wilhelm Scream, A",Canada 2025,Modern Love,2bd1f022,Calgary,Alberta,AB,Canada,CA,51.050112282,-114.085285152,17,"I Wipe My Ass With Showbiz / 5 to 9; Me vs. Morrissey in the Pretentiousness Contest (The Ladder Match); Mute Print; GIMMETHESHAKES; Be One to No One; The Kids Can Eat a Bag of Dicks; Boat Builders; Jaws 3, People 0; The Last Laugh; Anchor End; Devil Don’t Know; Yo Canada; The Horse; Congratulations; Famous Friends and Fashion Drunks; The King is Dead; Killing It",https://www.setlist.fm/setlist/a-wilhelm-scream/2025/modern-love-calgary-ab-canada-6344da4b.html
7b41628c,2025-09-14,Dwarves,762e1e6d-ba12-4946-b8ee-dfa0cf9a2655,Dwarves,,The Blox,43de0b83,Calgary,Alberta,AB,Canada,CA,51.050112282,-114.085285152,0,,https://www.setlist.fm/setlist/dwarves/2025/the-blox-calgary-ab-canada-7b41628c.html
3b4328ac,2025-09-14,Diesel Boy,044cb251-d596-40e2-a4a8-6b2943af05c9,Diesel Boy,,Dicken's Pub,3bd79cd8,Calgary,Alberta,AB,Canada,CA,51.050112282,-114.085285152,0,,https://www.setlist.fm/setlist/diesel-boy/2025/dickens-pub-calgary-ab-canada-3b4328ac.html
b41d1be,2025-09-13,CELIN,aabd97be-8da2-4594-9800-e7d5fdda9653,"Simard, Celine",,Highland Park Community Centre,3bde6878,Calgary,Alberta,AB,Canada,CA,51.050112282,-114.085285152,0,,https://www.setlist.fm/setlist/celin/2025/highland-park-community-centre-calgary-ab-canada-b41d1be.html
4340ab4b,2025-09-13,Dying Remains,5c1a6056-111e-4999-80a7-af4c0fd047a7,Dying Remains,,Rock Shop Experience,63de2263,Calgary,Alberta,AB,Canada,CA,51.050112282,-114.085285152,0,,https://www.setlist.fm/setlist/dying-remains/2025/rock-shop-experience-calgary-ab-canada-4340ab4b.html
2341fc4b,2025-09-13,CELIN,aabd97be-8da2-4594-9800-e7d5fdda9653,"Simard, Celine",,Food Bank,73de6ec9,Airdrie,Alberta,AB,Canada,CA,51.300112114,-114.03528302,0,,https://www.setlist.fm/setlist/celin/2025/food-bank-airdrie-ab-canada-2341fc4b.html
1340211d,2025-09-13,Matt Mays,87f02750-fb8a-462c-9f3d-a43ec609fcb1,"Mays, Matt",,Big Rock Brewery,43d2a7e3,Calgary,Alberta,AB,Canada,CA,51.050112282,-114.085285152,17,"Indio; Tall Trees; City of Lakes; NYC Girls; Tall Trees; Building a Boat; Station Out of Range; Travellin'; The Plan; City of Lakes; Chase the Light; Something Else; Dance Now, Cry Later; Take It on Faith; Terminal Romance; Cocaine Cowgirl; On the Hood",https://www.setlist.fm/setlist/matt-mays/2025/big-rock-brewery-calgary-ab-canada-1340211d.html
735b6ea1,2025-09-12,Aqua,a1ed5e33-22ff-4e7d-a457-42f4309e135f,Aqua,,Grey Eagle Resort & Casino,23d44c13,Calgary,Alberta,AB,Canada,CA,51.050112282,-114.085285152,17,Aquarius; Back to the 80's; Around the World; My Oh My; Turn Back Time; Dirty Little Pop Song; Happy Boys & Girls; Calling You; Doctor Jones; René DJ Set Intermission; Good Morning Sunshine; Back From Mars; My Mamma Said; Cartoon Heroes; Barbie Girl; Lollipop (Candyman); Roses Are Red,https://www.setlist.fm/setlist/aqua/2025/grey-eagle-resort-and-casino-calgary-ab-canada-735b6ea1.html
6b405e4e,2025-09-12,Alana Springsteen,eb1099c1-3ee0-49d3-8b6a-16ae5ae50004,"Springsteen, Alana",,Scotiabank Saddledome,13d7a181,Calgary,Alberta,AB,Canada,CA,51.050112282,-114.085285152,8,You Don't Deserve a Country Song; Look I like / Style; ghost in my guitar; ; Same God; Before He Cheats; cowboys and tequila; goodbye looks good on you,https://www.setlist.fm/setlist/alana-springsteen/2025/scotiabank-saddledome-calgary-ab-canada-6b405e4e.html
6b405e42,2025-09-12,Karley Scott Collins,836e296c-2938-45a5-9d18-a298661dac21,Karley Scott Collins,,Scotiabank Saddledome,13d7a181,Calgary,Alberta,AB,Canada,CA,51.050112282,-114.085285152,9,Easy to leave; Runner; Cowboy Sh!t; Bad bad; Quit You; American Boy; Quit You; Heavenly; Rock song,https://www.setlist.fm/setlist/karley-scott-collins/2025/scotiabank-saddledome-calgary-ab-canada-6b405e42.html
63405e4b,2025-09-12,Chase Matthew,b9bdc8af-9641-4958-8eb3-1bead9ff632d,"Matthew, Chase",,Scotiabank Saddledome,13d7a181,Calgary,Alberta,AB,Canada,CA,51.050112282,-114.085285152,11,Drives My Truck; Pull Up; NO WAY AROUND IT; Back in Black / Give It Away / Killing in the Name / You Shook Me All Night Long; County Line; We All Grow Up; Born for This; Small Town Shit; Cha Cha Slide; Darlin'; Love You Again,https://www.setlist.fm/setlist/chase-matthew/2025/scotiabank-saddledome-calgary-ab-canada-63405e4b.html
53406bc5,2025-09-12,Kiesza,87ff5ccd-64cd-45d6-bba3-ba2647e85d74,Kiesza,,Grey Eagle Resort & Casino,23d44c13,Calgary,Alberta,AB,Canada,CA,51.050112282,-114.085285152,8,So Erotic; Heaven Ain't Calling; Runway; Ruin My Life; It's My Birthday; Stays in Bed; Hideaway; I Go Dance,https://www.setlist.fm/setlist/kiesza/2025/grey-eagle-resort-and-casino-calgary-ab-canada-53406bc5.html
43405fd3,2025-09-12,Tribunal,7150a102-5feb-416a-b8f8-53ef5f052e84,Tribunal,Western Ruin Tour 2025,Vern's,3d03d83,Calgary,Alberta,AB,Canada,CA,51.050112282,-114.085285152,10,Incarnadine; A Wound Unhealing; Of Creeping Moss and Crumbled Stone; The Sword of the Slain; Armoured in Shadow; ...And the Thorn-Choked Flowers Grow; Between the Sea and Stars; Without Answer; Initiation; Apathy’s Keep,https://www.setlist.fm/setlist/tribunal/2025/verns-calgary-ab-canada-43405fd3.html
2b41fc5e,2025-09-12,D.O.A.,0f0b2f97-a073-4a92-ab99-ff7980ad7fca,D.O.A.,Summer Tour 2025,The Palomino,7bd78a00,Calgary,Alberta,AB,Canada,CA,51.050112282,-114.085285152,0,,https://www.setlist.fm/setlist/doa/2025/the-palomino-calgary-ab-canada-2b41fc5e.html
1340617d,2025-09-12,Keith Urban,f45da029-7b00-4bf3-962c-0eeb20309cc4,"Urban, Keith",High and Alive World Tour,Scotiabank Saddledome,13d7a181,Calgary,Alberta,AB,Canada,CA,51.050112282,-114.085285152,21,Straight Line; Where the Blacktop Ends; Long Hot Summer; Messed Up as Me; Better Life; You Look Good in My Shirt; Somewhere in My Car; Cop Car; Days Go By / I Had Some Help; Heart Like a Hometown; Kiss a Girl / Who Wouldn't Wanna Be Me; The Fighter; Somebody Like You; One Too Many; Pink Pony Club; You'll Think of Me; Blue Ain't Your Color; Wasted Time; Making Memories of Us; Turn Me Loose; You Get What You Give,https://www.setlist.fm/setlist/keith-urban/2025/scotiabank-saddledome-calgary-ab-canada-1340617d.html
5b452370,2025-09-11,Justin Moore,ab5d785b-ff87-48b5-b9e1-027e3c21ec0d,"Moore, Justin",,Grey Eagle Resort & Casino,23d44c13,Calgary,Alberta,AB,Canada,CA,51.050112282,-114.085285152,18,How I Got to Be This Way; Bait a Hook; You Look Like I Need a Drink; Til My Last Day; Kinda Don't Care; The Ones That Didn't Make It Back Home; Flyin' Down a Back Road; Stray Dogs; Lettin' the Night Roll; With a Little Help From My Friends; If Heaven Wasn't So Far Away; Small Town USA; Hank It; I Could Kick Your Ass; Point at You; Backwoods; This Is My Dirt; Why We Drink,https://www.setlist.fm/setlist/justin-moore/2025/grey-eagle-resort-and-casino-calgary-ab-canada-5b452370.html
5b4267c0,2025-09-11,Your Arms Are My Cocoon,d61394f7-3b8a-4171-8cd9-2f73a74e18b9,Your Arms Are My Cocoon,,Rosscarrock Community Hall,53de0731,Calgary,Alberta,AB,Canada,CA,51.050112282,-114.085285152,10,Snowy!; muffled beneath the sound of the ocean; Raisin Lungs; In October of 2019 I Called a Suicide Hotline for the First Time in My Life; city on fire (closeness); portraits; Illinois//Alberta; houston; death of a rabbit; Metamorphosis,https://www.setlist.fm/setlist/your-arms-are-my-cocoon/2025/rosscarrock-community-hall-calgary-ab-canada-5b4267c0.html
3b4678a4,2025-09-11,Descendents,f035837e-4117-438d-a524-cacf43500e68,Descendents,Canadian Tour 2025,"MacEwan Hall, University of Calgary",3d4615f,Calgary,Alberta,AB,Canada,CA,51.050112282,-114.085285152,0,,https://www.setlist.fm/setlist/descendents/2025/macewan-hall-university-of-calgary-calgary-ab-canada-3b4678a4.html
2b46789a,2025-09-11,Mattstagraham,7b647337-3c61-4bbc-b811-66eaeb14892f,Mattstagraham,,"MacEwan Hall, University of Calgary",3d4615f,Calgary,Alberta,AB,Canada,CA,51.050112282,-114.085285152,0,,https://www.setlist.fm/setlist/mattstagraham/2025/macewan-hall-university-of-calgary-calgary-ab-canada-2b46789a.html
2346789b,2025-09-11,Buzzcocks,31e9c35b-2675-4632-8596-f9bd9286f6c8,Buzzcocks,Canadian Tour 2025,"MacEwan Hall, University of Calgary",3d4615f,Calgary,Alberta,AB,Canada,CA,51.050112282,-114.085285152,0,,https://www.setlist.fm/setlist/buzzcocks/2025/macewan-hall-university-of-calgary-calgary-ab-canada-2346789b.html
6b4072fa,2025-09-10,Astral Swans,1d6ff56c-6a24-4396-afba-b3aaab414406,Astral Swans,,The Ship and Anchor,63d7b60b,Calgary,Alberta,AB,Canada,CA,51.050112282,-114.085285152,0,,https://www.setlist.fm/setlist/astral-swans/2025/the-ship-and-anchor-calgary-ab-canada-6b4072fa.html
5b5d1794,2025-09-10,Outlaws,e1a01561-204f-49aa-8e9d-12d5d39564e1,Outlaws,,Scotiabank Saddledome,13d7a181,Calgary,Alberta,AB,Canada,CA,51.050112282,-114.085285152,6,There Goes Another Love Song; Freeborn Man; Stick Around for Rock and Roll; Southern Rock Will Never Die; Riders in the Sky; Green Grass & High Tides,https://www.setlist.fm/setlist/outlaws/2025/scotiabank-saddledome-calgary-ab-canada-5b5d1794.html
435d179f,2025-09-10,Lynyrd Skynyrd,c544ed4d-2390-4442-a83e-1ea2883b09c8,Lynyrd Skynyrd,50th Anniversary Tour,Scotiabank Saddledome,13d7a181,Calgary,Alberta,AB,Canada,CA,51.050112282,-114.085285152,16,Thunderstruck; Workin' for MCA; What's Your Name; That Smell; I Know a Little; Saturday Night Special; Down South Jukin'; Gimme Back My Bullets; The Needle and the Spoon; Tuesday's Gone; Simple Man; Gimme Three Steps; Call Me the Breeze; Sweet Home Alabama; Free Bird; Happy Trails,https://www.setlist.fm/setlist/lynyrd-skynyrd/2025/scotiabank-saddledome-calgary-ab-canada-435d179f.html
3b407434,2025-09-10,Public Enemy,bf2e15d0-4b77-469e-bfb4-f8414415baca,Public Enemy,,Grey Eagle Resort & Casino,23d44c13,Calgary,Alberta,AB,Canada,CA,51.050112282,-114.085285152,30,Intro; Show 'Em Whatcha Got; Give It Up; Shut 'Em Down; Can't Truss It; Black Steel in the Hour of Chaos; Confusion (Here Come the Drums); 911 Is a Joke; Welcome to the Terrordome; He Got Game; State of the Union (STFU); Night of the Living Baseheads; Rebel Without a Pause; Black Is Back; Harder Than You Think; The Hits Just Keep On Comin; Can't Do Nuttin' for Ya Man; Do You Wanna Go Our Way???; Don't Believe the Hype; Anti-Nigger Machine; Bring the Noise; B Side Wins Again; I Shall Not Be Moved; Public Enemy No. 1; Timebomb; Public Enemy Coming Through; 25 daze to do it; By the Time I Get to Arizona; Fight the Power; She Watch Channel Zero?!,https://www.setlist.fm/setlist/public-enemy/2025/grey-eagle-resort-and-casino-calgary-ab-canada-3b407434.html
2b4e48b2,2025-09-10,Little Super Dangerous,e57e4578-1ccb-4a86-ac12-f78af488b44c,Little Super Dangerous,,The Ship and Anchor,63d7b60b,Calgary,Alberta,AB,Canada,CA,51.050112282,-114.085285152,2,Blue Eyes Crying in the Rain; You Are a Runner and I Am My Father's Son,https://www.setlist.fm/setlist/little-super-dangerous/2025/the-ship-and-anchor-calgary-ab-canada-2b4e48b2.html
1b400518,2025-09-08,Wand,5dc7b78d-7777-4dd7-87e2-fbe9f42f7e42,Wand,,The Palomino,7bd78a00,Calgary,Alberta,AB,Canada,CA,51.050112282,-114.085285152,3,Flying Golem; Melted Rope; Rio Grande,https://www.setlist.fm/setlist/wand/2025/the-palomino-calgary-ab-canada-1b400518.html
73401a91,2025-09-07,Tebby and the Heavy,cb6de8c6-32c5-42a5-8b84-5a67e1f6792d,Tebby and the Heavy,,The Palomino,7bd78a00,Calgary,Alberta,AB,Canada,CA,51.050112282,-114.085285152,0,,https://www.setlist.fm/setlist/tebby-and-the-heavy/2025/the-palomino-calgary-ab-canada-73401a91.html
53401705,2025-09-07,The Mystery Lights,9285e35e-275c-413f-aec5-a7172fb94577,"Mystery Lights, The",,The Palomino,7bd78a00,Calgary,Alberta,AB,Canada,CA,51.050112282,-114.085285152,0,,https://www.setlist.fm/setlist/the-mystery-lights/2025/the-palomino-calgary-ab-canada-53401705.html
43401703,2025-09-07,Witch Victim,068ebaf5-389e-4a9c-977c-aec71a9900c6,Witch Victim,,The Palomino,7bd78a00,Calgary,Alberta,AB,Canada,CA,51.050112282,-114.085285152,0,,https://www.setlist.fm/setlist/witch-victim/2025/the-palomino-calgary-ab-canada-43401703.html
b48cd72,2025-09-06,Kontravoid,a90da468-5d4f-482d-9f90-c4d52b3ee33a,Kontravoid,,Dicken's Pub,3bd79cd8,Calgary,Alberta,AB,Canada,CA,51.050112282,-114.085285152,0,,https://www.setlist.fm/setlist/kontravoid/2025/dickens-pub-calgary-ab-canada-b48cd72.html
7b403a1c,2025-09-06,Caifanes,77814bfb-f1b0-47fd-8492-65d6f72c246d,Caifanes,Caifanes 2025,"MacEwan Hall, University of Calgary",3d4615f,Calgary,Alberta,AB,Canada,CA,51.050112282,-114.085285152,0,,https://www.setlist.fm/setlist/caifanes/2025/macewan-hall-university-of-calgary-calgary-ab-canada-7b403a1c.html
3b41d0c4,2025-09-06,L.A. Witch,38e89263-3d3c-4ccb-ae29-9c31dcff0777,L.A. Witch,,The Palomino,7bd78a00,Calgary,Alberta,AB,Canada,CA,51.050112282,-114.085285152,0,,https://www.setlist.fm/setlist/la-witch/2025/the-palomino-calgary-ab-canada-3b41d0c4.html
348cd77,2025-09-06,Devours,98861c0d-f306-4ce0-a845-a517d254277d,Devours,,Dicken's Pub,3bd79cd8,Calgary,Alberta,AB,Canada,CA,51.050112282,-114.085285152,0,,https://www.setlist.fm/setlist/devours/2025/dickens-pub-calgary-ab-canada-348cd77.html
3402107,2025-09-06,Michael Bublé,611700cf-27f0-4dc9-ae80-c513a767853e,"Bublé, Michael",,Spruce Meadows,6bde8a82,Calgary,Alberta,AB,Canada,CA,51.050112282,-114.085285152,16,Feeling Good; L-O-V-E; Such a Night; Sway; When You're Smiling (The Whole World Smiles With You); Home; Everything; You're Nobody Till Somebody Loves You; To Love Somebody; Fly Me to the Moon; Haven't Met You Yet; Ballad; Just a Gigolo; You Never Can Tell; How Sweet It Is (To Be Loved by You); A Song for You,https://www.setlist.fm/setlist/michael-buble/2025/spruce-meadows-calgary-ab-canada-3402107.html
1b48cd7c,2025-09-06,Scimitar,179cf927-eb7c-406b-8d12-9b4a1bc89df5,Scimitar,,Dicken's Pub,3bd79cd8,Calgary,Alberta,AB,Canada,CA,51.050112282,-114.085285152,0,,https://www.setlist.fm/setlist/scimitar/2025/dickens-pub-calgary-ab-canada-1b48cd7c.html
1b48cd70,2025-09-06,Small Breed,42722142-4478-406f-88ac-6e0237c6789e,Small Breed,,Dicken's Pub,3bd79cd8,Calgary,Alberta,AB,Canada,CA,51.050112282,-114.085285152,0,,https://www.setlist.fm/setlist/small-breed/2025/dickens-pub-calgary-ab-canada-1b48cd70.html
1348cd75,2025-09-06,More Ephemerol,62d01585-01f0-43c7-b4eb-9b383652b59f,More Ephemerol,,Dicken's Pub,3bd79cd8,Calgary,Alberta,AB,Canada,CA,51.050112282,-114.085285152,0,,https://www.setlist.fm/setlist/more-ephemerol/2025/dickens-pub-calgary-ab-canada-1348cd75.html
1340dd29,2025-09-06,Dave Hause,feb265ec-e510-4277-9451-914e3c6ceac5,"Hause, Dave",,Modern Love,2bd1f022,Calgary,Alberta,AB,Canada,CA,51.050112282,-114.085285152,10,Cellmates; Hazard Lights; Look Alive; Enough Hope; We Could Be Kings; Yer Outta My Hair; The Ditch; Jane; Dirty Fucker; Damn Personal,https://www.setlist.fm/setlist/dave-hause/2025/modern-love-calgary-ab-canada-1340dd29.html
535fd3cd,2025-09-05,Stardew Valley: Symphony of Seasons Orchestra,e46d3b90-34a6-47a8-839e-a555c549817b,Stardew Valley: Symphony of Seasons Orchestra,,Southern Alberta Jubilee Auditorium,63d62ea7,Calgary,Alberta,AB,Canada,CA,51.050112282,-114.085285152,0,,https://www.setlist.fm/setlist/stardew-valley-symphony-of-seasons-orchestra/2025/southern-alberta-jubilee-auditorium-calgary-ab-canada-535fd3cd.html
434e53af,2025-09-05,The Worried Chest,a2c2ae14-c8ae-465a-a49c-d8afdc0461e0,"Worried Chest, The",Summer's End 2025 Tour,Congress Coffee Company,73de5e11,Calgary,Alberta,AB,Canada,CA,51.050112282,-114.085285152,0,,https://www.setlist.fm/setlist/the-worried-chest/2025/congress-coffee-company-calgary-ab-canada-434e53af.html
2b41249a,2025-09-03,Tony Ann,8062c0f2-bc7e-42a3-bd63-1f35caf13bd7,"Ann, Tony",World Tour 2025,Flanagan Theatre,3bde50d8,Calgary,Alberta,AB,Canada,CA,51.050112282,-114.085285152,19,"Future Rain; RAIN (feat. ARKAI) - Orchestral Version; TIME; REMINISCE; PULSE; AWAKENING; ARIES “The Charismatic”; TAURUS ""The Tenacious""; PISCES “The Artist”; Something I Could Never Be - Piano Version; Something I Could Never Be (feat. Wrabel); The Interstellar Experience; The Final Countdown; LOST (feat. ARKAI) - Orchestral Version; EUPHORIA (feat. ARKAI) - Orchestral Version; GRIEF (feat. ARKAI) - Orchestral Version; ICARUS (feat. ARKAI) - Orchestral Version; DESIRE (feat. ARKAI) - Orchestral Version; RUSH OF LIFE (feat. ARKAI) - Orchestral Version",https://www.setlist.fm/setlist/tony-ann/2025/flanagan-theatre-calgary-ab-canada-2b41249a.html
1344f179,2025-09-03,Tony Ann,8062c0f2-bc7e-42a3-bd63-1f35caf13bd7,"Ann, Tony",World Tour 2025,Flanagan Theatre,3bde50d8,Calgary,Alberta,AB,Canada,CA,51.050112282,-114.085285152,19,"Future Rain; RAIN (feat. ARKAI) - Orchestral Version; TIME; REMINISCE; PULSE; AWAKENING; ARIES “The Charismatic”; TAURUS ""The Tenacious""; PISCES “The Artist”; Something I Could Never Be - Piano Version; Something I Could Never Be (feat. Wrabel); The Interstellar Experience; The Final Countdown; LOST (feat. ARKAI) - Orchestral Version; EUPHORIA (feat. ARKAI) - Orchestral Version; GRIEF (feat. ARKAI) - Orchestral Version; ICARUS (feat. ARKAI) - Orchestral Version; DESIRE (feat. ARKAI) - Orchestral Version; RUSH OF LIFE (feat. ARKAI) - Orchestral Version",https://www.setlist.fm/setlist/tony-ann/2025/flanagan-theatre-calgary-ab-canada-1344f179.html
7b4092a8,2025-08-31,"Damian ""Jr. Gong"" Marley feat. Stephen Marley",27133b46-3030-40d8-a7d2-248f34630f5a,"Marley, Damian “Jr. Gong” feat. Marley, Stephen",,Grey Eagle Resort & Casino,23d44c13,Calgary,Alberta,AB,Canada,CA,51.050112282,-114.085285152,0,,https://www.setlist.fm/setlist/damian-jr-gong-marley-feat-stephen-marley/2025/grey-eagle-resort-and-casino-calgary-ab-canada-7b4092a8.html
4340df8f,2025-08-31,Damian Marley feat. Stephen Marley,3ee0237f-ca2f-4350-abc3-5615a84d04b9,"Marley, Damian “Jr. Gong” feat. Marley, Stephen",,Grey Eagle Resort & Casino,23d44c13,Calgary,Alberta,AB,Canada,CA,51.050112282,-114.085285152,22,"10,000 Chariots; The Traffic Jam; Trouble; Hey Baby; Hey Girl; Trenchtown Rock / Kingston 12; All Night; Pimpa's Paradise; Keep On Grooving; Tight Ship; It Was Written; Jah Army; Medication; The Mission; Love and Inity / Punky Reggae Party; Sun Is Shining; Is This Love; Rock Stone; Road to Zion; Welcome to Jamrock; Move!; Could You Be Loved",https://www.setlist.fm/setlist/damian-marley-feat-stephen-marley/2025/grey-eagle-resort-and-casino-calgary-ab-canada-4340df8f.html
33441c59,2025-08-30,Combust,b63c74fd-4311-492e-8ebe-327cb6d781eb,Combust,,The MLB,13d18141,Calgary,Alberta,AB,Canada,CA,51.050112282,-114.085285152,10,Belly of the Beast; The Knife; Why I Hate; N.Y.H.C.; Swallowing Swords; Paid With Pain; Truth Hurts; Prison of Time; Our Own Breed; Everyone's Enemy,https://www.setlist.fm/setlist/combust/2025/the-mlb-calgary-ab-canada-33441c59.html
33441c55,2025-08-30,Meantime,defe1490-ba74-4c6e-b222-54a62ce06dd4,Meantime,,The MLB,13d18141,Calgary,Alberta,AB,Canada,CA,51.050112282,-114.085285152,9,Among the Living; Supine; Lacerate; Immured; Lock & Key; Search; Death of Youth ft. Andy Patillo; Weight; Living in the Meantime,https://www.setlist.fm/setlist/meantime/2025/the-mlb-calgary-ab-canada-33441c55.html
2b4e981a,2025-08-29,Nunslaughter,82601df5-9b5a-4fd0-bdbd-399f7cf9c754,Nunslaughter,,The Palomino,7bd78a00,Calgary,Alberta,AB,Canada,CA,51.050112282,-114.085285152,0,,https://www.setlist.fm/setlist/nunslaughter/2025/the-palomino-calgary-ab-canada-2b4e981a.html
23597cc3,2025-08-29,Wilco,9e53f84d-ef44-4c16-9677-5fd4d78cbd7d,Wilco,An August Evening With Wilco,Southern Alberta Jubilee Auditorium,63d62ea7,Calgary,Alberta,AB,Canada,CA,51.050112282,-114.085285152,31,"Story to Tell; Handshake Drugs; One Sunday Morning; I Am Trying to Break Your Heart; If I Ever Was a Child; Cruel Country; Forget the Flowers; Evicted; Spiders (Kidsmoke); Bird Without a Tail / Base of My Skull; I'm Always in Love; Hesitating Beauty; Hummingbird; It's Just That Simple; Via Chicago; California Stars; The Late Greats; Theologians; Side With the Seeds; Box Full of Letters; Annihilation; Sunken Treasure; Either Way; Impossible Germany; Jesus, Etc.; Hate It Here; Heavy Metal Drummer; I'm the Man Who Loves You; Falling Apart (Right Now); Walken; I Got You (At the End of the Century)",https://www.setlist.fm/setlist/wilco/2025/southern-alberta-jubilee-auditorium-calgary-ab-canada-23597cc3.html
4b5a87a6,2025-08-28,Lainey Wilson,a6e613d6-ff65-4972-beff-303a1b10ab05,"Wilson, Lainey",Whirlwind World Tour,Scotiabank Saddledome,13d7a181,Calgary,Alberta,AB,Canada,CA,51.050112282,-114.085285152,22,"Whirlwind; Hold My Halo; Good Horses; Devil Don’t Go There; Watermelon Moonshine; Country's Cool Again; Keep Up With Jones; Somewhere Over Laredo; Peace, Love, and Cowboys; Yesterday, All Day, Every Day; Hang Tight Honey; Hillbilly Hippie; Whiskey Colored Crayon; Would If I Could; Counting Chickens; Things a Man Oughta Know; Wildflowers and Wild Horses; Bell Bottoms Up; Call a Cowboy; Bar in Baton Rouge; 4x4xU; Heart Like a Truck",https://www.setlist.fm/setlist/lainey-wilson/2025/scotiabank-saddledome-calgary-ab-canada-4b5a87a6.html
340e9a3,2025-08-28,Seraphina,1b79a524-3d9a-4c0d-a0f1-f358cc5da8ee,Seraphina,,University of Calgary,23d420cf,Calgary,Alberta,AB,Canada,CA,51.050112282,-114.085285152,2,Cruel Summer; Blank Space,https://www.setlist.fm/setlist/seraphina/2025/university-of-calgary-calgary-ab-canada-340e9a3.html
33452091,2025-08-28,Kaitlin Butts,296e5450-de56-4cd0-8564-949145ab30f5,"Butts, Kaitlin",Roadrunner! Tour 2.0,Scotiabank Saddledome,13d7a181,Calgary,Alberta,AB,Canada,CA,51.050112282,-114.085285152,5,Bang Bang (My Baby Shot Me Down); ; Blood; Hunt You Down; You Ain't Gotta Die (to Be Dead to Me),https://www.setlist.fm/setlist/kaitlin-butts/2025/scotiabank-saddledome-calgary-ab-canada-33452091.html
1b5ac1b4,2025-08-28,ERNEST,5e154c14-de6d-4901-a6d3-68d6b45ec305,ERNEST,,Scotiabank Saddledome,13d7a181,Calgary,Alberta,AB,Canada,CA,51.050112282,-114.085285152,11,"Why Dallas; Tennessee Queen; Cowgirls; Who's Your Daddy?; Courtesy of the Red, White and Blue (The Angry American); Turn Me Up; Help Me Make It Through the Night; Family Tradition; I Had Some Help; Gettin' Gone; Flower Shops",https://www.setlist.fm/setlist/ernest/2025/scotiabank-saddledome-calgary-ab-canada-1b5ac1b4.html
33413c85,2025-08-27,Woodhawk,03f5fcd7-4b0a-4ca1-b2d0-c393f3969b94,Woodhawk,Love Finds A Way Tour,The Ship and Anchor,63d7b60b,Calgary,Alberta,AB,Canada,CA,51.050112282,-114.085285152,0,,https://www.setlist.fm/setlist/woodhawk/2025/the-ship-and-anchor-calgary-ab-canada-33413c85.html
