event_id,event_date,artist_name,artist_mbid,artist_sort_name,tour_name,venue_name,venue_id,city_name,state,state_code,country_name,country_code,lat,lng,song_count,songs,setlist_url
73468249,2025-07-09,Postmodern Jukebox,5f5d68dd-285a-4f06-9099-84eb3f85c65f,Postmodern Jukebox,Magic & Moonlight Tour,Grey Eagle Resort & Casino,23d44c13,Calgary,Alberta,AB,Canada,CA,51.050112282,-114.085285152,19,What I Like About You; This Magic Moment; Man! I Feel Like a Woman!; 50 Ways to Leave Your Lover; I'm Not the Only One; Maple Leaf Rag / In the Mood / It's Now or Never / Sir Duke / Uptown Funk; Burn; Seven Nation Army; Where Is My Mind?; The House of the Rising Sun; Wannabe; Black Hole Sun; The Ocarina of Tap (Legend of Zelda Medley); Lovefool; Misirlou; Nothing Else Matters; My Heart Will Go On; Die With a Smile; All About That Bass,https://www.setlist.fm/setlist/postmodern-jukebox/2025/grey-eagle-resort-and-casino-calgary-ab-canada-73468249.html
7345766d,2025-07-09,Tom Cochrane,825a918f-09fa-40ee-9c27-b0921d48bdbb,"Cochrane, Tom",,Prince's Island Park,3bd6d0e8,Calgary,Alberta,AB,Canada,CA,51.050112282,-114.085285152,15,Mad Mad World; Victory Day; Good Times; Sinking Like a Sunset; The Untouchable One; Big League; Bird on the Wire; Light in the Tunnel; Human Race; Can't Turn Back; White Hot; No Regrets; Life Is a Highway; Lunatic Fringe; Boy Inside the Man,https://www.setlist.fm/setlist/tom-cochrane/2025/princes-island-park-calgary-ab-canada-7345766d.html
6b452696,2025-07-09,Charles Wesley Godwin,082e1531-e8ff-43ef-8f1c-7c6600b0c00d,"Godwin, Charles Wesley",,Nashville North,1bd711d8,Calgary,Alberta,AB,Canada,CA,51.050112282,-114.085285152,0,,https://www.setlist.fm/setlist/charles-wesley-godwin/2025/nashville-north-calgary-ab-canada-6b452696.html
63457663,2025-07-09,JJ Wilde,ffae0e05-008a-4234-9b5a-dba742e57ffa,"Wilde, JJ",,Prince's Island Park,3bd6d0e8,Calgary,Alberta,AB,Canada,CA,51.050112282,-114.085285152,14,Mercy; Off the Rails; Best of Me; Takes Me Back; You Oughta Know; Mess To Make; Knees; Bad Side; Bushweed; The Rush; If I'm a Woman; Wired; Best Boy; Hands,https://www.setlist.fm/setlist/jj-wilde/2025/princes-island-park-calgary-ab-canada-63457663.html
6345268b,2025-07-09,Chase Rice,79c478c4-9bd7-42f1-8d26-f3c45ac49258,"Rice, Chase",,Nashville North,1bd711d8,Calgary,Alberta,AB,Canada,CA,51.050112282,-114.085285152,14,Drinkin' Beer. Talkin' God. Amen; Fireside; Ready Set Roll; Oklahoma; Simple Man; Cruise; Haw River; Gonna Wanna Tonight; Jack Daniel's Showed Up; Arkansas; ; Lonely If You Are; Eyes on You; Bad Day to Be a Cold Beer,https://www.setlist.fm/setlist/chase-rice/2025/nashville-north-calgary-ab-canada-6345268b.html
5b468b08,2025-07-09,Khalid,28737730-ec70-4da5-89c5-77ac13c5c34d,Khalid,,Calgary Stampede Coca Cola Stage,23d65cfb,Calgary,Alberta,AB,Canada,CA,51.050112282,-114.085285152,17,OTW; Love Lies; Silence; Another Sad Love Song; Winter; 8TEEN; Better; Shot Down; lovely; Coaster; Saved; Eastside; Saturday Nights; Location; Rollin; Talk; Young Dumb & Broke,https://www.setlist.fm/setlist/khalid/2025/calgary-stampede-coca-cola-stage-calgary-ab-canada-5b468b08.html
5b45779c,2025-07-09,Drew Gregory,0e97a980-a8db-4ac7-b738-a3f10c7e608a,"Gregory, Drew",,Nashville North,1bd711d8,Calgary,Alberta,AB,Canada,CA,51.050112282,-114.085285152,0,,https://www.setlist.fm/setlist/drew-gregory/2025/nashville-north-calgary-ab-canada-5b45779c.html
4b468b0a,2025-07-09,Aminé,12398bf3-1b99-47b7-930c-f3956773f35a,Aminé,,Calgary Stampede Coca Cola Stage,23d65cfb,Calgary,Alberta,AB,Canada,CA,51.050112282,-114.085285152,17,Arc de Triomphe; Sossaup; Riri; Feels So Good; BLACKJACK; 13MOS; meant2b; ; SHINE; Woodlawn; Vacay; REDMERCEDES; Spice Girl; ; Caroline; 4EVA; REEL IT IN,https://www.setlist.fm/setlist/amine/2025/calgary-stampede-coca-cola-stage-calgary-ab-canada-4b468b0a.html
3b4568fc,2025-07-09,Avenoir,3d2ac6d3-0092-4fdf-8012-5260ae6d24c6,Avenoir,,Calgary Stampede Coca Cola Stage,23d65cfb,Calgary,Alberta,AB,Canada,CA,51.050112282,-114.085285152,12,DIFFERENT; Eve; TMW; Too Much; AFTER HOURS; ; D4U; LINK UP; ; Favour; ; Shameless,https://www.setlist.fm/setlist/avenoir/2025/calgary-stampede-coca-cola-stage-calgary-ab-canada-3b4568fc.html
3b452cf4,2025-07-09,T‐Pain,ce55e49a-32f4-4757-9849-bf04d06d5fcc,T‐Pain,,Cowboys Stampede Tent,2bd2bcce,Calgary,Alberta,AB,Canada,CA,51.050112282,-114.085285152,19,Up Down (Do This All Day); 2 Step; Got Money; Booty Wurk (One Cheek at a Time); I'm Sprung; Blame It; Can't Believe It; Shawty; Bartender; I'm N Luv (Wit a Stripper); Not Like Us; FE!N / Kiss Kiss; Don't Stop Believin'; Tennessee Whiskey; Stay With Me; Low; Buy U a Drank (Shawty Snappin'); Welcome to My Hood; All I Do Is Win,https://www.setlist.fm/setlist/tpain/2025/cowboys-stampede-tent-calgary-ab-canada-3b452cf4.html
3b450808,2025-07-09,Jessie Murph,007188c6-2cd6-4060-9629-151433847ddf,"Murph, Jessie",WORLDWIDE HYSTERIA TOUR,Cowboys Stampede Tent,2bd2bcce,Calgary,Alberta,AB,Canada,CA,51.050112282,-114.085285152,17,Cowboys and Angels; Gucci Mane; Wild Ones; Son of a Bitch; Upgrade; Couldn’t Be Worse; Dirty; How Could You; Best Behavior; Sip; Pray; Bad as the Rest; High Road; Before He Cheats; Touch Me Like a Gangster; Heroin; Blue Strips,https://www.setlist.fm/setlist/jessie-murph/2025/cowboys-stampede-tent-calgary-ab-canada-3b450808.html
33454c39,2025-07-09,Dabin,6d539d7d-454b-44b1-b7de-881a987d4edd,Dabin,,Knoxville's Tavern Stampede Tent,73d22e71,Calgary,Alberta,AB,Canada,CA,51.050112282,-114.085285152,0,,https://www.setlist.fm/setlist/dabin/2025/knoxvilles-tavern-stampede-tent-calgary-ab-canada-33454c39.html
3345081d,2025-07-09,Alex Hughes,65cc8ea8-0f2f-4a7c-8997-1b57a2988826,"Hughes, Alex",,Nashville North,1bd711d8,Calgary,Alberta,AB,Canada,CA,51.050112282,-114.085285152,0,,https://www.setlist.fm/setlist/alex-hughes/2025/nashville-north-calgary-ab-canada-3345081d.html
2b45080e,2025-07-09,Cody Ko,47759ebe-72f0-43b0-a51b-ed1f9147bdff,"Ko, Cody",,Cowboys Dance Hall,3bd49850,Calgary,Alberta,AB,Canada,CA,51.050112282,-114.085285152,0,,https://www.setlist.fm/setlist/cody-ko/2025/cowboys-dance-hall-calgary-ab-canada-2b45080e.html
23454c33,2025-07-09,Paper Skies,87eb62a5-15fc-4d48-818b-f71a545eace6,"Skies, Paper",,Knoxville's Tavern Stampede Tent,73d22e71,Calgary,Alberta,AB,Canada,CA,51.050112282,-114.085285152,0,,https://www.setlist.fm/setlist/paper-skies/2025/knoxvilles-tavern-stampede-tent-calgary-ab-canada-23454c33.html
23450817,2025-07-09,Lil Jon,a95384b1-6aec-468c-ae0d-8c6daf87c4c2,Lil Jon,,Big Four Roadhouse,53d2e32d,Calgary,Alberta,AB,Canada,CA,51.050112282,-114.085285152,0,,https://www.setlist.fm/setlist/lil-jon/2025/big-four-roadhouse-calgary-ab-canada-23450817.html
1b47113c,2025-07-09,Sloan,5a63c831-5bdb-444d-a9db-974501e3317d,Sloan,,Wildhorse Saloon,5bd79b80,Calgary,Alberta,AB,Canada,CA,51.050112282,-114.085285152,19,Losing California; Penpals; Dream It All Over Again; Scratch the Surface; Coax Me; I Hate My Generation; Sensory Deprivation; If It Feels Good Do It; The Other Man; Who Taught You to Live Like That?; Everything You've Done Wrong; Underwhelmed; 500 Up; People of the Sky; Take It In; The Lines You Amend; Money City Maniacs; The Rest of My Life; The Good in Everyone,https://www.setlist.fm/setlist/sloan/2025/wildhorse-saloon-calgary-ab-canada-1b47113c.html
b45152e,2025-07-08,Saint Motel,5c2593bc-1621-4c4d-821b-b7bb6ff213b5,Saint Motel,The Symphony in the Sky Tour,National Saloon,33d1e86d,Calgary,Alberta,AB,Canada,CA,51.050112282,-114.085285152,12,Move; Puzzle Pieces; Get It at Home; Sisters; A Good Song Never Dies; It's All Happening; Fine Wine; Steady Hand; Sweet Talk; Cold Cold Man; Van Horn; My Type,https://www.setlist.fm/setlist/saint-motel/2025/national-saloon-calgary-ab-canada-b45152e.html
6b45269a,2025-07-08,Meghan Patrick,cde60e8b-6c8f-493f-ba83-7615c4e61909,"Patrick, Meghan",,Nashville North,1bd711d8,Calgary,Alberta,AB,Canada,CA,51.050112282,-114.085285152,0,,https://www.setlist.fm/setlist/meghan-patrick/2025/nashville-north-calgary-ab-canada-6b45269a.html
6345269f,2025-07-08,Cole Swindell,365247e5-db90-4d0e-bf2c-ca18b54fcab9,"Swindell, Cole",,Nashville North,1bd711d8,Calgary,Alberta,AB,Canada,CA,51.050112282,-114.085285152,17,Flatliner; Love You Too Late; Bottom of It; Single Saturday Night; Let Me See Ya Girl; Forever to Me; Middle of a Memory; We Can Always Move On; Chillin' It; You Should Be Here; Dale Jr; ; Never Say Never; Ain't Worth the Whiskey; Drinkaby; Neon Moon / Carrying Your Love With Me  / Pickup Man / Should've Been a Cowboy / Be My Baby Tonight  / Ain't Goin' Down ('Til the Sun Comes Up); She Had Me at Heads Carolina,https://www.setlist.fm/setlist/cole-swindell/2025/nashville-north-calgary-ab-canada-6345269f.html
63452693,2025-07-08,Graham Barham,0ddd210b-12f5-43f5-ba4b-17c9da267d4c,"Barham, Graham",,Cowboys Dance Hall,3bd49850,Calgary,Alberta,AB,Canada,CA,51.050112282,-114.085285152,15,Shoot the lock; Camo; BREAK IT IN A BAR; Beer by my Bed; DEVIL YOU KNOW; Tequila; YOU WON’T LET ME STAY; WTH Just Happened?; LIE TO ME; SOMETHING TO CHASE; Whiskey Whiskey; M.I.A; OIL MONEY; Wagon Wheel; ,https://www.setlist.fm/setlist/graham-barham/2025/cowboys-dance-hall-calgary-ab-canada-63452693.html
5b468bf4,2025-07-08,Charlotte Day Wilson,a78f1671-3ebf-4822-b2bd-70ccc3088c2d,"Wilson, Charlotte Day",,Calgary Stampede Coca Cola Stage,23d65cfb,Calgary,Alberta,AB,Canada,CA,51.050112282,-114.085285152,0,,https://www.setlist.fm/setlist/charlotte-day-wilson/2025/calgary-stampede-coca-cola-stage-calgary-ab-canada-5b468bf4.html
53468be9,2025-07-08,Tinashe,396a9525-0994-4542-b480-c4587feeb476,Tinashe,,Calgary Stampede Coca Cola Stage,23d65cfb,Calgary,Alberta,AB,Canada,CA,51.050112282,-114.085285152,19,"Match My Freak Intro; Getting No Sleep; Needs; Link Up; Bouncin / Bouncin’, Pt. 2; The Worst in Me; Throw a Fit; Talk to Me Nice; X; Unconditional; All Hands on Deck; 2 On; Cross That Line; Uh Huh; Superlove; All My Friends; No Broke Boys; Nasty (Match My Chic Remix); Nasty",https://www.setlist.fm/setlist/tinashe/2025/calgary-stampede-coca-cola-stage-calgary-ab-canada-53468be9.html
53451fc9,2025-07-08,Convictions,66bf8de7-0bb2-4cfe-8059-4ec0da132702,Convictions,,Dicken's Pub,3bd79cd8,Calgary,Alberta,AB,Canada,CA,51.050112282,-114.085285152,0,,https://www.setlist.fm/setlist/convictions/2025/dickens-pub-calgary-ab-canada-53451fc9.html
4b451fca,2025-07-08,Born of Osiris,132ca1ea-0891-420f-b129-50247bb144b5,Born of Osiris,,Dicken's Pub,3bd79cd8,Calgary,Alberta,AB,Canada,CA,51.050112282,-114.085285152,15,Open Arms to Damnation; Bow Down; Elevate; A Mind Short Circuiting; Divergency; White Nile; Empires Erased; In Desolation; Through Shadows; Ascension; Torchbearer; Abstract Art; Brace Legs; Rosecrance; Machine,https://www.setlist.fm/setlist/born-of-osiris/2025/dickens-pub-calgary-ab-canada-4b451fca.html
43468b0b,2025-07-08,Don Toliver,a0723a3c-4135-438e-85c5-012712144ede,Don Toliver,,Calgary Stampede Coca Cola Stage,23d65cfb,Calgary,Alberta,AB,Canada,CA,51.050112282,-114.085285152,22,KRYPTONITE; TORE UP; BROTHER STONE; 4X4; HAD ENOUGH; Cardigan; GANG GANG; WHAT TO DO?; FIELD TRIP; 2000 EXCURSION; No Pole; NEW DROP; CAN'T SAY; Private Landing; Smoke; Lemonade; No Idea; Too Many Nights; FWU; BANDIT; After Party; FWU,https://www.setlist.fm/setlist/don-toliver/2025/calgary-stampede-coca-cola-stage-calgary-ab-canada-43468b0b.html
43451fcb,2025-07-08,The Browning,fb759bfb-34ec-4f1d-91f9-fd46549bc3cd,"Browning, The",,Dicken's Pub,3bd79cd8,Calgary,Alberta,AB,Canada,CA,51.050112282,-114.085285152,0,,https://www.setlist.fm/setlist/the-browning/2025/dickens-pub-calgary-ab-canada-43451fcb.html
3b451cfc,2025-07-08,Gatecreeper,69a16532-cdc2-459b-8f7a-7793583d7290,Gatecreeper,Dark Superstition,The Palace Theatre,6bd2e222,Calgary,Alberta,AB,Canada,CA,51.050112282,-114.085285152,0,,https://www.setlist.fm/setlist/gatecreeper/2025/the-palace-theatre-calgary-ab-canada-3b451cfc.html
34749a7,2025-07-08,Fall Out Boy,516cef4d-0718-4007-9939-f9b38af3f784,Fall Out Boy,,Cowboys Stampede Tent,2bd2bcce,Calgary,Alberta,AB,Canada,CA,51.050112282,-114.085285152,23,"Love From the Other Side; Sugar, We're Goin Down; Grand Theft Autumn/Where Is Your Boy; A Little Less Sixteen Candles, a Little More ""Touch Me""; The Phoenix; Disloyal Order of Water Buffaloes; Thriller; Uma Thurman; Dance, Dance; Immortals; The Kids Aren't Alright; This Ain't a Scene, It's an Arms Race; I Don't Care; My Songs Know What You Did in the Dark (Light Em Up); The Last of the Real Ones; What a Catch, Donnie; Golden; So Much (for) Stardust; Fake Out; Thnks fr th Mmrs; Headfirst Slide Into Cooperstown on a Bad Bet; Centuries; Saturday",https://www.setlist.fm/setlist/fall-out-boy/2025/cowboys-stampede-tent-calgary-ab-canada-34749a7.html
345152b,2025-07-08,Alex Hughes,65cc8ea8-0f2f-4a7c-8997-1b57a2988826,"Hughes, Alex",,Nashville North,1bd711d8,Calgary,Alberta,AB,Canada,CA,51.050112282,-114.085285152,1,Cruel Summer,https://www.setlist.fm/setlist/alex-hughes/2025/nashville-north-calgary-ab-canada-345152b.html
33456435,2025-07-08,200 Stab Wounds,e9c41776-b083-443d-af79-4c6923db6db2,200 Stab Wounds,Manual Manic Procedures North American Tour 2025,The Palace Theatre,6bd2e222,Calgary,Alberta,AB,Canada,CA,51.050112282,-114.085285152,17,Phallic Filth; Drilling Your Head; Gross Abuse; Flesh from Within; Fatal Reality; Defiled Gestation; Parricide; Masters of Morbidity; Body in the Basement; Stifling Stew; Release the Stench; Hands of Eternity; Itty Bitty Pieces; Skin Milk; Tow Rope Around the Throat; She Was Already Dead; Slave to the Scalpel,https://www.setlist.fm/setlist/200-stab-wounds/2025/the-palace-theatre-calgary-ab-canada-33456435.html
2345707f,2025-07-08,Little Image,0d1c6e19-1705-401f-bfed-34c333a76926,Little Image,,Cowboy Music Festival Tent,bd3fd6a,Calgary,Alberta,AB,Canada,CA,51.050112282,-114.085285152,8,THE PRESSURE; BLUE; NOVOCAINE; OUT OF MY MIND; RUN FOR FOREVER; KILL THE GHOST; BOTTLES; WORTH IT,https://www.setlist.fm/setlist/little-image/2025/cowboy-music-festival-tent-calgary-ab-canada-2345707f.html
1b451524,2025-07-08,The Watchmen,2d117d1c-2c9c-45e3-b333-7bc867a575f1,"Watchmen, The",,Wildhorse Saloon,5bd79b80,Calgary,Alberta,AB,Canada,CA,51.050112282,-114.085285152,0,,https://www.setlist.fm/setlist/the-watchmen/2025/wildhorse-saloon-calgary-ab-canada-1b451524.html
1b40e9a4,2025-07-08,Seraphina,1b79a524-3d9a-4c0d-a0f1-f358cc5da8ee,Seraphina,,Ranchman's Uptown,73d0ca51,Calgary,Alberta,AB,Canada,CA,51.050112282,-114.085285152,8,Miss Americana & the Heartbreak Prince; Love Story; You Belong With Me; Look What You Made Me Do; Don't Blame Me; Style; Blank Space; 22,https://www.setlist.fm/setlist/seraphina/2025/ranchmans-uptown-calgary-ab-canada-1b40e9a4.html
1345153d,2025-07-08,De La Soul,a8ebde98-7e91-46c7-992c-90039ba42017,De La Soul,,Big Four Roadhouse,53d2e32d,Calgary,Alberta,AB,Canada,CA,51.050112282,-114.085285152,16,"Change in Speak; Eye Know; Say No Go; Potholes in My Lawn; Pass the Plugs; The Grind Date; Oooh; Much More; Stakes Is High; Never Been in Love; Down for the Count; Get By; A Roller Skating Jam Named ""Saturdays""; Ring Ring Ring (Ha Ha Hey); Me Myself and I; The Magic Number",https://www.setlist.fm/setlist/de-la-soul/2025/big-four-roadhouse-calgary-ab-canada-1345153d.html
7b452678,2025-07-07,Alex Hughes,65cc8ea8-0f2f-4a7c-8997-1b57a2988826,"Hughes, Alex",,Nashville North,1bd711d8,Calgary,Alberta,AB,Canada,CA,51.050112282,-114.085285152,0,,https://www.setlist.fm/setlist/alex-hughes/2025/nashville-north-calgary-ab-canada-7b452678.html
7b452668,2025-07-07,bbno$,27638856-79a1-4495-b7da-1912899560c7,bbnomoney,It's Pronounced Baby No Money World Tour 2025,National Saloon,33d1e86d,Calgary,Alberta,AB,Canada,CA,51.050112282,-114.085285152,26,it boy; ; sriracha; nursery; who dat boi; Bad Boy; mathematics; lil' freak; i see london i see france; meant to be; antidepressants; C'est La Vie; 1-800; Wagon Wheel; Goodness Gracious; Welcome to Chilis; edamame; help herself; mary poppins; two; boom; check; lalala; pogo; Whoomp! (There It Is); lalala,https://www.setlist.fm/setlist/bbno/2025/national-saloon-calgary-ab-canada-7b452668.html
7b452664,2025-07-07,Kygo,ba0e7638-0cd6-4ff4-8987-c3e224d22c23,Kygo,,Cowboys Stampede Tent,2bd2bcce,Calgary,Alberta,AB,Canada,CA,51.050112282,-114.085285152,19,Whatever; Forever Yours / Levels; Stay; Stargazing; It Ain't Me; Stars Will Align; Happy Now; Kids in Love; Sexual Healing; Hot Stuff; Lose Somebody; Freedom; What's Love Got to Do With It; Woke Up in Love; Remind Me to Forget; Stole the Show; Can't Get Enough; Higher Love; Firestone,https://www.setlist.fm/setlist/kygo/2025/cowboys-stampede-tent-calgary-ab-canada-7b452664.html
73452679,2025-07-07,Wyatt Flores,4ae67eb7-c01c-4d71-b995-21b093fcb888,"Flores, Wyatt",Welcome Back To The Plains Tour,Nashville North,1bd711d8,Calgary,Alberta,AB,Canada,CA,51.050112282,-114.085285152,14,West of Tulsa; Welcome to the Plains; Wildcat; You Can Have the Crown; Losing Sleep; Alabama; Forget Your Voice; When I Die; Orange Bottles; How to Save a Life; Milwaukee; Please Don't Go; Oh Susannah; Don't Wanna Say Goodnight,https://www.setlist.fm/setlist/wyatt-flores/2025/nashville-north-calgary-ab-canada-73452679.html
6b45267e,2025-07-07,TLC,99790314-885a-4975-8614-9c5bc890364d,TLC,,Big Four Roadhouse,53d2e32d,Calgary,Alberta,AB,Canada,CA,51.050112282,-114.085285152,16,DJ Dubz Hype Intro; Ain't 2 Proud 2 Beg; What About Your Friends; Baby-Baby-Baby; Red Light Special; Diggin' on You; Unpretty; Kick Your Game / Girl Talk / Hat 2 Da Back; Dance Break; DJ Dubz Intermission; Silly Ho / FanMail; Way Back; Case of the Fake People; Creep; No Scrubs; Waterfalls,https://www.setlist.fm/setlist/tlc/2025/big-four-roadhouse-calgary-ab-canada-6b45267e.html
6b45266e,2025-07-07,Dallas Smith,933de17e-4f37-45a4-bad6-56ad20c21b87,"Smith, Dallas",,Wildhorse Saloon,5bd79b80,Calgary,Alberta,AB,Canada,CA,51.050112282,-114.085285152,0,,https://www.setlist.fm/setlist/dallas-smith/2025/wildhorse-saloon-calgary-ab-canada-6b45266e.html
6345267b,2025-07-07,Koe Wetzel,cf59723d-febb-4481-9b9b-3cb2c7f2a7e6,"Wetzel, Koe",,Nashville North,1bd711d8,Calgary,Alberta,AB,Canada,CA,51.050112282,-114.085285152,17,"9 Lives (Black Cat); April Showers; Fuss & Fight; Forever; Twister; Should've Been a Cowboy; Good Times; Good Die Young; Ragweed; ; Creeps; Sweet Dreams; Drunk Driving; February 28, 2016; Damn Near Normal; Something to Talk About; High Road",https://www.setlist.fm/setlist/koe-wetzel/2025/nashville-north-calgary-ab-canada-6345267b.html
6345265b,2025-07-07,The All‐American Rejects,09885b8e-f235-4b80-a02a-055539493173,"All‐American Rejects, The",,Cowboys Stampede Tent,2bd2bcce,Calgary,Alberta,AB,Canada,CA,51.050112282,-114.085285152,18,"Dirty Little Secret; Fallin' Apart; My Paper Heart; One More Sad Song; Beekeeper's Daughter; I Wanna; Sandbox; Stab My Back; Swing, Swing; Sweat; Close Your Eyes; Fast and Slow; Mona Lisa; There's a Place; It Ends Tonight; Easy Come, Easy Go; Move Along; Gives You Hell",https://www.setlist.fm/setlist/the-allamerican-rejects/2025/cowboys-stampede-tent-calgary-ab-canada-6345265b.html
5b596b48,2025-07-07,Diplo,a56bd8f9-8ef8-4d63-89a4-794ed1360dd2,Diplo,,Calgary Stampede Coca Cola Stage,23d65cfb,Calgary,Alberta,AB,Canada,CA,51.050112282,-114.085285152,0,,https://www.setlist.fm/setlist/diplo/2025/calgary-stampede-coca-cola-stage-calgary-ab-canada-5b596b48.html
53468bf1,2025-07-07,MC4D,e05250ef-fa5a-4c53-be00-b0351d0b5f72,MC4D,,Calgary Stampede Coca Cola Stage,23d65cfb,Calgary,Alberta,AB,Canada,CA,51.050112282,-114.085285152,0,,https://www.setlist.fm/setlist/mc4d/2025/calgary-stampede-coca-cola-stage-calgary-ab-canada-53468bf1.html
4b468bf6,2025-07-07,Brandi Cyrus,cac1f99e-3b42-458d-8e6a-d8baadb62fda,"Cyrus, Brandi",,Calgary Stampede Coca Cola Stage,23d65cfb,Calgary,Alberta,AB,Canada,CA,51.050112282,-114.085285152,0,,https://www.setlist.fm/setlist/brandi-cyrus/2025/calgary-stampede-coca-cola-stage-calgary-ab-canada-4b468bf6.html
134515f9,2025-07-07,Adrien Nunez,134213b7-e935-47f7-aa3f-4104cb69a8a9,"Nunez, Adrien",,Cowboys Dance Hall,3bd49850,Calgary,Alberta,AB,Canada,CA,51.050112282,-114.085285152,0,,https://www.setlist.fm/setlist/adrien-nunez/2025/cowboys-dance-hall-calgary-ab-canada-134515f9.html
6b45ce76,2025-07-06,Noeline Hofmann,98e910b6-cfae-4a79-b21f-69508fd4d725,"Hofmann, Noeline",Purple Gas Tour '25,Big Four Roadhouse,53d2e32d,Calgary,Alberta,AB,Canada,CA,51.050112282,-114.085285152,0,,https://www.setlist.fm/setlist/noeline-hofmann/2025/big-four-roadhouse-calgary-ab-canada-6b45ce76.html
53468bfd,2025-07-06,Two Feet,07d0e0b3-dea4-4892-bee7-eaad19d093ec,Two Feet,,Calgary Stampede Coca Cola Stage,23d65cfb,Calgary,Alberta,AB,Canada,CA,51.050112282,-114.085285152,0,,https://www.setlist.fm/setlist/two-feet/2025/calgary-stampede-coca-cola-stage-calgary-ab-canada-53468bfd.html
534507d5,2025-07-06,Mest,5aea663c-7508-4992-bf56-fb0362797187,Mest,Canada 2025,Commonwealth Bar & Stage,2bd484ea,Calgary,Alberta,AB,Canada,CA,51.050112282,-114.085285152,17,Rooftops; Long Days Long Nights; Fuct Up Kid; Hotel Room; Was It Worth It; Opinions; I Melt With You; Barely Hanging On; 2000 Miles; Jaded (These Years); When We Were Young; I'm Gonna Be (500 Miles); Living Dead; Hate You Sober; Drawing Board; Cadillac / Your Love / Take Me Home Tonight / Time Bomb; Until I Met You,https://www.setlist.fm/setlist/mest/2025/commonwealth-bar-and-stage-calgary-ab-canada-534507d5.html
3b452cfc,2025-07-06,MJ Lenderman,4f52595e-652d-4894-95ea-f925234629fc,"Lenderman, MJ",2025 Summer Tour,Big Four Roadhouse,53d2e32d,Calgary,Alberta,AB,Canada,CA,51.050112282,-114.085285152,13,SUV; Rudolph; Toontown; Manning Fireworks; Joker Lips; Wristwatch; On My Knees; Bark at the Moon; I Ate Too Much at the Fair; She's Leaving You; Rip Torn; Hangover Game; Knockin',https://www.setlist.fm/setlist/mj-lenderman/2025/big-four-roadhouse-calgary-ab-canada-3b452cfc.html
3b452ce4,2025-07-06,Midland,e0a60de0-22c3-4e10-ac93-3a385191bbf6,Midland,Get Lucky,Nashville North,1bd711d8,Calgary,Alberta,AB,Canada,CA,51.050112282,-114.085285152,0,,https://www.setlist.fm/setlist/midland/2025/nashville-north-calgary-ab-canada-3b452ce4.html
3b452c44,2025-07-06,Thomas Rhett,bca8bfc0-9d5b-449b-b713-914596f88d56,"Rhett, Thomas",Better In Boots Tour 2025,Cowboys Stampede Tent,2bd2bcce,Calgary,Alberta,AB,Canada,CA,51.050112282,-114.085285152,21,Boots; Make Me Wanna; Look What God Gave Her; Life Changes; Crash and Burn; Sixteen; Gone Country; What's Your Country Song; She Had Me at Heads Carolina; Half of Me; Small Town Girls; Front Porch Junkies / Get Me Some of That / It Goes Like This; Marry Me; Country Again; Somethin’ ’Bout a Woman; Unforgettable; NOTHING ELSE; Beautiful as You; Craving You; After All the Bars Are Closed; Die a Happy Man,https://www.setlist.fm/setlist/thomas-rhett/2025/cowboys-stampede-tent-calgary-ab-canada-3b452c44.html
3b452c38,2025-07-06,Tucker Wetmore,bac63106-16c3-4a31-80a4-d269ec27ab96,"Wetmore, Tucker",,Cowboys Stampede Tent,2bd2bcce,Calgary,Alberta,AB,Canada,CA,51.050112282,-114.085285152,11,"Break First; Silverado Blue; Wine Into Whiskey; When I Ain't Lookin'; Bad Habit; Casino; 3,2,1; What Would You Do?; Bad Luck Looks Good On Me; Wind Up Missin' You; Brunette",https://www.setlist.fm/setlist/tucker-wetmore/2025/cowboys-stampede-tent-calgary-ab-canada-3b452c38.html
3b451498,2025-07-06,Leon Bridges,69d9dfd7-19b7-4a75-8a53-9f733fb5d774,"Bridges, Leon",,Spruce Meadows,6bde8a82,Calgary,Alberta,AB,Canada,CA,51.050112282,-114.085285152,23,When a Man Cries; Panther City; Better Man; Flowers; Laredo; Coming Home; That’s What I Love; Never Satisfied; Mariella; Steam; Ain’t Got Nothing on You; Texas Sun; You Don't Know; Bad Bad News; If It Feels Good (Then It Must Be); Hold On; Can’t Have It All; God Loves Everyone; River; Peaceful Place; Smooth Sailin'; Lisa Sawyer; Beyond,https://www.setlist.fm/setlist/leon-bridges/2025/spruce-meadows-calgary-ab-canada-3b451498.html
3451507,2025-07-06,Roy Woods,f50cee24-a799-45da-b65f-fb0874cd521d,Roy Woods,,Cowboys Dance Hall,3bd49850,Calgary,Alberta,AB,Canada,CA,51.050112282,-114.085285152,0,,https://www.setlist.fm/setlist/roy-woods/2025/cowboys-dance-hall-calgary-ab-canada-3451507.html
3450d2b,2025-07-06,Zedd,56c4b861-0922-4c3a-a9b9-3bfcb00f8274,Zedd,,Badlands Tent,53d193f9,Calgary,Alberta,AB,Canada,CA,51.050112282,-114.085285152,13,Everything in Its Right Place; Can't Feel My Face; I Want You to Know; Thunderstruck; Stay the Night; Where You Are; Old Town Road; Stay; Break Free; Spectrum; The Middle; Beautiful Now; Clarity,https://www.setlist.fm/setlist/zedd/2025/badlands-tent-calgary-ab-canada-3450d2b.html
335970e1,2025-07-06,Lights,efdbd3b1-2d20-4cea-af46-dffbc1e7daba,Lights,,Calgary Stampede Coca Cola Stage,23d65cfb,Calgary,Alberta,AB,Canada,CA,51.050112282,-114.085285152,15,Damage; Okay Okay; Running With the Boys; White Paper Palm Trees; Siberia; Saviour / Drive My Soul / Second Go; Ghost Girl on First; Batshit; Surface Tension; Speeding; Piranha; Grip; Clingy; Love Me; Alive Again,https://www.setlist.fm/setlist/lights/2025/calgary-stampede-coca-cola-stage-calgary-ab-canada-335970e1.html
33452ce9,2025-07-06,Boy Golden,89169d2b-f18f-4961-b284-98a6481fcd30,Boy Golden,,Big Four Roadhouse,53d2e32d,Calgary,Alberta,AB,Canada,CA,51.050112282,-114.085285152,0,,https://www.setlist.fm/setlist/boy-golden/2025/big-four-roadhouse-calgary-ab-canada-33452ce9.html
33452ccd,2025-07-06,Garrett Gregory,f094df0f-cf3c-4c0d-b966-ff9d97e831e2,Gregory Garrett,,Nashville North,1bd711d8,Calgary,Alberta,AB,Canada,CA,51.050112282,-114.085285152,0,,https://www.setlist.fm/setlist/garrett-gregory/2025/nashville-north-calgary-ab-canada-33452ccd.html
