event_id,event_date,artist_name,artist_mbid,artist_sort_name,tour_name,venue_name,venue_id,city_name,state,state_code,country_name,country_code,lat,lng,song_count,songs,setlist_url
5b5dd77c,2025-05-07,Rival Sons,2aff9c10-2145-4851-a656-898aeb434ad5,Rival Sons,,Place Bell,23d4d04f,Laval,Quebec,QC,Canada,CA,45.5699525280969,-73.6919975280762,9,"The Good, the Bad and the Ugly; Open My Eyes; Tied Up; Too Bad; Pressure and Time; Where I've Been; Electric Man; Do Your Worst; Secret",https://www.setlist.fm/setlist/rival-sons/2025/place-bell-laval-qc-canada-5b5dd77c.html
2b5dd49a,2025-05-07,Bush,93ccd76c-3790-4435-a8bf-02bc26294b93,Bush,Loaded: The Greatest Hits Tour,Place Bell,23d4d04f,Laval,Quebec,QC,Canada,CA,45.5699525280969,-73.6919975280762,18,Everything Zen; Machinehead; Bullet Holes; The Chemicals Between Us; All Things Must Change; Greedy Fly; The Sound of Winter; 60 Ways to Forget People; Letting the Cables Sleep; Swallowed; Heavy Is the Ocean; Flowers on a Grave; Little Things; More Than Machines; Come Together; Glycerine; Comedown; Machinehead,https://www.setlist.fm/setlist/bush/2025/place-bell-laval-qc-canada-2b5dd49a.html
1b51a5e4,2025-05-07,Wheel,4a059eea-f04b-4a49-a705-dd7d15566116,Wheel,,Théâtre Beanfield,3d1f9d7,Montreal,Quebec,QC,Canada,CA,45.5088375,-73.587809,6,Porcelain; Fugue; Empire; Dissipating; Vultures; Wheel,https://www.setlist.fm/setlist/wheel/2025/theatre-beanfield-montreal-qc-canada-1b51a5e4.html
1b47353c,2025-05-07,We Will Rock you,e47f2333-07ab-45ec-80d7-105df5c6198d,We Will Rock you,,Théâtre St-Denis,73d63a8d,Montreal,Quebec,QC,Canada,CA,45.5088375,-73.587809,0,,https://www.setlist.fm/setlist/we-will-rock-you/2025/theatre-st-denis-montreal-qc-canada-1b47353c.html
7b5f4e5c,2025-05-06,Fleshgod Apocalypse,48cb4248-889d-45ed-8462-acb29c002a8d,Fleshgod Apocalypse,Chaos & Carnage 2025,Olympia de Montréal,bd605de,Montreal,Quebec,QC,Canada,CA,45.5088375,-73.587809,8,I Can Never Die; ; Pendulum; The Fool; Bloodclock; Sugar; The Violation; Blue (Da Ba Dee),https://www.setlist.fm/setlist/fleshgod-apocalypse/2025/olympia-de-montreal-montreal-qc-canada-7b5f4e5c.html
7b5f4e54,2025-05-06,Undeath,a449014f-de9a-43fa-b271-786b0af10926,Undeath,Chaos & Carnage 2025,Olympia de Montréal,bd605de,Montreal,Quebec,QC,Canada,CA,45.5088375,-73.587809,0,,https://www.setlist.fm/setlist/undeath/2025/olympia-de-montreal-montreal-qc-canada-7b5f4e54.html
735f4e65,2025-05-06,Dying Fetus,f76167bb-c117-4022-8b6b-54c796edf5c9,Dying Fetus,Chaos & Carnage 2025,Olympia de Montréal,bd605de,Montreal,Quebec,QC,Canada,CA,45.5088375,-73.587809,11,"Praise the Lord (Opium of the Masses); Unbridled Fury; In the Trenches; Wrong One to Fuck With; Compulsion for Cruelty; One Shot, One Kill; Your Treachery Will Die With You; Grotesque Impalement; Subjected to a Beating; Into the Cesspool; Killing on Adrenaline",https://www.setlist.fm/setlist/dying-fetus/2025/olympia-de-montreal-montreal-qc-canada-735f4e65.html
735f4e59,2025-05-06,Cradle of Filth,7e26cbe1-b8f5-4215-af82-e43d5f8ff308,Cradle of Filth,Chaos & Carnage 2025,Olympia de Montréal,bd605de,Montreal,Quebec,QC,Canada,CA,45.5088375,-73.587809,9,To Live Deliciously; Nemesis; She Is a Fire; The Principle of Evil Made Flesh; Malignant Perfection; Cruelty Brought Thee Orchids; Death Magick for Adepts; Her Ghost in the Fog; Blooding the Hounds of Hell,https://www.setlist.fm/setlist/cradle-of-filth/2025/olympia-de-montreal-montreal-qc-canada-735f4e59.html
735f4e4d,2025-05-06,Corpse Pile,a73b4d1d-d6ed-4a14-9aab-f6ab32383859,Corpse Pile,Chaos & Carnage 2025,Olympia de Montréal,bd605de,Montreal,Quebec,QC,Canada,CA,45.5088375,-73.587809,0,,https://www.setlist.fm/setlist/corpse-pile/2025/olympia-de-montreal-montreal-qc-canada-735f4e4d.html
6b5f4e52,2025-05-06,Ne Obliviscaris,75359245-49cf-4991-932f-e078408481f2,Ne Obliviscaris,Chaos & Carnage 2025,Olympia de Montréal,bd605de,Montreal,Quebec,QC,Canada,CA,45.5088375,-73.587809,0,,https://www.setlist.fm/setlist/ne-obliviscaris/2025/olympia-de-montreal-montreal-qc-canada-6b5f4e52.html
6b5f4e4e,2025-05-06,Vomit Forth,2466d2b6-29dd-434b-9ba6-256b70455014,Vomit Forth,Chaos & Carnage 2025,Olympia de Montréal,bd605de,Montreal,Quebec,QC,Canada,CA,45.5088375,-73.587809,0,,https://www.setlist.fm/setlist/vomit-forth/2025/olympia-de-montreal-montreal-qc-canada-6b5f4e4e.html
6b5a7e92,2025-05-06,Steel Panther,f82927e4-b905-4e3b-a82e-5184fbb68b29,Steel Panther,The Northern Exposure Tour,MTELUS,13d291d1,Montreal,Quebec,QC,Canada,CA,45.5088375,-73.587809,11,Eyes of a Panther; It Won't Suck Itself; Asian Hooker; Just Like Tiger Woods; Never Too Late (to Get Some Pussy Tonight); Girl From Oklahoma; 17 Girls in a Row; Party Like Tomorrow Is the End of the World; Community Property; Death to All but Metal; Gloryhole,https://www.setlist.fm/setlist/steel-panther/2025/mtelus-montreal-qc-canada-6b5a7e92.html
635ebe47,2025-05-06,Saint Motel,5c2593bc-1621-4c4d-821b-b7bb6ff213b5,Saint Motel,The Symphony in the Sky Tour,Théâtre Beanfield,3d1f9d7,Montreal,Quebec,QC,Canada,CA,45.5088375,-73.587809,16,Puzzle Pieces; For Elise; Get It at Home; Sisters; Life's a Gas; A Good Song Never Dies; Hold My Place in Heaven; Move; It's All Happening; Fine Wine; Steady Hand; Cold Cold Man; A Bluer Blue; Sweet Talk; Van Horn; My Type,https://www.setlist.fm/setlist/saint-motel/2025/theatre-beanfield-montreal-qc-canada-635ebe47.html
5b5a7b9c,2025-05-06,Kurt Deimer,337310ff-6bb7-43da-b07f-cf63e5f0683c,Kurt Deimer,,MTELUS,13d291d1,Montreal,Quebec,QC,Canada,CA,45.5088375,-73.587809,2,Have a Cigar; Reach for the sky,https://www.setlist.fm/setlist/kurt-deimer/2025/mtelus-montreal-qc-canada-5b5a7b9c.html
53466b0d,2025-05-06,Strawberry Gothcake,64c2c8aa-4e21-4f52-a92a-36f02f28f49c,Strawberry Gothcake,,La Sala Rossa,3d635d3,Montreal,Quebec,QC,Canada,CA,45.5088375,-73.587809,0,,https://www.setlist.fm/setlist/strawberry-gothcake/2025/la-sala-rossa-montreal-qc-canada-53466b0d.html
4358fb6b,2025-05-06,AJJ,5e1dbdb2-87ac-41ff-9960-4a42a872327a,AJJ,Solo Tour 2025,"Bar ""Le Ritz"" P.D.B",43d407c7,Montreal,Quebec,QC,Canada,CA,45.5088375,-73.587809,23,"A Big Day for Grimley; Brave as a Noun; Heartilation; Rejoice; People; People II: The Reckoning; Big Bird; Children of God; Getting Naked, Playing With Guns; Kokopelli Face Tattoo; Linda Ronstadt; Small Red Boy; Normalization Blues; Body Terror Song; Brave as a Noun; The Baby Panda; Candles of Love; Disposable Everything; Video Games; China Before Communisum; ; Beauty and Truth; It's Raining Now",https://www.setlist.fm/setlist/ajj/2025/bar-le-ritz-pdb-montreal-qc-canada-4358fb6b.html
43466b13,2025-05-06,Alice Longyu Gao,a0b6734c-a0fb-4068-b667-06483ad73719,"Gao, Alice Longyu",The Debut Trilogy Tour,La Sala Rossa,3d635d3,Montreal,Quebec,QC,Canada,CA,45.5088375,-73.587809,18,"<3 Korean Girls; crush; Kanpai; Message Received; 100 Boyfriends; Detective Alice; Clingy; (Intro) Let’s Hope Heteros Fail, Learn and Retire; MAKE U 3 ME; Hëłlœ Kįttÿ; Little Piggy; LEGEND - Alg Mix; Come 2 Brazil; Bird W/O Nest; yAPPER; Message 2 My Ladies; To My White Boy Princess...; Lesbians <3",https://www.setlist.fm/setlist/alice-longyu-gao/2025/la-sala-rossa-montreal-qc-canada-43466b13.html
3b46643c,2025-05-06,Stolen Gin,f8a32de3-3f3a-4832-955e-236987c1876c,"Gin, Stolen",,Théâtre Beanfield,3d1f9d7,Montreal,Quebec,QC,Canada,CA,45.5088375,-73.587809,0,,https://www.setlist.fm/setlist/stolen-gin/2025/theatre-beanfield-montreal-qc-canada-3b46643c.html
135a792d,2025-05-06,Buckcherry,822e92ef-72ea-42e0-9af1-b987816b487a,Buckcherry,The Northern Exposure Tour,MTELUS,13d291d1,Montreal,Quebec,QC,Canada,CA,45.5088375,-73.587809,10,Roar Like Thunder; Lit Up; So Hott; Ridin'; Come On; Gluttony; Sorry; Say Fuck It; Summer of '69; Crazy Bitch / Sex Machine / Bad Girls / Irresistible Bitch / Proud Mary,https://www.setlist.fm/setlist/buckcherry/2025/mtelus-montreal-qc-canada-135a792d.html
735a7e61,2025-05-05,Atheist,424f2349-f719-46c0-ab39-abbb4364d95f,Atheist,Shred Fest,Théâtre Fairmount,5bd4439c,Montreal,Quebec,QC,Canada,CA,45.5088375,-73.587809,10,No Truth; On They Slay; Unholy War; Unquestionable Presence; Brains / Enthralled in Essence / Your Life's Retribution; Water; Room With a View; I Deny; Mother Man; Piece of Time,https://www.setlist.fm/setlist/atheist/2025/theatre-fairmount-montreal-qc-canada-735a7e61.html
73467a75,2025-05-05,Headpins,829a1440-01c7-46f5-a3e6-6231e4b92d6b,Headpins,,Place Bell,23d4d04f,Laval,Quebec,QC,Canada,CA,45.5699525280969,-73.6919975280762,3,Just One More Time; Don't It Make Ya Feel; Turn It Loud,https://www.setlist.fm/setlist/headpins/2025/place-bell-laval-qc-canada-73467a75.html
73461ac9,2025-05-05,Origin,ec81be28-4c2c-4711-b8fb-c4c94e5bf112,Origin,Shred Fest,Théâtre Fairmount,5bd4439c,Montreal,Quebec,QC,Canada,CA,45.5088375,-73.587809,0,,https://www.setlist.fm/setlist/origin/2025/theatre-fairmount-montreal-qc-canada-73461ac9.html
6b461ad6,2025-05-05,Obscura,f002e30d-401c-44b1-82e0-d6796870594d,Obscura,Shred Fest,Théâtre Fairmount,5bd4439c,Montreal,Quebec,QC,Canada,CA,45.5088375,-73.587809,11,Forsaken; Silver Linings; Evenfall; Emergent Evolution; Devoured Usurper; Akróasis; The Sun Eater; The Anticosmic Overload; A Valediction; When Stars Collide; Septuagint,https://www.setlist.fm/setlist/obscura/2025/theatre-fairmount-montreal-qc-canada-6b461ad6.html
63467a77,2025-05-05,April Wine,78761837-4b00-4935-b7be-601697900e66,April Wine,Back In Overdrive,Place Bell,23d4d04f,Laval,Quebec,QC,Canada,CA,45.5699525280969,-73.6919975280762,10,Oowatanite; You Could've Been a Lady; Say Hello; I Like to Rock; Before the Dawn; Enough Is Enough; Just Between You and Me; Sign of the Gypsy Queen; Bad Side of the Moon; Roller,https://www.setlist.fm/setlist/april-wine/2025/place-bell-laval-qc-canada-63467a77.html
53467345,2025-05-05,Decrepit Birth,4bde96f1-3813-4169-afd1-949f06feb890,Decrepit Birth,Shred Fest,Théâtre Fairmount,5bd4439c,Montreal,Quebec,QC,Canada,CA,45.5088375,-73.587809,0,,https://www.setlist.fm/setlist/decrepit-birth/2025/theatre-fairmount-montreal-qc-canada-53467345.html
53467341,2025-05-05,Fractal Universe,0ac72b79-5511-447f-bd5e-e5caa92974f9,Fractal Universe,Shread Fest,Théâtre Fairmount,5bd4439c,Montreal,Quebec,QC,Canada,CA,45.5088375,-73.587809,0,,https://www.setlist.fm/setlist/fractal-universe/2025/theatre-fairmount-montreal-qc-canada-53467341.html
435cbfdb,2025-05-05,Tech N9ne,dde3d9b1-0e44-48bc-b0c9-d739b3570000,Tech N9ne,Hollywood & N9ne Returns,Olympia de Montréal,bd605de,Montreal,Quebec,QC,Canada,CA,45.5088375,-73.587809,0,,https://www.setlist.fm/setlist/tech-n9ne/2025/olympia-de-montreal-montreal-qc-canada-435cbfdb.html
3b4690c8,2025-05-05,Thomas LaRosa,64c1e219-dd5e-435f-99d8-0590e1df996c,"LaRosa, Thomas",,Le Studio TD,2bd00812,Montreal,Quebec,QC,Canada,CA,45.5088375,-73.587809,0,,https://www.setlist.fm/setlist/thomas-larosa/2025/le-studio-td-montreal-qc-canada-3b4690c8.html
335cb8f1,2025-05-05,Hollywood Undead,321fdfbb-426b-43f7-8295-fa9aca6348d9,Hollywood Undead,Hollywood & N9ne Returns,Olympia de Montréal,bd605de,Montreal,Quebec,QC,Canada,CA,45.5088375,-73.587809,0,,https://www.setlist.fm/setlist/hollywood-undead/2025/olympia-de-montreal-montreal-qc-canada-335cb8f1.html
2b5cb8b2,2025-05-05,Zero 9:36,dd2172f4-5404-4e62-9dce-0f94dbec8675,Zero 9:36,,Olympia de Montréal,bd605de,Montreal,Quebec,QC,Canada,CA,45.5088375,-73.587809,0,,https://www.setlist.fm/setlist/zero-936/2025/olympia-de-montreal-montreal-qc-canada-2b5cb8b2.html
2b4690ea,2025-05-05,Mercer Henderson,7062683d-df79-4b48-a820-ccc27da43401,"Henderson, Mercer",,Le Studio TD,2bd00812,Montreal,Quebec,QC,Canada,CA,45.5088375,-73.587809,0,,https://www.setlist.fm/setlist/mercer-henderson/2025/le-studio-td-montreal-qc-canada-2b4690ea.html
235cb8b3,2025-05-05,Set It Off,823ed9ad-3412-47dc-9caf-b7be02121fcf,Set It Off,,Olympia de Montréal,bd605de,Montreal,Quebec,QC,Canada,CA,45.5088375,-73.587809,0,,https://www.setlist.fm/setlist/set-it-off/2025/olympia-de-montreal-montreal-qc-canada-235cb8b3.html
23469077,2025-05-05,Isabel LaRosa,fa22eeda-8db9-4ae5-97c9-6d0b9ceb7cf3,"LaRosa, Isabel",Psychopomp Tour,Le Studio TD,2bd00812,Montreal,Quebec,QC,Canada,CA,45.5088375,-73.587809,0,,https://www.setlist.fm/setlist/isabel-larosa/2025/le-studio-td-montreal-qc-canada-23469077.html
13517169,2025-05-05,Bachman–Turner Overdrive,7a3b3f80-04b8-4968-b432-fbcd3f350716,Bachman–Turner Overdrive,Back in Overdrive,Place Bell,23d4d04f,Laval,Quebec,QC,Canada,CA,45.5699525280969,-73.6919975280762,20,"Take It Like a Man; Gimme Your Money Please; Rock Is My Life, and This Is My Song; Not Fragile; Blue Collar; Four Wheel Drive; These Eyes; Laughing; Undun; No Sugar Tonight; No Time; Lookin' Out for #1; Stayed Awake All Night; American Woman; She's So High; Let It Ride; You Ain't Seen Nothing Yet; Roll On Down the Highway; Hey You / All Right Now / Rock'n Me / You Shook Me All Night Long / Honky Tonk Women / Get It On (Bang a Gong) / (I Can't Get No) Satisfaction  / Old Time Rock and Roll / Hey You (reprisal); Takin' Care of Business",https://www.setlist.fm/setlist/bachmanturner-overdrive/2025/place-bell-laval-qc-canada-13517169.html
6b5ac2e2,2025-05-04,The Birthday Massacre,83d8a06a-4145-444a-b4ae-49e1e986206f,"Birthday Massacre, The",Live 2025 USA & Canada,Les Foufounes Électriques,53d6d3f5,Montreal,Quebec,QC,Canada,CA,45.5088375,-73.587809,0,,https://www.setlist.fm/setlist/the-birthday-massacre/2025/les-foufounes-electriques-montreal-qc-canada-6b5ac2e2.html
6b5ac28e,2025-05-04,Magic Wands,ef307507-d445-4c46-8b92-a52c5a602fdc,Magic Wands,,Les Foufounes Électriques,53d6d3f5,Montreal,Quebec,QC,Canada,CA,45.5088375,-73.587809,0,,https://www.setlist.fm/setlist/magic-wands/2025/les-foufounes-electriques-montreal-qc-canada-6b5ac28e.html
6b5aa66e,2025-05-04,Silent Planet,c62afc98-8596-4532-a1dd-bc1a595c927e,Silent Planet,The Bloom In Heaven Tour,Théâtre Beanfield,3d1f9d7,Montreal,Quebec,QC,Canada,CA,45.5088375,-73.587809,15,Offworlder; Collider; Panopticon; Euphoria; Dreamwalker; Antimatter; Return to One; Panic Room; :Signal:; Anunnaki; Mindframe; Interstellar; The Overgrowth; SUPERBLOOM; Trilogy,https://www.setlist.fm/setlist/silent-planet/2025/theatre-beanfield-montreal-qc-canada-6b5aa66e.html
6b5aa632,2025-05-04,Invent Animate,af3fd27c-c59f-4eb7-9303-042ee3eef006,Invent Animate,The Bloom In Heaven Tour,Théâtre Beanfield,3d1f9d7,Montreal,Quebec,QC,Canada,CA,45.5088375,-73.587809,13,False Meridian; Shade Astray; Absence Persistent; Labyrinthine; Void Surfacing; All The Light Is Gone; Purity Weeps; Emberglow; Elysium; Reverie; Heavener; Without a Whisper; Immolation of Night,https://www.setlist.fm/setlist/invent-animate/2025/theatre-beanfield-montreal-qc-canada-6b5aa632.html
635ac28f,2025-05-04,Essenger,12aeaf26-5dcf-451b-af8d-999b3755c731,Essenger,Live 2025 Tour,Les Foufounes Électriques,53d6d3f5,Montreal,Quebec,QC,Canada,CA,45.5088375,-73.587809,2,Empire of Steel; OVER & OVER,https://www.setlist.fm/setlist/essenger/2025/les-foufounes-electriques-montreal-qc-canada-635ac28f.html
5b46773c,2025-05-04,L.A. Witch,38e89263-3d3c-4ccb-ae29-9c31dcff0777,L.A. Witch,DOGGOD,"Bar ""Le Ritz"" P.D.B",43d407c7,Montreal,Quebec,QC,Canada,CA,45.5088375,-73.587809,10,Kill My Baby Tonight; Drive Your Car; Baby in Blue Jeans; You Love Nothing; Eyes of Love; SOS; I Hunt You Prey; Brian; DOGGOD; Kiss Me Deep,https://www.setlist.fm/setlist/la-witch/2025/bar-le-ritz-pdb-montreal-qc-canada-5b46773c.html
5359a3a1,2025-05-04,156/Silence,c4a3dc14-e745-4ca8-af27-e89ff19232d3,156/Silence,The Bloom in Heaven Tour,Théâtre Beanfield,3d1f9d7,Montreal,Quebec,QC,Canada,CA,45.5088375,-73.587809,7,High Dive in a Low Well; Product Placement; If Pleasure's Gone; Wants I Need; Blood Loss; Better Written Villain; Character Development (Cold Start),https://www.setlist.fm/setlist/156silence/2025/theatre-beanfield-montreal-qc-canada-5359a3a1.html
435aa7af,2025-05-04,Allt,bd25b4a6-09ee-4c88-96f3-04464e36c2e5,Allt,The Bloom in Heaven Tour,Théâtre Beanfield,3d1f9d7,Montreal,Quebec,QC,Canada,CA,45.5088375,-73.587809,7,A Flash of Light; Remnant; Aquila; Memory of Light; Echoes; The Orphan Breed; Emanate,https://www.setlist.fm/setlist/allt/2025/theatre-beanfield-montreal-qc-canada-435aa7af.html
3b4674ec,2025-05-04,La Zarra,893d79f2-b0f7-496c-9712-a58b6cf98572,"Zarra, La",,La Tohu,bd3e5fa,Montreal,Quebec,QC,Canada,CA,45.5088375,-73.587809,1,Évidemment,https://www.setlist.fm/setlist/la-zarra/2025/la-tohu-montreal-qc-canada-3b4674ec.html
335b68b1,2025-05-04,SUUNS,f2394946-07cc-4af7-8d77-58fea451dd59,SUUNS,,Les Foufounes Électriques,53d6d3f5,Montreal,Quebec,QC,Canada,CA,45.5088375,-73.587809,0,,https://www.setlist.fm/setlist/suuns/2025/les-foufounes-electriques-montreal-qc-canada-335b68b1.html
63462acf,2025-05-03,Pierre Lapointe,0e1b80ef-5c60-403e-a337-836f86db584b,"Lapointe, Pierre",Chansons démodées pour ceux qui ont le cœur abimé,Centre Marcel-Dulude,1bd55db0,Saint-Bruno-de-Montarville,Quebec,QC,Canada,CA,45.53341,-73.34916,0,,https://www.setlist.fm/setlist/pierre-lapointe/2025/centre-marcel-dulude-saint-bruno-de-montarville-qc-canada-63462acf.html
5b5ddbd8,2025-05-03,Kelsey Hart,d689966d-2cd2-4d7c-a0f6-119c09f885ef,Kelsey Hart,,Le Studio TD,2bd00812,Montreal,Quebec,QC,Canada,CA,45.5088375,-73.587809,9,Burn My Summer; Put It On The Map; Gone With The Wind; 4x4; Crazy 'bout You; Pickup Man / Should've Been a Cowboy / Ol' Red; Life With You; I Went to the Bar; Country in Business,https://www.setlist.fm/setlist/kelsey-hart/2025/le-studio-td-montreal-qc-canada-5b5ddbd8.html
5b5b6f34,2025-05-03,Beguiler,1d470aef-229d-403a-a72d-ef5bacb8f1e4,Beguiler,The Subservient Bloodletting Tour,Piranha Bar,13d78911,Montreal,Quebec,QC,Canada,CA,45.5088375,-73.587809,0,,https://www.setlist.fm/setlist/beguiler/2025/piranha-bar-montreal-qc-canada-5b5b6f34.html
5353f381,2025-05-03,August Burns Red,5bac9b4f-2f1c-4d39-8d11-231d5b6650ce,August Burns Red,,Place Bell,23d4d04f,Laval,Quebec,QC,Canada,CA,45.5699525280969,-73.6919975280762,9,Chop Suey!; Paramount; Composure; Defender; Bloodletter; Vengeance; Exhumed; Marianas Trench; White Washed,https://www.setlist.fm/setlist/august-burns-red/2025/place-bell-laval-qc-canada-5353f381.html
53461ff5,2025-05-03,Sol Hess,bcf1deb8-bc71-4645-a90a-f2d482c4a612,"Hess, Sol",Québec Tour 2025,Le Palais Ontario,43de3793,Montreal,Quebec,QC,Canada,CA,45.5088375,-73.587809,13,"Street Lights; Ants in the Leaves; City Ghosts; (The World Is Crazy If It Isn't) Crazy About You; Lover Boy; My Body Knows; Somersaults, Dandelions, the Wind; My Stone Lion; Poor Christopher; The Summer Air Was Filled With Fright; This Sorrowful Tune; The Starlight, The Moonlight, My Dear; Moths",https://www.setlist.fm/setlist/sol-hess/2025/le-palais-ontario-montreal-qc-canada-53461ff5.html
4b53f382,2025-05-03,Bullet for My Valentine,d530dbf9-69b1-404f-98f2-0431104f5a1e,Bullet for My Valentine,The Poisoned Ascendancy Tour,Place Bell,23d4d04f,Laval,Quebec,QC,Canada,CA,45.5699525280969,-73.6919975280762,16,"""The Poison"" Intro; Her Voice Resides; 4 Words (to Choke Upon); Tears Don't Fall; Suffocating Under Words of Sorrow (What Can I Do); Hit the Floor; All These Things I Hate (Revolve Around Me); Hand of Blood; Room 409; The Poison; 10 Years Today; Cries in Vain; The End; Knives; Waking the Demon; Walk",https://www.setlist.fm/setlist/bullet-for-my-valentine/2025/place-bell-laval-qc-canada-4b53f382.html
435ddbdb,2025-05-03,Restless Road,dc9fc068-72df-4f39-9329-bea481871900,Restless Road,Goin' Out Like That Tour,Le Studio TD,2bd00812,Montreal,Quebec,QC,Canada,CA,45.5088375,-73.587809,19,"Head Over Heels; Goin' Out Like That; Sundown Somewhere; Done It By Now; Tell Me Not To; Work On Me; Take Me Home; Headlights; 10 Things; Dixieland Delight / She Thinks My Tractor's Sexy / Love Story / Kiss a Girl / I Like It, I Love It; Hometown Tonight; Go Get Her; Roll Tide Roll; Bar Friends; I Don't Wanna Be That Guy; No Can Do; Friends in Low Places; Growing Old With You; Last Rodeo",https://www.setlist.fm/setlist/restless-road/2025/le-studio-td-montreal-qc-canada-435ddbdb.html
435b6f0f,2025-05-03,Art of Attrition,02f3b623-333f-483c-9104-ebc52a1edfee,Art of Attrition,The Subservient Bloodletting Tour,Piranha Bar,13d78911,Montreal,Quebec,QC,Canada,CA,45.5088375,-73.587809,0,,https://www.setlist.fm/setlist/art-of-attrition/2025/piranha-bar-montreal-qc-canada-435b6f0f.html
4353f383,2025-05-03,Trivium,1f5ff245-2837-4d4a-a609-e93e544478c3,Trivium,The Poisoned Ascendancy Tour,Place Bell,23d4d04f,Laval,Quebec,QC,Canada,CA,45.5699525280969,-73.6919975280762,16,Hit the Lights; The End of Everything; Rain; Pull Harder on the Strings of Your Martyr; Drowned and Torn Asunder; Ascendancy; A Gunshot to the Head of Trepidation; Like Light to the Flies; Dying in Your Arms; The Deceived; Suffocating Sight; Departure; Declaration; Capsizing the Sea; In Waves; Heaven and Hell,https://www.setlist.fm/setlist/trivium/2025/place-bell-laval-qc-canada-4353f383.html
43461ff7,2025-05-03,Sol Hess,bcf1deb8-bc71-4645-a90a-f2d482c4a612,"Hess, Sol",Québec Tour 2025,Le Vacarme,53d32795,Montreal,Quebec,QC,Canada,CA,45.5088375,-73.587809,7,"Street Lights; City Ghosts; (The World Is Crazy If It Isn't) Crazy About You; Lover Boy; Poor Christopher; The Starlight, The Moonlight, My Dear; Moths",https://www.setlist.fm/setlist/sol-hess/2025/le-vacarme-montreal-qc-canada-43461ff7.html
3b46b06c,2025-05-03,Pouya,cae09884-f473-460a-a04a-4dd3fc69cf6e,Pouya,THEY COULD NEVER MAKE ME,Club Soda,6bd6c6ca,Montreal,Quebec,QC,Canada,CA,45.5088375,-73.587809,0,,https://www.setlist.fm/setlist/pouya/2025/club-soda-montreal-qc-canada-3b46b06c.html
3346b061,2025-05-03,Kxllswxtch,7d577034-18d3-4066-85c7-157d3bcce6b5,Kxllswxtch,,Club Soda,6bd6c6ca,Montreal,Quebec,QC,Canada,CA,45.5088375,-73.587809,0,,https://www.setlist.fm/setlist/kxllswxtch/2025/club-soda-montreal-qc-canada-3346b061.html
23530887,2025-05-03,Bleed From Within,385d80ab-cf87-46ed-b4c9-3ea8942993ef,Bleed From Within,The Zenith Tour,Place Bell,23d4d04f,Laval,Quebec,QC,Canada,CA,45.5699525280969,-73.6919975280762,5,God Complex; Levitate; I Am Damnation; The End of All We Know; In Place of Your Halo,https://www.setlist.fm/setlist/bleed-from-within/2025/place-bell-laval-qc-canada-23530887.html
b59052a,2025-05-02,Rebecca Black,312c7cc1-9b5c-4406-963b-9f73f50674c0,"Black, Rebecca",SALVATION,MTELUS,13d291d1,Montreal,Quebec,QC,Canada,CA,45.5088375,-73.587809,1,Friday,https://www.setlist.fm/setlist/rebecca-black/2025/mtelus-montreal-qc-canada-b59052a.html
3b46202c,2025-05-02,Sol Hess,bcf1deb8-bc71-4645-a90a-f2d482c4a612,"Hess, Sol",Québec Tour 2025,Quai des brumes,3d64943,Montreal,Quebec,QC,Canada,CA,45.5088375,-73.587809,11,"Street Lights; Ants in the Leaves; City Ghosts; (The World Is Crazy If It Isn't) Crazy About You; Lover Boy; My Body Knows; Somersaults, Dandelions, the Wind; My Stone Lion; Poor Christopher; The Starlight, The Moonlight, My Dear; Moths",https://www.setlist.fm/setlist/sol-hess/2025/quai-des-brumes-montreal-qc-canada-3b46202c.html
2b47f86a,2025-05-02,ACTORS,230f2c85-8b1c-4e88-ab5d-0d015a4bbe16,ACTORS,,"Bar ""Le Ritz"" P.D.B",43d407c7,Montreal,Quebec,QC,Canada,CA,45.5088375,-73.587809,17,L'appel Du Vide; Slaves; Dead Inside; In Real Life; Object of Desire; Love U More; Like Suicide; Only Lonely; Killing Time (Is Over); Strangers; Crystal; Bury Me; We Don't Have to Dance; PTL (Post Traumatic Love); How Deep is the Hole; Face Meets Glass; Cold Eyes,https://www.setlist.fm/setlist/actors/2025/bar-le-ritz-pdb-montreal-qc-canada-2b47f86a.html
634632af,2025-05-01,Klô Pelgag,b31a4002-33b4-4f4e-ac16-249c45fb0178,"Pelgag, Klô",Abracadabra,MTELUS,13d291d1,Montreal,Quebec,QC,Canada,CA,45.5088375,-73.587809,20,Le sang des fruits rouges; Pythagore; Libre; Coupable; À l'ombre des cyprès; Les instants d'équilibre; Lettre à une jeune poète; Sans visage; Le goût des mangues; Les puits de lumière; Jim Morrison; Décembre; Deux jours et deux nuits; Mélamine; Umami; La Maison jaune; Rémora; Les animaux; Les ferrofluides-fleurs; Comme des rames,https://www.setlist.fm/setlist/klo-pelgag/2025/mtelus-montreal-qc-canada-634632af.html
53462bc1,2025-05-01,Angine de Poitrine,5fd29907-c3c5-4b1d-a799-7cf9bbd288fc,Angine de Poitrine,,MTELUS,13d291d1,Montreal,Quebec,QC,Canada,CA,45.5088375,-73.587809,0,,https://www.setlist.fm/setlist/angine-de-poitrine/2025/mtelus-montreal-qc-canada-53462bc1.html
33462011,2025-05-01,[:SITD:],bb1c0a99-6abe-4675-ada5-601da83a926f,SITD,,"Bar ""Le Ritz"" P.D.B",43d407c7,Montreal,Quebec,QC,Canada,CA,45.5088375,-73.587809,0,,https://www.setlist.fm/setlist/sitd/2025/bar-le-ritz-pdb-montreal-qc-canada-33462011.html
134621fd,2025-05-01,Saya Gray,b949a783-214b-429d-a184-4e75c0f8be9c,"Gray, Saya",,Le National,3bd634c0,Montreal,Quebec,QC,Canada,CA,45.5088375,-73.587809,18,"Intro; PUDDLE ( OF ME ); ..THUS IS WHY ( I DON’T SPRING 4 LOVE ); SHELL ( OF A MAN ); SADNESS RESIDUE (ERASER ROOM); LINE BACK 22; SHALLOW (PPL SWIM IN SHALLOW WATER); PAP TEST; DIZZY PPL BECOME BLURRY; AA BOUQUET FOR YOUR 180 FACE; ANNIE, PICK A FLOWER.. (MY HOUSE); 10 WAYS ( TO LOSE A CROWN ); H.B.W; PREYING MANTIS !; IF THERE’S NO SEAT IN THE SKY (WILL YOU FORGIVE ME???); LIE DOWN..; HOW LONG CAN YOU KEEP UP A LIE?; EXHAUST THE TOPIC",https://www.setlist.fm/setlist/saya-gray/2025/le-national-montreal-qc-canada-134621fd.html
63462637,2025-04-30,Fabio Frizzi,21dc853f-9d63-40d9-b90c-781e9138618c,"Frizzi, Fabio",,Théâtre Fairmount,5bd4439c,Montreal,Quebec,QC,Canada,CA,45.5088375,-73.587809,0,,https://www.setlist.fm/setlist/fabio-frizzi/2025/theatre-fairmount-montreal-qc-canada-63462637.html
